Sophomore,4,"The campus and people are amazing. Many of the professors are kind and helpful. Depending on how you learn best, however, a few professor can be hard to learn from. There is a great tutoring center that can help you if that seems to become an issue."
Sophomore,4,"I have had a great experience so far here at EKU. The classes and professors are great. There are many different food options available on campus. There are also many different people that are here on campus to support you and can help you, even if you just need to talk to someone. Not only are facilities great, but the campus is beautiful too."
Senior,4,I have thoroughly enjoyed my time at EKU. The professors are extremely hospitable and work with you to help you achieve your goals. It is a bigger campus with a small feel. You can't walk across campus without seeing someone you know!
Junior,4,My first two years at Eastern Kentucky university were great! They are doing a good job at giving students a better dining hall as well as new dorms.
Sophomore,4,EKU is very homey and accommodating. The tutoring centers and the colonels cupboard have been especially helpful.
Junior,4,"The college is a very nice place to relax and meet new friends. I feel safe, and the food is not too bad. The best thing is I have thoroughly enjoyed all of my professors so far."
Sophomore,4,I feel like the only main issue is that there isnt enough communication with students in financial need
Junior,4,"I love attending Eastern Kentucky University. EKU lives up to its nickname ""campus beautiful"" through the use of preserving nature as well as a no littering policy which the students uphold. The staff is mostly positive and campus live is thriving. It is also a good size as it is not too big to get across campus in time but also not overly crowded."
Sophomore,4,"I love being a student here at Eastern Kentucky University. It is very easy to find a home in whatever it is that you choose to do. From Greek Life to sports to being apart of a club, anyone can find an interest in something to do on campus. The food is not always the best but they have a lot of stores on-campus such as Chik-Fil-A, Subway, and Steak and Shake to fulfill your food needs. Overall it is a very nice, clean, friendly, and safe school to be at."
Sophomore,4,"Since Richmond, KY is my hometown I definitely have a biased view when it comes to this school and going in I thought I would hate it. However, I was proven wrong by the beautiful scenery and wonderful people."
Senior,4,I am transferring into this school in order to complete my degree and so far I have had a pretty good experience with most of the individuals whom I have come into contact with.  I am looking to interact with more individuals soon in order to hopefully be able to give a better score for their ratings.
Junior,4,"I like the atmosphere of the college. Its very welcoming and unlike other colleges, there is no a city in the middle of it. It is also very spread out compared to other colleges."
Freshman,4,I like the campus and the people. Some of the professors are rude and not understanding. The environment is nice and working on campus is enjoyable.
Freshman,4,One of the things I enjoy most about Eastern Kentucky University is the campus scene and how friendly the staff is.
Niche User,4,"My experience at EKU was amazing. Professors are wonderful and are so caring about the students, the resources the campus has to make sure students are able to strive and be better."
Freshman,4,"Eastern Kentucky University is an amazing university,  all of my professors have been down to earth people that understand that students have lives outside of school"
Freshman,4,"Eastern is a good sized school for most. It is very small when compared to UK, but this may also be a good thing. At Eastern, you are not treated like another number. Experience from both the Richmond and regional campus provided all that one might need. The campus give an inviting experience. Like all communities, nothing is simply handed to you. For the students who do not like it here, they fail to branch out and make friends. College is most definitely what you make it. There are activities all the time, a great gym, numerous intramural activities, various eating options on and off campus. The location of Richmond is good. If one wishes, a short trip to Lexington would be a connivence. You can make the most out of Richmond while also experiencing life in Lexington. This is a good school, good people. The professors truly care about you and your well being. Although they aren't perfect, they continue to improve with each year."
Senior,4,"I very much love going to school here! the college campus has so many resources for students and also have an amazing environment that is very welcoming. There are many clubs and activities available for students to get to know each other and make friends. The only issue with this college, like many, is the constant unnecessary construction and rising in fees."
Junior,4,Eastern Kentucky is a great community. Everyone is nice and eager to help you on your journey. The professors care about your learning and will do anything to help you.
Senior,4,"I really enjoyed my time here, it's a calm campus. They have great professors and I've had great memories here."
Junior,4,I attended EKU over 10 years ago and I am now enrolled in their online program.  I am a full time working mother of two and their online program is the only way I can finish my degree.  I am thankful this is an option for me at this point in my life and career.
Sophomore,4,"I love EKU.  life and opportunity.  I love the Music department, and the friendships I have made.  I do think the dorms need work.  My degree program is flexible.  I enjoy the classes that are small enough to have professor contact as well as the opportunity to have lessons."
Freshman,4,"Eastern Kentucky University has a variety of great programs, some of which are at the top of their rankings (such as in the state, region, or nation.) I have also made such good friends here and I am still in my first year of attending college."
Sophomore,4,"I enjoy the safety protocols on the campus, sometimes we have people who come through and like to make the campus feel unsafe but we have a pretty adequate safety system all around the campus."
Graduate Student,4,Overall it is a good college. If you know where to look it is easy to find good opportunities to invest in your future career as well as figure out what it is that you want to do with your life. I have had many chances to be involved and have made friends that will last a lifetime.
Freshman,4,"I'm very excited to return to EKU to finish up my freshman year of college. The experience of going here has been very fun and interesting, as there is always something happening on campus for students to participate in. The only complaint I have is the on-campus dining options, which are pretty limited."
Sophomore,4,This is probably one of the best school I have attended (I have been attended 3 different online schools). I can't recommend it enough. The only downfalls I have noticed are tuition seemed a little more than I expected (but still very affordable) and my advisor can be difficult to reach when needed. Those are the only reasons I did not give five stars.
Freshman,4,"This University is amazing, people are great, professors are good if you choose the right ones. The campus is absolutely beautiful and everything is good distance between each other. Some things i wish would change is the parking for anyone, and the job opportunities, its so hard to get a job on campus."
Sophomore,4,I like the size of EKU and its relatively  close to my home so it makes it a lot easier being away from home the majority of the year . They also have a good tutoring center that helps tremendously .
Junior,4,Many professors are willing to help students. The campus has a very family-like atmosphere. It is very easy to make friends and feel welcomed.
Sophomore,4,The people are friendly and they have a great education program. The campus is beautiful and it is easy to find your way around. There are a few professors that are not to my liking but most are. Downstairs case is a plus. I love the Chic-fil-a.
Senior,2,"I decided to attend this university because it was the cheapest option for me, but over the years they have increased tuition and cut several beloved programs in order to pay for unnecessary buildings and equipment that they don't need. For example, they tore down many historic buildings to build luxurious dorms, cafeterias, and REC centers while the Wallace Building, which houses the mathematics department, has mold and filthy, old bathrooms. The school has turned into one giant construction zone with so many obstacles and detours you must take to go to get across campus. Not to mention, the lab school has mold and old equipment despite the university announcing they would be building a new school.  Most professors have a negative attitude. This school charges so much money for unnecessary items. You have to purchase a meal plan and pay fees for campus recreation even if you live off campus as I do. Overall, I would only recommend attending this school if it is your only option."
Senior,2,"The advisers do not point on prospective certifications within the field of degree. For instance, Psychology has a criminal justice certificate, a child-rearing and counselor certificate; and  EES coursework in the criminal justice for mainframe leadership certification.

The teachers require constant supervision for grading, they all exaggerate their impeccable writing skills .

Several teachers sabbatoged the experience under stature by requiring all submitted assignments to be uploaded to another software, out of sorts. SafeAssign and the link not listed within Blackboard.
Financial aid office and TITLE IV  do not qualify for  sympathetic withdrawal into refunds--  be alert of fiscal inept.  Yield categorizing folders within school emails.  And more importantly, create an outline for success; volunteering and  blogs for vitae. Have the degree works impromptu.
Take the long way in the degree desiring, be your own profession."
Sophomore,2,"Eastern Kentucky University is not too bad of a place to attend for classes. All the classes are close together, the meal plans and flex makes sure you're fed, there are plenty of organizations to join, and there are plenty of places around the area for coffee. I would like to see the college focus more on academics and putting the money where it belongs as well as making the university more affordable and more successful for students."
College Freshman,2,EKU does not really have very much school spirit when it comes to athletics.
College Freshman,2,They think they're the best of the best
College Sophomore,2,Hosing it awful to deal with and keeps getting higher in price
College Freshman,2,"There are two nice dormitory/ apartment style living on campus avialable to upperclass men.  The older, dated dorms are old and cramped"
College Freshman,2,"There are not houses, only two dorm towers (one for fraternities and one for sororities). They pretty much go unnoticed, not even their parties are a big deal because everyone throws parties. Unless you're involved in Greek life, nobody really cares about them."
College Sophomore,2,"It's close enough to home that I can commute to save money, but if I had known that my room mate here would try to commit suicide then the second would be abusive, I would never have chosen EKU. Also the dorms are super gross. They had bed bugs, cockroaches, and everything was pretty much broken."
College Freshman,2,I would much rather be allowed to have someone over anytime during the week and they be able to stay. We're choosing our career dor the rest of our lives but we're not allowed to have someone stay with us during the week. Dorm rooms getting lonely sometimes. Other than that most people are rather easy going.
College Senior,2,Not alot of scholarships for minorities to choose from
College Sophomore,2,"We have one main dining building, with an upstairs and downstairs section. The upstairs is a cafeteria set-up. The food is cheaply made, low quality choices. The downstairs section has 5 fast food options, they are slow paced and extremely overpriced and under-stocked."
College Sophomore,2,"Demanding, extremely competative, hard to get into, top in the country"
College Sophomore,2,"Professors: lazy, not eager to help, no interest in collaboration

Curriculum: very contradictory, much too strict

Workload: difficult"
College Sophomore,2,"Living on campus is a struggle. There s only one dorm situated in the center of campus. The rooms in the dorms are not good sized, and social cleanliness is a ongoing issue."
College Sophomore,2,"Currently I am an OT major, however due to the extreme conditions to get accepted into the program, I will be changing my major. To even be considered into the OT program at EKU, you must have a minimum of a 3.5 cumulative GPA."
College Freshman,2,"The food that is offered is usually meat with few vegetarian options, If you want something healthy you have the option of a salad or fruit. Everything is usually frozen and for the poor quality the food should not cost so much."
College Sophomore,2,"Greek life here is only about drinking and parties. I am not involved, nor do I want to be."
College Senior,2,"I'm honestly not sure about this because i own a car that i use to get to and from campus. There is a shuttle that runs daily on campus to take students where they need to go, but it is on campus only!"
College Sophomore,2,"Kentucky weather is like a woman in PMS, trust me, I know from experience. Random weather changes, random storms, an alert system that tells us there's a Thunderstorm Warning DURING a thunderstorm. It's an adventure, always."
College Sophomore,2,"While I personally have had no interaction with drugs, I know it's a problem when I overhear a girl in the bathroom talking a meth dealer on Powell Corner every Friday night."
College Junior,2,Have to be in a fraternity or sorority
College Sophomore,2,Often difficult to find parking so you must get there early. Permit price has doubled and availabilty decreased. 
College Freshman,2,The food choices in Richmond are not very beneficial.
College Junior,2,I am from Iowa so they don't know how to handle winter weather here.
College Freshman,2,I don't really pay attention to athletic stuff but many people participate in the activities.
College Freshman,2,"There are many parties on campus any night of the week, its just one of those things that you need to know about. The University throws really good parties too."
College Freshman,2,Eastern has one of the best nursing programs there is. The program has high standards set and goes by ranks. The only tip that I have for admission is to maintain high grades and do what you are expected.
College Senior,2,the only time i have felt unsafe is at night 
College Senior,2,MAinly it seems like the freshmen at our school are the ones th at get in trouble for alcohol the most.
College Senior,2,"The athletics are just ""okay"""
College Senior,2,"There are no good options besides the subway which was just built. The quality of the food is not that good, and also the service is not great as well. "
College Senior,2,"Eastern Kentucky is not very up-to-date as other campuses. It also not very convenient for a college student; Richmond, Kentucky could definitely use some expansion. "
College Senior,2,Rooms and showers are very very small. Fun to have friends close though.
College Junior,2,"I am a vegan. There are pretty much only 2 restaurants I go to-- Khin's sushi and Casa Fiesta.

On campus, the food is pretty bad although we do have several options including a cafeteria and food court, two coffe places."
College Junior,2,Their are lots of parking spots but its not always easy to find one. I live on campus and got really lucky that my dorm I right across form the building where most of my classes are. I always walk to classes I don't like driving even if it is a ten minute walk in the snow. Most of the time parking is always in front of your dorm building.
College Sophomore,2,"Greek life is basically joining a club where you pay them to be your friends. You pay a lot of money throughout the year for friendships, invites, and activities. Often, they don't make a difference much."
College Senior,2,"The alcohol and drug scene at Eastern Kentucky is sever. Although, I am a 22 year old student I only see drugs and alcohol used more along my journey through high school and college. I dont use drugs or smoke, though I do drink on occasion. I see drugs being used regularly, but little to no peer pressure."
College Junior,2,"It is hard to get a parking spot at times, I arrive early to class however I don't want to leave and come back knowing it is hard to get a parking spot."
College Sophomore,2,"The dorms are not big enough.  It is so crowded you can barely move.  The  housing process went smoothly and I got the dorm I wanted. I also got theroommate I wanted. The amenities were good.  I had what I needed that was provided. I don't like the cost, especially when it keeps going up"
College Senior,2,Mostly bars.  There really isn't a lot of hang-out spots that stay open late.
College Sophomore,2,"Richmond is known to be a big party town so, unless you are a ""partier"", I don't feel like there is too much to do around campus. There are plenty places to eat though. There is some shopping places but, there could be a lot more development in Richmond."
College Freshman,2,The dorm halls for freshman are very nasty and unclean.
College Freshman,2,Personally I have never felt in danger here at Eastern. Although the school is swarming with STD's and that disgusts me.
College Junior,2,financial is a somewhat non friendly experience look on the internet for schalorships there are tons out there
College Senior,2,Football is the most supported sport on campus. Fan support for other sports is not very high though Eastern does have some very good sports teams. IM basketball and Flag Football are pretty popular on campus. The Rec Center is top of the line.
College Freshman,2,Im going into Occupational Therapy and The classes just to get accepted to the Occupational science program are hard. After that you have to take 2 more years of classes and your not even sure youre going to get accepted into the OT program
College Sophomore,2,"Richmond had a variety of apartments to choose from but you would seriously need to have a car to live at them unless you get lucky to get one directly off campus. Also, many are expensive and you would need a roommate to may it cheaper. Fortunately, they are building apartments right on campus!"
College Sophomore,2,"Several options in the food court, but everything but Subway has really high prices. I eat a mostly vegan diet, so I pretty much never eat on campus anymore. The cafeteria is the fresh food company, so it's all you can eat and there are several options. Has a bit of a sketchy reputation for giving you ""Powell gut."" (Powell is the name of the building it's in). They put too many onions in everything. A lot of times they put food up early so if you don't get there in time, you only have a couple of options (and I'm a picky eater). The vegetarian station has slim pickings."
College Sophomore,2,"Parking lots are inconveniently located, its hard to get very close to your classes so there is a lot of walking involved. It is also sometimes hard to find a parking space, the parking lots are usually very full or packed. Parking passes are expensive considering that you have to fight everyday to find a parking slot. My advice is to get there 30 min early so you have time to find parking and walk to class."
College Senior,2,THE RARE TIMES I GO TO CAMPUS THE PARKING IS RIDICULOUS
College Junior,2,"From my experience at other schools i have found that like most colleges EKU doesn't offer nearly enough scholarships. The few they do offer is not available for middle class students. Most are only offered to low income students, but college is expensive and we could all use a little help!"
College Junior,2,"There are a lot of whites, but there's also a lot of blacks and Middle eastern people. That seems to make up most of the population, I think I've maybe know of or seen 10 at the most Hispanic and Asian people! There's a lot of ignorant people from every race as well, you can't escape that!"
College Sophomore,2,the truth is that the university is a suitcase college and being from miami florida im used to being around a lot of different people all the time and always having something to do. here at eastern the campus is always dead with very little to do because majority of the students live within 10 miles of campus so by the time thursday comes around about 70% of the campus is gone home until sunday night and the nightlife in richmond is also boring you will always have to make a 30 minute drive to lexington to actually have fun with the university of kentucky students.
College Junior,2,"Campus Shuttles and Around Town Shuttles – There are campus shuttles that will take you to different places around town, there are also very cheap shuttles that transport you around town. If not there are always cabs that are also cheap."
College Senior,2,"Very Small & Country – This is a very small country town located in Kentucky. There is some racism but you'll get used to it. You have to be there for a while to figure out the different activities available off campus. There are a lot of bars downtown and too many elementary schools close to campus. It is close to Lexington where University of Kentucky is, so alot of students travel back and forth there."
College Junior,2,"Dorms Need Lots of Upgrades – The housing is very convenient, close to everything on campus.  But they are old.  They are very small and extremely basic compared to other schools."
College Student,2,"Few Parking Spaces – The school doesnt offer enough parking spaces for students; therefore, students have to travel long distances to class.  This can be scary for women at night or early in the morning."
College Sophomore,2,"Some of the programs you apply for are very hard to get in to and you can only apply once a year, not once a semester."
College Junior,2,Not Existent – there aren't really parties that go on because we are a dry campus you have to go off to do those things.
Sophomore,1,"There are some good things about the school like the options for majors, that’s about it. All they care about is money and if you have an issue, everyone goes MIA with helping and you can’t get in touch with anyone. I highly recommend not going to this school."
Junior,1,"If you have other options, do not come here unless you just want to party. The coursework is laughable, and most of the students don't care. I don't know how this University is accredited. My community college was light years ahead of this school."
Niche User,1,"Eastern was a very large school with a large ratio of student to teacher. Coming from a small town and an even smaller high school, eastern was not for me. "
College Freshman,1,I come from a lot small school where I had the best of everything and then come here and pay a lot more and don't get no where near I get at my last school.
College Freshman,1,It's a joke. I've been to other bigger university's and they have a lot better values and actually trying to make a difference in there community. But here it's just a social scene where people get together to party but the parties are small. They to need to host parties or concerts. For people to pay and go towards a charity or something.
College Senior,1,"I am 32 and have a five year old son, i do not party"
College Freshman,1,Definitely not worth the cost of staying in dorms.
College Sophomore,1,I haven't recieved any financial aid. According to the federal government I made too much money last year so I should be able to pay for school myself.
College Sophomore,1,"Eastern Kentucky University's financial aid office is a pain to deal with. They offer meager amounts of financial aid. They are continuously transferring your calls, and don't attempt to offer help."
College Freshman,1,There are not very many options to choose from.
College Freshman,1,There are several things that they need to get a grip on.
College Senior,1,"the residential parking spots are very scarce, you would have to leave your car parked all week to keep a decent parking sopt. The commuter parking lot is kind of far depending on where you are located on campus, and the spots are always not that good. "
College Senior,1,"The city is boring, nothing to make you feel like its your hometown at all. "
College Senior,1,"I don't feel like some of the professors enjoy their job. Some are not really proactive with their students. The programs that mean the most to this campus are nursing criminal justice and business, all others get overlooked at times. "
College Senior,1,Not all greeks live in the greek towers; the NPHC greeks are not living in the dorms like the other organizations 
College Senior,1,There are no clubs in richmond anymore due to them going out of business. 
College Senior,1,"I feel as if my experience is not what i was expecting coming from high school. I have participated in some clubs in my 3.5 years that i have been here, and i still do not feel the experience that i hoped for as a senior in high school. Now it is really to the point where i'm just going to school and getting my education with no social life around campus at all. "
College Senior,1,"The weather is actually not that bad; it goes by the season change, either it is really hot, rainy, really cold, or steady."
