Sophomore,5,"It is a pretty good University! All my professors have been super nice and I like the environment. The campus is pretty big, but easy to navigate. The cafeteria is pretty good and lower case has subway, panda exprees, chicfila, and moes."
Sophomore,5,I like eastern Kentucky university because it is a fun and interesting school with great academics. There’s always something fun going on. They also really want to see their students succeed and have a lot of resources so that they do so.
Junior,5,All my classes have been online and the professors are easy to access and reply in a very timely manner.
Junior,5,Eastern Kentucky University has been so helpful and has worked well with my work schedule so that I can finish my bachelors.
Freshman,5,I have taken all of my classes online. Eastern Kentucky University has done a great job making their interface user accessible. The professors have all been great online too.
Junior,5,"Eastern Kentucky University has become my home away from home in the past year and a half. Even with everything going on in the world, EKU has kept a level head and made sure that their students come first with everything. Allowing us to stay at home and continue our schoolwork was just one great example of how they kept things smooth. They created a tactical team that only debated what their plan of action was and was quick to respond to any questions asked. Not only that, they have taken good care of their professors and allowed them the flexibility to work on their classes on their own time. This small community is probably the best one I have ever been apart of and hope to continue to be apart of for many years into the future as an alumni. Eastern Kentucky University has become my home and I couldn't imagine what my life would have been without it."
Freshman,5,EKU has a lot of good resources for all freshmen who need help with their school and job. Great experience in the events such as homecoming at EKU.
Senior,5,"EKU is a home away from home. Not only is it affordable,  the campus is beautiful! There are many campus organizations to join!"
Graduate Student,5,"Eastern Kentucky was my first home away from home. What truly made it a memorable experience was the professors of my department who are now my life long mentors and inspiration. I was more fortunate than other EKU students to develop close relationships and a sense of community with both other students and teachers. Unfortunately, what made EKU so special is now disintegrating since my graduating year of 2015, much of my department has changed to accommodate changes to the university (larger classroom sizes, raise in tuition, and moving away from service learning). Although the campus now looks very nice with new buildings and gardens, it feels that it has lost it's sense of close community and service learning."
Junior,5,"Advisors are very quick and adequately responsive. The courses are very informative and helpful. There are multiple options available and always help anytime. The campus is clean and safe, and there is always someone around the corner to help. I would recommend EKU to anyone!"
Freshman,5,"Eastern Kentucky University has welcomed me with open arms, I would highly recommend this university to any high school student or anyone looking to transfer. this college does not take failing as an option, they will help you at any cost to see you succeed. there is so many clubs and organizations that are availably to you at all times, this school is definitely a home away from home."
Alum,5,"I loved this school. Spent all 4 years here. It was very easy to get involved on campus. I even believe I had a total of 3 or 4 different jobs during my time here. The classes were great and the teachers were very helpful whenever you needed it. When it comes to the city as a whole, it's pretty based on the school but there are good restaurants and stores around. If none of that interests you, Lexington was right down the road."
Freshman,5,Eastern Kentucky University is a Great school! They have some of the best programs! Beautiful campus.
Senior,5,"Other than having the best criminal justice program in North America, EKU is just the right size for me. I have gotten very involved with the campus and with its organizations (which it offers a ton of). I have also gotten the opportunity to work here as a student worker which gave me a chance to work closely with professors and those within the community."
Junior,5,"From all the colleges I toured, EKU felt the most inclusive and most home-like. I do not regret my decision coming here. The friendly environment makes it feel like a safe and comfortable to spend my time away from home. The facilities are nice and constantly being updated, so can't complain about that. EKU has been a great environment for me to experience growth and become more independent."
Niche User,5,It was a beautiful place to see and a lot of great people there and to meet and their rooms are nice
Sophomore,5,So far my time at EKU has been nothing but wonderful. This campus is truly beautiful and so welcoming. With class sizes that are fairly small you feel like you can get to know your peers and professors better.
Senior,5,"I graduated in 2014 with a Bachelor’s in English and decided to go back this year for my BFA with a concentration in Painting.  I have only been drawing and painting for 2 years, and I wanted to improve my skills.  I love Eastern Kentucky University.  The campus is beautiful with vivid flowerbeds and trees.  EKU has an awesome food court with many chains represented like Chik-fil-A, Steak n’ Shake, Moe’s Southwest Grill, and many others.  Students are very active and health-conscious, so we’re getting a new recreational center with pools, gym, and many other amenities.  We love our football and basketball in Kentucky, so the stadium and coliseum are always full of students cheering on our athletes.  I have learned a lot, the professors are knowledgeable and really engage in instruction.  I am very glad that EKU is my choice to further my education."
Senior,5,"I am a full time online student and have had the best experience.  The support system is amazing. There are so many avenues available for help, of any kind, from study habits, writing papers, technical support, and even the much needed positive feedback."
Freshman,5,"Amazing overall. Wouldn't change it for a bit. Best choice for the American Sign Language Interpretation program, no doubt!!"
Freshman,5,I've really enjoyed EKU on and off campus. The overall diversity of the campus while also having very approachable professors really helped my transition to college life. I would highly recommend Eastern Kentucky University to anyone who is currently stuck on where they want to go for college.
Niche User,5,Eastern Kentucky University has lots of diversity and great things to do in the area. The campus is very safe and spacious.
Niche User,5,"I love this school, such a pretty campus! The new dorms are amazing and the science building is gorgeous. There is a police station, fire station, and hospital right down the street"
Freshman,5,"I just started my freshman year this past August, but I like the smaller classes and the everything is within walking distance on campus."
Freshman,5,"My fellow students are really kind and the staff and faculty is very helpful and kind as well! There are tons of clubs and organizations to join on campus, including Greek life! The residence halls are spacious and a lot cleaner than I expected them to be as an incoming freshman. Most of the buildings are fairly close to one another, so you don't really spend a lot of time walking, unless you live at Keene Hall. But even then its not a huge distance. There's lots of off-campus excursions to go on, too. You can go hiking and kayaking on Lake Reba, you can get dinner at a large variety of great restaurants around town, and you can venture around and take in the local history of Richmond."
Niche User,5,"Im a current senior high school, and i already know this is my home. I've been to multiple campus events/visits and met multiple professors and all i can say is wow. The campus is beautiful and safe and its overall just an amazing place!!!!"
Senior,5,"Smaller than most universities, yet large enough to offer everything you need with diversity.  Beautiful campus that is clustered mostly together with lots of activities.  The classes range from small to mid size so your professors have a lot of one on one interaction. The academics offer a wide range of choices for undergrad and graduate students. My overall experience  here is excellent."
Sophomore,5,"The campus is so beautiful and small, but not that small but its the perfect campus to walk around in and just enjoy."
Sophomore,5,"Overall it is a great school. Eastern has a variety of food choices including the cafe, chic-fil-a, panda express, Moe's and Subway. EKU also has a variety of campus-wide activities for students with different needs. The campus is beautiful and the landscaping is always maintained with various in-season plants. The students are mostly helpful and accepting of others with very few exceptions. Most of my teachers are wonderful and would go the extra mile for any students however, there are a few who refuse to offer any extra help. Like anything else there are going to be faults in the system but, at Eastern Kentucky University there are very few."
Freshman,5,"Everyone at EKU is extremely helpful, they make the overall college experience less stressful! When transferring in I was an absolute mess and riddled with anxiety, but the SOTO department made the transition painless and as easy as possible. I am forever thankful for my choice to transfer."
Niche User,5,"It is an amazing school. Wonderful campus, beautiful scenery, and very nice people. I plan to attend there fall of 2020 and I couldn't be happier with my decision."
Sophomore,5,From the first day I arrived at Eastern Kentucky University (EKU) I felt welcomed and apart of something I’ve never had before. There was a 3 day event where all freshman got to know one another and got the change to create friendships all of which I still have to this day.
Junior,5,"Eastern Kentucky University is phenomenal. You will learn how to critically think, how to progress with future careers and you will be provided the tools necessary to accomplish your dreams and goals."
Freshman,5,"Eastern Kentucky provides the perfect college experience. From academics, to sports, to social aspects, EKU is a place everyone can call home. The academics are challenging, but professors are always willing to help with students who struggle. Social aspects of Eastern are especially great. There are a ton of different sororities and fraternities on campus to join, as well as clubs and groups for those less interested in the greek life! Sports are extremely important to EKU. The football and basketball games create an environment that everyone wants to be a part of! Go Colonels!"
Sophomore,5,"While EKU a predominately caucasian populated university, we do not support or allow discrimination on campus. We are a welcoming community, with awesome educational opportunities and a beautiful campus."
Alum,5,"EKU has a rich history, beautiful campus, and plenty of activities for people from various backgrounds and interests. The professors are kind and willing to work with students to ensure success. Advising could be more streamlined and program requirements/course catalog listings could be more clearly stated. Overall, I love EKU!"
Alum,5,"Good student amenities, but needs to work on career guidance services. Some programs are also a bit rudimentary and would benefit from being expanded."
Sophomore,5,"Eastern Kentucky University is  a complete home away from home. The staff, students, and professors are always welcoming and will try to help you any chance they get. Campus safety was a huge factor when I was choosing a college and was one of the reasons I chose EKU."
Niche User,5,"Going to school there in the fall. So far every experience I have had with this university has been really good, I love it so much there I can’t stop visiting! I can’t wait to attend in the fall."
Freshman,5,"I love how it is big but it is also small enough to know many people such as professors and peers. I love campus life, there is always something going on to keep me busy in my free time. I also love how most of the professors try to make it as personal as possible."
Freshman,5,i like that at eastern kentucky university you are able to walk from one side of the campus to the other side.
Freshman,5,"Eastern is a great fit for me. I love the campus, its the perfect size and beautiful. Many majors are offered and the freshman orientation is phenominal. The professors are approachable and very helpful. My freshman year has been a learning experience for sure. I have grown as a student and as a person. EKU has a diverse population and that was really important for me. I am looking forward to all that EKU has to offer. I hope that I will represent my college in a positive light. The most important criteria for me is that I will have the skills I need to secure a job in my chosen profession. Go big E!"
Junior,5,I have had a good 3 years so far. I like the atmosphere that you get living on campus. The worst thing is the parking.
Freshman,5,"It is a fantastic university. I am beyond glad that I chose to go to EKU. My peers are great, the food is great, and my professors are overall fantastic. I love it!"
Freshman,5,I grew up in the town around Eastern Kentucky University. I have always loved the beautiful campus and the buildings housed on that campus. EKU is always actively involved with the high schools in surrounding areas. I remember many times I attended the STEM fair through EKU and part of that involvement helped waver my decision to attend Eastern. I always feel as if I belong at EKU.
Niche User,5,"Amazing Campus, Very clean , safe , dorms are insanely amazing, all around great college. Professors maintain great relationships with students. All inclusive campus. Many things to do and see around campus and some incredible state of the art technology."
Sophomore,5,Throughout my first year at Eastern I truly felt at home. I truly believe the best decision I made was choosing to go to EKU for college.
Sophomore,5,"I absolutely love EKU! My experiences there are great and I love all my professors there. I believe everyone should come to Richmond, where everyone is friendly and kind. They are open to different diversities and the professors do put you first."
Freshman,5,Eastern Kentucky University has the best program in my field in the whole state of Kentucky. It's School of Justice and Safety is a program of Distinction.
Graduate Student,5,Affordable and supportive. One of the better priced DNP programs with high quality education and appropriately accredited program
Freshman,5,EKU has given me a home away from home where I have found a field I wish to pursue and a job to help with the expenses of campus life.
Sophomore,5,"It's not too big, and not too small. It's affordable and still university title. There needs to be more parking."
Junior,5,EKU has a very welcoming environment.  The professors seem to really care about the students.  The newer dorms are very nice.  They have a support system for students with learning disabilities that is extremely helpful.
Niche User,5,When I visited Eastern it was absolutely incredible. They have amazing programs for health and criminal justice majors. They have a great atmosphere of students. Amazing class ratios. and its very affordable.
Freshman,5,"What i loved about Eastern Kentucky University was, of course that the had my major, Pre-Occupational Therapy, many other schools had the same major but this university had a much better program. Another reason Eastern stood out to me were the friendly faces and the appreciation that the incoming freshmen had from the school. it was very heart warming. It felt good to know that I chose the right decision to be apart of the Colonel family and the tuition was very convenient for me and my family. I am proud I've became a Colonel and i can't wait to see whom i will become when i walk across the stage receiving my diploma, accessing a new level to my life of happiness."
Sophomore,5,They are really nice and have a lot of materials to help you! It's a large campus with medium to small classes.
Sophomore,5,Professors are generally willing to work with you on things. Classrooms are clean and spacious. Classes are never too large. The area around the campus is amazing. Offers regional campus options.
Sophomore,5,I love Eastern Kentucky university. It's a wonderful diverse school. They offer a lot of opportunities and I love that. Although they just went through a budget cuts and they shut down the campus that is closer to me.
Sophomore,5,It is a great campus.  It is not a huge college--but the is Lots to do socially.  It is close to intersate--so communting is easy to navigate.  Close to malls.  Teachers are great small enough that you get indiviualize attention.
Graduate Student,5,I was an undergrad in the EKU Honors Program.  At that time it was one of the best in the country.  When I decided to go back to school and obtain my masters I originally went to another school but transferred back to EKU because they had evening/weekend availability to allow me to work full time and finish my degree.
Junior,4,"Overall, the learning experience online during COVID-19 has been very good. It has been an adjustment for everyone, not just the students."
Junior,4,I have been a student at EKU for 3 years now and most of my professors have seemed to genuinely care about how well we do in their class as well as other classes.
Sophomore,4,A beautiful school with a caring facility where it counts. I do wish they listened more to the students voice and what we had to say sometimes.
Sophomore,4,I took classes both online and in person due to Covid-19. Throughout this year and last year professors have always been eager to help the students no matter what.
Sophomore,4,"I like that there is always something going on and something for students to do on campus. Activities at the Rec, extra curricular activities, sports, etc."
Sophomore,4,"The instructors, teachers, and employees at eastern Kentucky university add very kind and positive people. As an African American male I have never felt unwanted on campus or uncomfortable. However, you cannot just expect people to help you you have to be willing to ask for it on your own."
Freshman,4,"Eastern Kentucky University has been great. The only downside, however, has been upon returning to school after a 2 year break. I have had to jump through hoop after hoop for the last 2 months, my financial aid is super late, I was only approved for readmission a week before classes began, etc. It has been a nightmare with that sense."
Senior,4,"I like the classes and professors. I'm very attached to the professors in my field. My issues are with the registration process, especially when first applying. They are also really bad about telling people important information, such as deadlines and resources."
Junior,4,"While these times are tough and communication is cut short on many occasions, I doubt that Eastern Kentucky University could have handled the switch to online any better. As things started to escalate, they had a team immediately banded together to discuss what will happen in the future. This quick response was able to keep us students and the professors safe on campus. The teachers were allowed a week to get things in order for us and many of them were able to make it feel like a real classroom in my own room. Sometimes the servers for Blackboard would go down, but that never stops a class from learning the material. While I miss classes on campus, I'm happy that EKU has allowed us to stay safe inside of our own homes and practice our social distancing."
Junior,4,"I had to take my classes online for the rest of the semester because of COVID-19. My professors were very understanding about attending lectures and turning in assignments because of technology issues. However, it was very stressful because they assigned more work than what was on the syllabus."
Junior,4,"I really love the campus! It is close knit and the professors are really helpful. They want you to succeed in their classes. The campus is kind of small, but it is very easy to meet people that share the same interests as you. Also, campus life is so much fun because you can meet so many different people from all around the world."
Sophomore,4,"Throughout my first year of college at EKU, each of my professors were very helpful and reasonable with assignments and grades. The campus is beautiful as well. After transitioning to online courses for the second semester, some courses were more difficult than others but I ended well and still kept a high GPA."
Freshman,4,"During the COVID-19, the online classes were good. They helped me to focus to finish the assignments on time.  The professors did a great job with communication with the students who needed help with their assignments. Also EKU offered the tutoring sessions online. They were helpful."
Junior,4,Online classes are typically very thought out and detailed. The professors are quick to respond and the content is easy to understand.
Freshman,4,I have enjoyed my time here at EKU. Its a big name school but with a somewhat small campus with great teachers and staff. Only rate 4 starts because I am a freshman and have not experienced everything yet.
Freshman,4,"I love how everyone feels like they have a place here. The staff are always helpful and welcoming, encouraging us to try new things and explore. There is always something to do, events, markets, parties. I have made many lifelong friends both student and staff alike."
Niche User,4,"I went to Eastern Kentucky University for a football camp in the summer and i really enjoyed it. I’m Trying to visit the school and see the campus, the rooms, and the area around the campus. I looked up the rooms and i really liked them."
Freshman,4,"EKU is a great school. The campus is amazing, it's very scenic, and campus life is active. Students are engaged and want to be there, the school offers many clubs and activities for students to participate in, and campus is very safe. The Professors are great, and every Professor and Advisor wants to see students succeed. The atmosphere is very nice."
Freshman,4,It is a really nice school and I recommend everyone to at least come for a visit. The campus has really nice vibes. If you ever have any questions you can ask any staff and they will be sure to help you or point you to who ever can.
Freshman,4,"EKU is an amazing school. I like the smaller campus, it gives the feel of being at home while away from home. I like that I'm exploring being away from home but I am close enough to drive home on the weekends or where ever I need too.
I enjoy and like the small class sizes and that the teachers/professors actually care about theit students and want them to succeed."
Niche User,4,"Currently, I am a high school senior boy d to attend Eastern Kentucky University. some family members of mine, as well as friends have gone through this path and have saturated me with information about this school, and its surroundings. I was drawn in to the school by their police academy, as they currently have one of the largest, most prestigious groups in all of America. when looking into this school, I discovered that it could be my second home. The thought of living on campus, and making a new family excites me, as well as scares me a bit. After visiting the campus and going through the grounds, I noticed that this is where I want to be, grow, and learn as a person. so far, my experience with this school has been nothing less of exciting."
Niche User,4,it's a good school to attend. Professors are connected to the students. They teach well. It is a more educated based school not many partys.
Freshman,4,I have been at eastern for only 2 semesters now but I already feel very comfortable here. My classes aren’t as far apart as I imagined they would be. Everyone here is very nice and it’s easy to find your way around.
Freshman,4,"I love the community feel of Eastern Kentucky University. I chose EKU because it was not as big as the University of Kentucky, and the class size was noticeably smaller."
Junior,4,"The course work is great and I love all my teachers, but the living faculties are not good to live in and expensive. I have bad and good experiences with other students, but overall they are friendly. The staff is super helpful and really encourage you to do your best!"
Junior,4,"My experience with attending Eastern Kentucky University has been an overall challenging and eye-opening. My student life is average in some regard, but I am making improvements to become more involved. Areas I think EKU can improve on is there student life, especially during the weekends. From what I've seen most students pack up and leave for the weekend, so enhancing student life especially during the weekend can maybe help students get involved and find fun weekend activities to do."
Junior,4,"Eastern Kentucky university (EKU) has a wide variety of majors, clubs, sports, and other ways to get involved on campus. Moody if the professor truly do care about the students efforts involvement in class, and stride too mane the classes interesting."
Freshman,4,"Its a really nice campus. Its really easy to make friends here with the different clubs, classmates, and fellow residence hall members."
Junior,4,"Switched here from a private university, love that I made that switch. Its not terribly big not super small. so theres enough new faces that you don't know everyone"
