College Freshman,2,I'm sure it may be nice for some students but this year I have not been awarded all the aid I was in the previous year.  I did well academically and was not acknowledged for it.
College Freshman,2,Walking to class is brutal in Cleveland weather.
College Freshman,2,"Unless a student is already living in close proximity to the school with their parents, I do not see the point of living off campus.  I think it is too much of a hassle trying to pay rent, tuition, etc."
College Junior,2,"After my first semester I did not attend many parties. I had a poor experience and quickly found out that it just wasn't my scene. The parties were out of control, fights and other mishaps. However, no I.D. meant no entry. As for the club scene everything was close to campus and in later years the school shuttle provided transport to and from the downtown clubs. "
College Freshman,2,Daley is not that good food is very fating and not to much to pick from.
College Sophomore,2,It is Cleveland. End of story. Winters can be tough because of commuting. The walks across campus are not far however.
College Sophomore,2,"Guys are typically the artsy type. Ursuline is a 94% female school, so guys are few and far between. The girls are relatively athletic and inteligent."
College Senior,2,"Few Men but Growing – Ursuline was once an all female campus., But in recent years, the campus has gone co-ed. Although females largely out number males on campus, there has been an increased number of men commuting to the campus."
College Junior,2,"There Is No Where to Hide – It's a walk to everything, and sometimes it's easier to go outdoors. There isn't a lot of awnings, or places to hide. Also, it's a long walk to the buildings from the main parking area. I imagine it's very annoying for people living on dorm when the weather is bad."
College Student,2,"Registering for Classes – This is a small college, but a good majority of the classes only have one offering and even the most common classes aren't offered every semester. THis makes it difficult for me to schedule work and school. Many of my classmates have transferred to other colleges because of it and I consider doing the same."
College Junior,1,i have never been to an ursuline campus party
College Sophomore,1,There is no Greek life
College Sophomore,1,The local weather that affects campus is very bad because its near the weather belt.
College Sophomore,1,there is no greek life on campus.
College Senior,1,"The closest I could find apartment wise is still twenty minutes away, and still very expensive. Pepper Pike (the city where Ursuline College is located) is a very upper-class area, so the housing is expensive. You can find decently priced apartments if you're willing to drive at least 20 minutes, but there is nothing cheap for broke college students close by."
College Sophomore,1,There is nothing close to UC. It is probably a good 5 miles to anything. And most of those restaurants are overpriced. The east side of Cleveland is expensive.
College Sophomore,1,"Ursuline is a small school. We recently made it into the NCAA. Sports are not well attended. As most of our students are commuters, coming back after classes to see less than average teams is not a priority."
College Junior,1,"It's All Pretty Far – There really isn't a ton of parties, and it's hard to get to a bar if you don't have a car. Most of the bars are run of the mill."
College Senior,1,"Very Strict – This is a catholic, predominantly female school.  There is a 12;00 curfew in the dorms, especially for the men who live there.  There is no alcohol or smoking allowed near the dorms.  There are security guards everywhere you turn"
