College Sophomore,4,"There is not much violence at all on campus, there is a large amount of campus police available, and my only  concern is a few unlit walkways at night."
College Sophomore,4,"There is a lot of respect for those of us in the nursing program, and we are often spots of advice for younger and sometimes older students who have not yet been admitted. However, maintaining those spots is often difficult, and many students spend as much as an entire day filling out paperwork. It is a very rigorous program, and not for students who would take it lightly. The grading scale is curved upward, so that a 74% would be an F and not a C. There is also no extra credit, and professors do not have sympathy for those who do not do their work."
College Junior,2,There aren't very many choices of greek life at our campus.
College Junior,2,The school does not have campus housing because it is too small.
College Sophomore,2,I am an older student and am unable to receive scholarships. I am looking on line at present time for anything to help me.
College Sophomore,2,"Our campus is a commuter campus, so there isn't much nightlife at all. There are rarely events that are hosted at night, but not enough to bring a lot of people out."
College Junior,2,"Small town, not alot to do."
College Freshman,2,"Financial Aid claims that my parents make too much money, when we are struggling to pay for school."
College Sophomore,2,Campus or public transportation is only available for sports teams and local high school students on tours. Everyone else has to drive themselves or carpool if that option is available to them.
College Sophomore,2,I live at Chester Heights apartments and they are always trying to pull on over on college students you have to be careful ask lots of questions and show proof of payments.
College Junior,2,The weather is typically cyclical and Midwestern. Nothing to write home about. Summer and winter can be brutal .
College Sophomore,2,"Since there are no dorms here, there really isn't much for the police to be strict about. They do seem to ticket the ""visitor"" section of the parking lot quite a bit though."
College Senior,2,"They could use a bit more updating. The outside of the building look nicer than the insides, though. Some higher-end finishes might help in some areas. The workout facility is way too small. The den (cafeteria) is also way too small."
College Junior,2,"There is a public bus transportation route that passes by the university. I see very little cabs available. Because Indiana university east is known as a commuters college, transportation for specifically college students is poor."
College Junior,2,"Kind of Tough – The social work program has an extensive application process. The process requires the applicant to write three detailed essays about a certain social work topic. The application also requires three references with certain criteria, which somewhat limits the student on who they can use for a reference. Overall, it is great that there is an application process to get into the program to weed out the ones who do not really want it, but it was an intense process even for those of us who did want in."
College Sophomore,2,Small town. Lots of food joints but nothing to do.
College Sophomore,2,"No Snow Days – Even when it snows a lot or the roads are unsafe, the campus rarely shuts down for snow days. The teachers tend to be understanding if you are unable to attend class on those days, however."
College Junior,2,"Parking Police – Parking is very abundant at IUE and the parking police are sticklers about ""student"" parking and ""visitor"" parking. If you are a student DO NOT park in the ""visitor"" area or you will get a ticket!"
College Junior,2,Great for Richmond Residents – For students attending classes in Richmond there are plenty of choices for dining with the opportunity to use discounts at many fast food places.  Commuters do not have as large of a selection.
Alum,1,"Some professors understand it, some do not. Overall it can never replace a face-to-face classroom.  I suspect more learning will be done online in the future."
Alum,1,"I entered their new Graphic Design program because it was affordable and close to home. The program is high school level at best. YOU WILL NOT BE JOB READY BY GRADUATION. 

I received A's for the classes relating to my major, and I found the work to be extremely basic. The professors are experienced and they try, but the expectations are set way too low. There is absolutely no emphasis on career readiness, which I find bizarre since graphic design is such a competitive field. You will not be challenged if you enter this program. 

By the time you graduate, you will know:
BASIC COLOR THEORY
BASIC TYPOGRAPHY
BASIC PHOTOSHOP
BASIC ILLUSTRATOR
NO INDESIGN
NO LIGHTROOM
NO WEB DESIGN
NO DESIGN FOR PRINT

This material should be covered in High School, not University.

Even though I excelled in the classroom I still feel completely unready for a job in this field. If you are interested in nursing or the school of business, you might be fine. Just not graphic design."
College Junior,1,There is not any place to party
College Sophomore,1,There is no greek life at this campus because it is a strictly commuter college that has a ban on alcoholic products
College Junior,1,I am a transfer from Ohio and the scholarship process is terrible.
College Freshman,1,"We do not have school buses,but the community buses could take you. That is about it though."
Recent Alumnus,1,"There is no transportation offered by the school. The city of Richmond has a bus and taxi service, but rather than that student's use their own vechile's to get to school."
College Sophomore,1,"Go Home – Indiana University East does not have dorms available to their students. For right now a student either travels from home or rents an apartment close to campus that gives student discounts. From what I have heard, IUE has been planning the building of dorms for a few years and are just contemplating where to place them. I do not believe that there is sufficient space on campus for dorms. This campus is very young and are increasing in younger students. Only time will tell."
College Sophomore,1,"There really is no nightlife in Richmond, Indiana. Nearly everything closes around, if not before, eleven thirty. The cause of this is the fact that we do not act like a college town. There are three colleges in Richmond - Indiana University East, Ivy Tech Community College, and Earlham University. Two of the mentioned colleges are community colleges and call for commuting everyday. There are no dorms and no real nightlife available. I cannot say the same for Earlham, but since I do not attend Earlham it does not matter. Indiana University East does try to have parties and student organized events due to the increasing attendance of young students. This college is only 40+ years old and still has an above average population of adult students. They are surly but slowly making changes to accommodate younger students. If a student wants to have fun the best option would be to hold a party in your apartment or attend one at Earlham."
College Sophomore,1,Lack of Off-Campus Student Housing – There are not many odd-campus options for Indiana University East students. The only apartment complex that I know of that offers a discount for students is chester heights. Although that apartment is close to campus it would be nice if the younger students had more options. I know that IUE is trying to become more than just a small community college. They now offer a sport programs and if they are trying to go in that direction they need to provide some sort of housing. I know there are talks in regards to the old hospital in town that is close to the campus being converted into dorm rooms for IUE students. I think this would be a great idea and a good thing for IUE.
