College Freshman,4,"West Virginia State University offers a wide variety of majors to choose from, the campus is beautiful, and I couldn't ask for a better staff."
College Freshman,4,The new dorms they just built are pretty good. We get our own room within the dorms and it is set up like a hotel
College Student,4,"I live in the new dormitories that they just recently opened. I love the fact that you get your own room, which mean you get privacy. and you don't have to share a bathroom with 20+ people that live on the same floor."
College Junior,4,"Most professors are helpful and knowledgeable in their fields. Usually they have first hand experience with whatever they are teaching as well. Film professors are filmmakers, language professors have been to the countries, and so on. However there are few professors for each campus section (such as there's just a couple to few professors in the music dept, several in the comm dept, several in the science, a few in the English, etc) so it becomes difficult if you can't learn to the professor's teaching style or have personal issues with the professor/etc. Also due to the low staff, certain required classes are only offered every other other semester or only one class at a time during one semester, making it difficult to maintain the amount of credit hours to accommodate students that work and/or have families to tend to or to graduate on time."
College Junior,4,There are a good number of diverse students at State.
College Junior,4,"Came from big university,  I love this school!"
College Junior,4,"Average university food, even better since I don't have to cook!"
College Sophomore,4,The campus diversity is rather noticeable in all of my classes. West Virginia State University is a very non traditional campus which creates many new opportunities for people.
College Sophomore,4,There is very little that the weather can do to prevent me from enjoying the campus.
College Freshman,4,I love the people at WVSU. Everybody is nice and easy to get a long with and talk to.
College Freshman,4,"My family lives in Florida. If I want to go home, I drive with friends."
College Freshman,4,I see the campus police everywhere. They even came to one of my classes to do a campus safety talk.
College Freshman,4,I was able to get all of the financial aid i requested and needed. I am also able to get a summer grant that I was unaware of at first.
College Freshman,4,"For the most part, the attendance policy with most professors are reasonable. Some professors have ridiculous absence policies that are very difficult to achieve."
College Freshman,4,"WVSU is an ok school to attend. It is sometimes hard to get in contact with the right people at the right time. I wouldn't take any classes during the winter, as they rarely close campus, and you are expected to be in class even if it is dangerous driving conditions. Other than silly things, most professors have your best interest at heart and are very personable."
College Senior,4,It not to bad. Visitation you must have you id to enter into the buildings when necessary. Campus policies are set in place some are enforce and other they can be lax on them.
College Senior,4,It is a big thing on our campus. If you want student to come out of their dorms let them know that a Greek organization is throwing something. The best are the probates and everyone is out on the yard watching people cross.
College Senior,4,There is security always driving around. The also have the emergency pole up so you can press the button. I have yet to hear of any crimes on campus.
Freshman,2,"An overly diverse HBCU in the middle of institute, WV. HAs no social atmosphere or party life... not a fan"
College Junior,2,"I applied for student aid and completed it on 4/4/2016. It took the woman in financial until 6/30/2016 to deny me of any type of financial aid or student loans. The deadline was 6/30/2016. I went to orientation on the 25th of June 2016 and she didn't bother to tell me. I turned everything they needed wasting my time as I am going through the student process. I cannot pay over 1100 in books for one semester and 6,000 for tuition and fees. The school did not bother to tell after going through this grueling process. I am disabled but that did not matter. I mean, the financial lady named Ariene was the one who was not very helpful for me getting aid but causing more trouble and heartache wanting to finish my degree. I made mistakes in the past. I have 106 credit hours and did very badly but now I was ready to make the straight A's I always did in high school. I am depressed and very unhappy that I had to go through so much and not even chance to finish a degree in Accounting. I guess it just wasn't meant to be at all. I am so disappointed in the school leading me on to think I would be a part of the WVSU college experience. I don't make that much for tuition and fees a year much less to take of myself. Very unhappy with Ariene. She was very unfriendly and I am not used to being spoken to as I am stupid."
College Freshman,2,All of our teams suck. And no on particularly cares about sports.
College Freshman,2,"My college's funding, like many colleges, spends too much money on athletics. The fan support is adequate, but most of the campus teams don't have adequate track records. Team performance is generally poor, except for the tennis team. Many of the students are only attending this school to participate in athletics. The emphasis should shift toward the research and academics."
College Freshman,2,"No one, including myself, really pays any attention to the athletics here. It's never mentioned, not even by professors or other administration."
College Freshman,2,Nothing is opened up late night near campus
College Freshman,2,The quality could be improved
College Junior,2,"There really aren't very many parties or events to attend, most are frat centered and aren't good for general students."
College Freshman,2,"This area doesn't have the best night life, you will have to travel about 40 minutes or so for better clubs."
College Freshman,2,The nightlife at our school is so bad that we go to other schools to party.
College Freshman,2,"It really pisses me off when people at my school, including my friends, use drugs on a weekly basis in their dorms. First of all, drugs are prohibited on campus. The smell goes through the whole hallway and everyone gets a community fine for it if caught. During the week, the drug and alcohol use is kept at a very low minimum except for those who are addicted. On the weekends, many people tend to ""turn up"" and violate the drug and alcohol policy like there wasn't even one to begin with. It is very bad in college because the usage of drugs and alcohol is overboard. Students don't know how much they can handle so they end up overdosing, or binge drinking. Peer pressure plays a major role in the drug scene on campus. Many students are faced with peer pressure from their friends or peers when they are faced with drugs or alcohol. I feel like the policy should be enforced a little more because I hate to see people fail classes, drop out of school, and go to jail because of drug or alcohol related incidents."
College Junior,2,"No matter what they serve, it tastes bad or isn't cooked right."
College Junior,2,"The buses run hours before or after classes, so if you ride the bus you have to get to the stop two hours before class, then you have roughly an hour on campus before class starts. Having a car costs more, but in the long run it's makes school less stressful, especially if you have to move projects around. "
College Junior,2,"The Greek fraternities and sororities have great cook out events and homecoming events, but they blast horrible rap music at their function, full of curse words I'm not allowed to say. They have a presence on campus, and sororities do bake sales, but they don't have an impact. "
College Sophomore,2,Depends on what you're looking for
College Sophomore,2,Great College just a little Dated 
College Senior,2,"Institute, is near Charleston which offers a myriad of activities during the summer and spring.  The mountains, and rivers of West Virginia can always offer some kind of activities throughout the year."
College Senior,2,"West Virginia has a nice climate throughout the year. However, the winter months (dec, jan, feb) can bring a lot of snow, and its pretty typical that class could be cancelled or delayed"
College Senior,2,There is no communication from the Department regarding financial aid.  When you call to speak with someone they make you feel like you are a bother.
College Senior,2,"To get a good parking place you have to arrive very early for class. Most of the parking lots are a good way from the classes. There never seems to be enough parking places. The permit cost is too expensive, it is like $80 a year."
Junior,1,They do not care about you at all!! The employees that are not instructors are absolutely useless and have no idea what they are doing. The commuter students are screwed because the awful President never cancels class even when the roads are undriveable.
College Sophomore,1,There are no night clubs near wvsu you have to go to charleston or Huntington. There's only a few in charalton and they are okay no that great and a there are only a few.
College Senior,1,State is safe during the day time. But at night while walking around campus anyone can be robbed or kidnapped. There was once a drunk inside a building at night. No security around.
College Junior,1,"Dining options are TERRIBLE at WVSU. As an off campus student, the hours of the cafeteria are very inconvenient. You have to pay nine dollars just to get in and the food selections are not impressive. They have things such as pizza, cereal, pasta, a salad bar that is not cleaned very often, and other unhealthy foods. As a student athlete, my first year on campus I could never find anything to eat because I needed healthy food for training and the only thing I would eat was a salad every day or a turkey sandwich in which the meat was left out in room temperature all day long. After living on campus, you will never catch me eating in the caf again."
College Freshman,1,awful every morning is like playing eye spy while cars get wrote up with tickets
College Junior,1,Horrible Selection – There is only one place to eat off-campus that you don't need transportation to. It's a really good BBQ place and it any too expensive. The next closest off-campus food would be Mexican restaurant that is about 5 miles or so down the road. You can always have pizza delivered though.
College Freshman,1,"Lack of Respect – The teachers here so far seem nice, and are willing to assist, but I live in a Dorm for the married/with children. I have had two different workers on campus unlock my door without knocking and have complained. I felt violated, like a dog for the lack of privacy respect. Then, the truck needed a jump. Calling the campus security it took two hours until one of the maintenance guys, not the security helped us. I have lost respect for the school's security. Why can't I go to another school or move? Lack of money and ways to afford it, and no way to afford to rent another place for paying for this one. It is scary to walk across campus somewhat because of the college location in Institute. Not to long ago, about a block away, a woman was killed and her body was disassembled. Institute dont seem too safe and the security crew prooved themselves worthless."
College Freshman,1,"You Want to Have Access to Most Things? You Need a Car. Other than the high price food across the street or in the union. The closest mcdonalds or other eating place is at least 20 to 25 mins away by foot. Not much as a big deal with a car. The buses run but during the week peak hours every 30 to 45 mins, after that every hour, after 7 every 2 hrs. Weekend every 1-2 hours."
College Student,1,"The weather is bad, expecialy around this time of year. It can sometimes make it imposible to get to class."
