College Freshman,2,I found that the math and science classes were very challenging because the professors relied heavily on our previous knowledge which was minimal because they were 100 level classes. Then the majority of our grade was based on the tests which provoked not only previous knowledge but complete understanding and application of complex ideas introduced in class. Students should know going into the class that it is more self taught rather than professor taught.     
College Sophomore,2,"Greatly Improved – Honestly, this is one of the most expensive colleges in the country. Even though my financial aid packet covered half my tuition, it still isn't enough. And they DON'T change your financial aid as the years go by. I know multiple people, including myself, whose income has gone down due to multiple problems. No matter how many times you call or go down to the office to talk to them, they do not care. They keep pushing for you to take the semester off and get a job to save money, which honestly is not a option for many of us. If you are an international student, you have a better chance at getting more money because they pride themselves on having a ""diversity of students"" and ""international community"". Domestic students-we are left out of the financial aid decisions."
College Sophomore,2,"less drugs than most colleges – if you want drugs, you'll find them. if not, you may never even see or hear about them."
College Senior,2,"Students Are Not Crazy About Sports – Unfortunately, varsity athletes often do not get the credit they deserve and games are not well-attended. Our athletics teams are average at best. The Equestrian team is competitive. Oddly for a women's college there is no softball team. Lacrosse, field hockey and crew are popular as is the rugby team (club sport). There are no intramural sports and limited offerings for club sports. Overall we have an ok program for women's athletics, but if you're looking for a more competitive athletics scene and one where students show up to the games, I suggest looking elsewhere."
Recent Alumnus,2,"Dry Campus – They are pretty strict about drinking or drug use.  It's a dry campus, so no alcohol is permitted unless it is permitted by the school (student org parties, etc).  It's not a part school, and most students are pretty good about following the rules."
College Sophomore,2,"Its So-So – Although there are parties at the college, they tend to get boring after a while.Most would probably go off campus to nearby colleges to party or have fun as the bus runs quite late into the night."
College Freshman,2,"Entertainment Is There If You Go Looking – South Hadley is awful, but the five college area provides things to do if you're willing to search for them."
College Sophomore,2,"If You Have a Car, You're Set – Being that I'm from NYC, the local atmosphere of Mount Holyoke (in South Hadley, aka the middle of no where) is a bit dry. Most social events are in campus and there are some off campus but the city buses that run through our campus and nearby towns aren't frequent enough. But like I said, if you have car, you'll be fine... that is until gas prices go up."
College Sophomore,1,The school only allows a small number of upperclassmen to live off campus each year to maintain their full room and board earning.
College Senior,1,no social life on campus if you're not connect to a specific type of mount holyoke group ...
College Senior,1,"they really don't provide financial aid support for those who need it. my family contribution was no where near realistic which is why i now have thousands of dollars in debt. they also should make it VERY clear to student who have a sibling in an undergrad that your financial aid will decrease if you sibling graduates. the financial aid process seems very sneaky and I have warned prospective students to weigh all of their options before coming to this school especially if financial aid is an important factor. they don't seem to care if you're struggling financially as student and it's a shame that I had to pay so much money for ""an education"" 

total B.S."
College Freshman,1,There are not off campus dining options...?
College Sophomore,1,There is no greek life.
College Sophomore,1,No off campus housing really. If you're lucky you might be able to but it's rare. Most people live on campus all four years
College Sophomore,1,There's pretty much two restaurants- a chinese restaurant and a japanese restaurant. That's it. There's a crappy mexican place and an expensive restaurant. Not a lot of options at all.
College Freshman,1,Amherst and UMass are your best options to party.
College Freshman,1,I don't think there are really any off-campus options.
College Senior,1,"This is a single-sex institution, so there are little to no guys. Sometimes men from the other campuses come by to take classes that are offered her, but for the most part there are none here. 

If you want to meet guys, you can go off campus to Amherst, Hampshire or UMass, but there is no guarantee that you will meet someone you want to be friends with."
College Freshman,1,I really do not like it here. I do not fit in and am transferring next year because it is too small and I do not enjoy being at a women's college due to drama. 
College Freshman,1,"It's a women's college, therefore there are very few to none guys on campus."
College Freshman,1,I hate it here. It's very boring. There is absolutely nothing to do.
College Freshman,1,I received no financial aid or scholarship money and the school is very expensive.
College Freshman,1,There is absolutely no nightlife at my school. You have to go off campus.
College Freshman,1,It's extremely hot in the summer and extremely cold in the winter.
College Freshman,1,"The school can feel isolated at times. However, there is a free bus to the other four colleges in the five college consortium so that is a good thing, it always students to leave campus when they want or need to. The town of South Hadley is not a very vibrant place, but again, it is relatively easy to visit the surrounding towns and the other schools. "
College Freshman,1,We do not have Greek life.
College Sophomore,1,"Very few off campus options, but living on campus is great!"
College Junior,1,"NONE.  None... None. South Hadley is literally a ghost town.  There's nothing to do, especially if you don't have a car or if you don't feel like using it very often.  Thankfully, we have the PVTA - a bus which takes students to the other campuses for free (though getting to Smith is very annoying) - so you can travel to Amherst if you need proof that stores, culture, other humans, brand-name companies, etc. DO STILL EXIST.  Long story short: if you're a city girl, stay far away from Mount Holyoke, or get used to isolation, and lots of it.  At least you can see the stars every night!"
