Senior,5,"When covid hit the professors did their best to have the transition to online classes go smoothly while making sure their students health, mental and physical, we okay and all their needs were being meant."
Senior,5,My experience at Mount Holyoke was excellent. I grew so much as a person while having the best time of my life there. All the students and faculty are so friendly and helpful.
Sophomore,5,Mount Holyoke is a great school with some excellent faculty! People are super friendly and it is very easy to make friends. The academics side is good and you have a lot of options to choose your courses and explore your interests!  The campus is beautiful. Would totally recommend MHC
Sophomore,5,"I think professors did what they could. Considering the situation we are all in, I would not complain about anything!"
Niche User,5,"I was interested in Mount Holyoke because my mom went there. We toured, and I like it there a lot, enough to apply there. I applied early decision, and I was accepted! Yay! I like the college's atmosphere, and the traditions. I also know that I will be challenged there."
Alum,5,"At Mount Holyoke, the professors are incredibly smart and have the ability to teach on a level that is both challenging and nurturing. It is small enough that I felt a presence on campus and large enough that I felt I was part of a greater community. The students here are kind and considerate and treat each other with respect."
Freshman,5,"Mount Holyoke College has such an accepting and welcoming community. Everyone here is super friendly, and there's no shortage of student clubs and organizations to get involved with. All my professors are engaging and responsive, and they push me to do my best. The food is really nice -- anyone who complains about it doesn't know what college food is usually like, imo. The dorms do vary by size and location, but I'm very happy with where I ended up (Torrey). I was wary of coming here at first, because I wanted to stay in-state, but now I couldn't be happier with my choice. Even though I'm far from my family, Mount Holyoke has become my MoHome!"
Sophomore,5,I love the opportunity to take courses at any of the five colleges which Mount Holyoke College is a part of. It opens up many options to choose from and take a variety of interesting courses.
Freshman,5,"Mount Holyoke really feels like my dream school. It is a lovely campus, with plenty to keep you busy. Everyone is extremely welcoming and willing to help you with anything you need help with. I cannot wait to spend the next four years here!"
Junior,5,"Mount Holyoke College is  a truly wonderful learning and living environment. The community is supportive and collaborative, which pushes students to enjoy learning and take risks. Faculty care about student success and work closely with students in and out of the classroom. The campus is beautiful, with old and new buildings that match the overall feel of the college."
Sophomore,5,"Mount Holyoke has excellent classes and professors, however, the school could hire more professors to make it easier to get into classes (shorten the waitlists). Many of the professors are very dedicated to their research and teaching. The school could also be more transparent about their diversity initiative and have more ways of incorporating the diversity into the life of the campus instead of leaving that for the 'diversity' to do."
Junior,5,"I love Mount Holyoke College (MHC) more and more with each school year! As a physics and dance double-major, I have spent much time in both departments. While I cannot say that they have exceeded my expectations, I have enjoyed studying in both. The individuals that I have met, mainly through dance, have become some of my closest friends. MHC students are open-minded, intelligent, and diverse. The school is far from perfect and has much room for improvement. For one, it can do a better job in being transparent with its students when it comes to alerting us about campus safety, specifically considering our recent issues. I would also appreciate if MHC made a better effort to unite students from different backgrounds."
Sophomore,5,"I’ve never felt more at home than I do at Mount Holyoke. The classes are academically challenging, without being so overwhelming that you don’t have time for other activities. The professors are accessible, know a lot about what they teach, and really care about their students succeeding. It isn’t a major party school, but they aren’t nonexistent. Athletics also exist and you can be a part of it if you want, but it’s not an enormous facet like it is at other schools.
If you’re looking for a school with a gorgeous campus, accepting environment, great academics, and an AWESOME dining hall then look no further. South Hadley is a small town, but I love how cozy and safe feeling it is. Plus, the PVTA can take you to busier nearby towns when you want to get away or Boston isn’t far. Some dorms are better than others, but they’re still good. Overall, as students we really have it good here and I am proud to have chosen to attend."
Alum,5,"Mount Holyoke provides a rigorous, intellectually stimulating undergraduate experience on a gorgeous campus in an area with 40,000 students. Women learn to be thoughtful leaders and are well prepared for elite graduate schools and careers in both corporate and not-for-profit organizations. As the oldest women's college in the country, the school has a huge and diverse community of alumnae that stand ready to help any young graduate make their mark on the world. South Hadley is a sleepy town, with a big window on the whole world, due to the college's large international student population and the popularity of studying overseas during one or two semesters. I loved it."
Alum,5,"Graduated 4 years ago, still recalling my time there with great fondness. Mount Holyoke is truly a special place, where a strong sisterhood is actively fostered by the various traditions that Mount Holyoke strives to keep. The academics is absolutely rigorous, and I am still constantly in touch with my professors, who have become mentors in life. I understand as a single sex college, Mount Holyoke (along with others) are struggling to define themselves in this time and age. But I truly believe the single sex environment helps women find their own voice and realize we are capable of everything."
Senior,5,"Mount Holyoke is an amazing college filled with amazing people. The opportunities for personal growth and community betterment are vast and varied. While not perfect for everyone, every woman-aligned individual should consider Mount Holyoke, where every aspect of your life can flourish."
Alum,5,It's an empowering environment where you are encouraged to step out of your comfort zone. Many caring professors even after graduation!
Sophomore,5,"It took me a semester to actually figure out what I was doing, but I eventually found out what was going on, where things were, and people I could hang out with. The education is absolutely stellar. I've been made to think about things that I never would have thought about, and think about other things in ways that I would not have. The academics are unmatched. It is hard, but if you like a challenge, you will be challenged. If you haven't fit in anywhere, that simple fact will make you fit in at MHC, but you will still maintain  your uniqueness."
Sophomore,5,"The student body, for the most part, is passionate, caring, and active. They speak out, even when it means speaking out against the administration."
Freshman,5,It is very welcoming and the professors care for you. The professors want to see you succeed and will help you. They notice when you are not in class. You are a name and not a number.
Senior,5,Mount Holyoke is a good school. The campus has very diverse students who are willing to share their stories. I got learn about the world through the students I have met here.
Freshman,5,"Mount Holyoke is such an amazing and supportive place. The professors our outstanding and the students are so kind, genuine, and passionate. I really feel like I am becoming a better person every day I am here."
Alum,5,"Mount Holyoke is not for everyone, but as a nascent liberal academically-minded feminist, it was the perfect place for me to explore my identity and politics in a friendly, safe, and welcoming space. Professors were amazing. It was a bit of a cocoon, for better or for worse - by my final semester, I was very ready to leave - but in retrospect, I could not have picked a better college for me. It will always have a place in my heart."
Alum,5,"I went to Mount Holyoke even though it is a women’s college but ended up valuing it so deeply because it is a women’s college.  I learned to use my voice.  I learned to work hard.   I felt valued, supported, and challenged all at once.  Mount Holyoke truly changed the course of my life.  I am deeply grateful."
Alum,5,Wonderful place to explore interests and encounter challenging ideas; academically rigorous; tight-knit community steeped in tradition; very small and self-selective.
Freshman,5,"Mount Holyoke College is a top notch women's college that offers diversity and supurb academics. The professors are amazing, knowledgeable and make each class interesting. Everyone going to Mount Holyoke takes their academics very seriously and are accepting and friendly. The campus is beautiful and there is a lot of history within this small college. I would highly recommend to any woman who wants a quality education to go to Mount Holyoke College."
Sophomore,5,"Mount Holyoke College has a beautiful campus and an even more beautiful community. Every student I have met is engaged in their coursework, active in both the community and the world, and is supportive to each other. The teachers ensure you get a wonderful education during your time there and go above and beyond."
Sophomore,5,"I'm big on academics so that is what I based my rating on. The counselors know how to guide students into the right direction in terms of what career they see themselves occupying; if students are not sure of their path, there are a plethora of classes to take to figure it out. Besides the academics, there are Division 3 sports and recreational sports including basketball, volleyball, field hockey, and many others. The location of the school is more on the suburban side but there are buses that come everyday (some free ones!) that take students off campus and into more city atmospheres. In addition, students can take classes at other schools in the area that not only count for credit but allow for students to make more friends."
Junior,5,"Mount Holyoke College is an oasis of learning in itself. It is a wonderful environment for all types of people, especially because of its liberal environment. It is a space to explore self-identity and to be accepted in every step of the way. It is a place where your academic passions across the board meet, as requirements for completing a major are well-paced and there is plenty of space to explore passions outside your major. The campus is relatively small and accessible from all residence halls. Faculty and staff are renowed and more available to students here than anywhere else."
Sophomore,5,"Mount Holyoke College is a lovely, accepting institution. It creates a beautiful community of bright students who engage in rigorous academic discourse in and out of the classroom. Though at times the administration is a bit self-serving and secretive, all the positives outweigh this part. My only suggestion is that they make good on their promise of being a liberal and progressive institution by becoming a sanctuary campus and divesting from fossil fuels. But otherwise it is a great place for a student wanting an academic challenge and looking for a loving community that will be supportive and understanding no matter your background."
Freshman,5,"At Mount Holyoke College, everyone is really nice and the academics are of high ranking. You are introduced to new programs and connections with other colleges as well. They also have a variety of majors and courses to choose from and along with it comes helpful advising and encouragement form peers and staff.  During the day, you see the seasonal change in the environment around and breathe in the fresh air. Also, to help with stress, professors are amazing with helping with whatever you need."
Freshman,5,"I 'm coming as a freshman; however, I have visited campus and meet some of the students and faculty members.  They all were very welcoming to students  in the program I attended. They atmosphere is very friendly and peaceful. Professors allowed us to attend their classes and we were able to ask questions. Overall, an excellent experience, and I can't wait till I become an official freshman."
Sophomore,5,"Mount Holyoke provides multiple opportunities for students to thrive academically. Internships, study abroad, research opportunities, Mount Holyoke has it all!"
Alum,5,"Mount Holyoke College is a liberal arts college located in South Hadley, MA. Its student community is comprised of people from across the world and from all different backgrounds and identities. The thing they have in common is a striving for excellence and a pursuit for justice and ethical practices. The professors employed at MHC are incredibly qualified on the whole, and give ample instruction and direction to students. MHC is also a part of the 5-College Consortium, which allows students to take courses at the neighboring Smith College, Amherst College, Hampshire College, and University of Massachusetts, Amherst."
Sophomore,5,"I just completed my first year at Mount Holyoke and I really love it there. The professors really care about their students, and the campus is beautiful."
Senior,5,"Mount Holyoke College is the best decision I have ever made! There is a huge variety in terms of nightlife on campus and off. Whatever Mount Holyoke and South Hadley lack, the other college towns and schools make up for. The best professors you'll find. Great sense of community. Wonderful traditions. It feels like a summer camp with homework."
Freshman,5,"My experience at Mount Holyoke has been exemplary so far! The academics are hard, but fair. The professors are dedicated to their work and their students, and most of the people are genuinely excited to learn and change the world."
Niche User,5,"Mount Holyoke is a fantastic women's college in Massachusetts. I visited in March 2015, and I had a wonderful experience. Campus is beautiful, the people are friendly, our tour guide was extremely competent, and I came away feeling inspired."
Freshman,5,"Mount Holyoke College is an amazing institution. The faculty and staff are amazing, the students are brilliant, and the campus and facilities are wonderful. "
College Sophomore,5,"I love every single professor I've had and I've enjoyed every class, even one's outside of my major that I was taking just to fill a requirement. Only thing is - I wish there was a larger variety of classes offered."
College Sophomore,5,I feel unbelievably safe on my campus because it is a small women's college in a rural area.
College Junior,5,"While Mount Holyoke College is far from perfect, it has been a place where I feel physically and emotionally safe; the things that matter most to me are the things that the school offers: kind students of diverse backgrounds and identities, academic support, physical safety initiatives, and basic needs of daily living (food, water, living space) are all met.  These are the things that matter most to me that I have been satisfied with at Mount Holyoke College.  I absolutely love the athletics program, which is another important piece of the experience to me.  The fact that I have been able to compete alongside like-minded caring individuals towards a common goal of teamwork and success has been a privilege to me that I greatly appreciate.  After I leave MHC, I will have these friends who I met on and off the athletic fields.  The relationships will surely remain even after I graduate, which is very valuable to me.  This ability to make lasting connections with kind, inspiring, likeminded and caring individuals is an aspect of the school that I will forever me thankful for no matter what minor flaws the institution has."
College Junior,5,"I am so fortunate to be able to be a varsity athlete at Mount Holyoke College, and I am grateful for all of the athletic opportunities available for students like myself."
College Junior,5,I never thought that I would enjoy school as much as I do at Mount Holyoke.
College Junior,5,"Very diverse along every dimension except politically, although if your party is inherently exclusive to minorities I don't really think it should count."
College Junior,5,"I've chosen a very in-demand field, but I've heard from other students that it's fairly easy to find a good job in their fields as well."
College Junior,5,Couldn't be any more grateful that I was able to transfer to this amazing school.
College Junior,5,"Probably the only thing students are afraid of when walking across campus at night is the ghost of a past student, rumored to haunt the campus."
College Junior,5,"Some dorms are better than others, but even the ""bad"" dorms are for sure way above the national average."
College Junior,5,The athletic facility is very new and updated.
College Junior,5,"I was a transfer student and I can't begin to explain how much better my life is going to Mount Holyoke. I'm challenged, intrigued, and happy."
College Junior,5,Great diversity as far as nationality/identity goes. Very liberal campus.
College Junior,5,"Great classes, small size, brilliant professors who are kind and welcoming."
College Junior,5,"We live in palaces, practically. Love my dorm, second year running."
College Junior,5,Can't imagine myself anywhere else.
College Junior,5,I've never felt unsafe on campus. I study in the library past 12am almost every night and have never felt uncomfortable walking back to my dorm alone. MHC feels like a safe haven.
College Freshman,5,"In one of my classes, international students made up 99% of the class. People have varying religious, political, sexual and gendered views but everyone is accepted, except when some people try to pretend to be very ""woke""."
College Freshman,5,"If you don't drink, you'll still have as much fun even more than those that do. Also, drug use is frowned upon even by the student body, except for weed and tobacco cigarettes, so if you are caught with any hard substances you'll get in serious trouble."
College Freshman,5,"Mount Holyoke's campus housing is by far the most beautiful I have ever seen. Many of the buildings are older and have a lot of character. Despite the age of the buildings, they are updated on the inside without losing any of the charm. Doubles range in size, but most are fairly large. Many of the singles are also on the larger side. The housing system is very practical, and the Residential Life staff tries very hard to place compatible roommates together. The campus housing is also very unique, in that several housing buildings contain dining halls within them. The Residential Life staff who reside in the dorms are known as Community Advisers, and they create such a positive sense of community within their respective halls and floors."
College Freshman,5,"I have not been at Mount Holyoke College very long, but already I feel as though the college has made me into a better person. The academics have challenged me intellectually, and have made me expand my boundaries. The professors truly want their students to get more out of class than just a good grade. They want everyone to move out of their comfort zones and learn beyond the materials. As a women's college, Mount Holyoke is very empowering and truly believes in the value of all the students there. It has been so accepting of every student, not regardless of, but because of sexual orientation, gender identity, race, ethnicity, and national origin. The diversity of Mount Holyoke is something the school prides itself on in addition to academic success. Both of these characteristics of the school have challenged my general belief systems, and made me think more about the state of the world, and what I can do to change it. As a first-year student, Mount Holyoke is already empowering me to confront injustices, and make a change for the better."
Sophomore,4,"Mount Holyoke College is a great historically women liberal arts college that has great academics, and an amazing community, a strong athletic program, and a fun dining hall."
Sophomore,4,I found my home here at mount holyoke. The people I met for classmates and professors were amazing and the community is really what made Mount Holyoke special. The team of faculty is sometimes hard to communicate with.
Freshman,4,"Establishing myself at MHC was pretty easy, people were very friendly and understanding  with me coming in. I was scared being away from my family and home, but I grew and found another place to call home in MHC, and the students and professors became my family."
Freshman,4,"The online classes I took were not meant to be online. because of the COVID-19 pandemic, the campus closed down, forcing all classes to go online. it was hard at first as it was very unexpected for the professors making them less prepared and difficult. but, as weeks went by, it slowly got easier as I entered a routine."
Sophomore,4,"It is a PWI and I would love for a greater emphasis on diversity and inclusion, and not just for show, but rather to create a lasting change where Black and Brown voices are heard and prioritized just as much as White voices. I love the campus, the classes, and most of the professors are great and really understanding, the area can be quite boring, and the party scene is not that great. Most people take the PVTA to Northampton or Amherst for parties, events, and general outings."
Freshman,4,I enjoyed my 1.5 semesters but often found my time on campus to be very lonely. It does have a very beautiful campus  and the counseling services were very good and attentive.
Sophomore,4,"I love MHC. Students here are able to take initiative and play an active role in forming their education. I would, however, like to see financial aid become a bit more inclusive."
Alum,4,"MHC is a truly unique experience! As a historically women's college, it provides students with many wonderful traditions, as well as loads of opportunities that traditionally co-ed schools do not offer. Minority voices are held in higher regard, and students take charge of their own futures. The administration could use some turnover, as it does not fully and/or accurately represent the student body. Some departments (STEM) receive more funding than others, which is unfortunate, but predictable. However, I found the community to be wonderfully passionate and loving."
Freshman,4,"I love how safe I feel at school! There are so many resources for students to tap into, and the campus is GORGEOUS. I constantly feel lucky for being there. It took less than a month to be calling the campus home! 

You can feel some divides between some student groups, but you find your tribe after getting used to the environment. I often find myself forgetting I go to a gender-inclusive college!"
Sophomore,4,"Mount Holyoke is a great community. The classes can be challenging but the professors care about your success and will help you along the way. My main issue is dining, the food is alright but it is never properly labeled which has led to allergic reactions or just people eating things that is against their beliefs. Also, because the buildings are old things are often broken or there are a lot of bugs."
Alum,4,I really liked my time there. The psychology department was nice and I was able to access some research opportunities there.
Freshman,4,"Mount Holyoke College is an incredibly tight knit and supportive community. The dining hall food is gourmet with lots of variety and the trees and nature surrounding it is gorgeous. My only complaint is that the location of the school is not in a typical college town, so ordering pizza is difficult because there aren't too many places nearby."
Freshman,4,"Overall good. academics are challenging but I learn a lot. food is really bad. the campus is really beautiful, esp in the fall even in the winter when it snows outside."
Freshman,4,I like the athletic department and how much they genuinely care about you as a student and an athlete. I would like to see better financial aid!
Freshman,4,"Before arriving at Mount Holyoke, my thoughts on Mount Holyoke were neutral as I knew only the basics of the college. I only knew my roommates name, my advisor and my the classes I had registered for. Over the course of freshman year, I have realized how grateful I am to be attending this school."
Senior,4,There are a lot of unique experiences here. It offers a tough curriculum and a community of intellectuals. A great women's college.
Alum,4,"I am so thankful for my experience at MHC! I graduated a few months ago and am missing its beautiful campus, dedicated and motivated students, caring professors, and the over-all learning/classroom experience."
Freshman,4,"The professors are excellent teachers, and very caring about each student. In terms of grading, they tend to be rigorous but fair. The college environment generally is also multicultural and very supportive. However, the location is quite isolated and there is very little to do outside of campus."
