Freshman,4,"August 31st, 2018 I officially became a Freshman at MHC and it's currently September 26, 2018, almost a month into my ""Firstie"" experience, and I have really made the right choice in coming here from South Florida. From the people I've met and the friends I've made to the amazing vegan food in the Dining Commons (A.K.A Super Blanche), my experience here has been nothing short of stimulating. My classes are mostly small, my largest class has over 30 students, my residence hall and dorm are large and inviting. Everyone here is kind and accepting and you can really feel and see the community. I also work in the Dining Commons 3x a week, for Work Study, and it is manageable and fits perfectly into my schedule. There are regular parties and events both on and off campus and the PVTA takes students almost everywhere. Anyone considering MHC or not sure if it's the place for them should do as much research as possible, and feel free to contact me personally >> brayn22a@mtholyoke.edu"
Sophomore,4,"Mount Holyoke is an incredible college that I’m lucky to attend. In my first year of attending Mhc, I’ve done incredible things and I’m excited to see where my next three years take me."
Sophomore,4,"Mount Holyoke is a gorgeous school with an incredible academic program, historic traditions, and of course, M&C's. As a historically women's college, I thought I would miss being at a co-ed school. However, this is not the case. I love being in an environment I feel comfortable in and was able to make friends I really care about. I am giving Mount Holyoke a 4 out of 5 stars because, although I love it, it still has its issues. I wish Mount Holyoke had a more diverse faculty, especially in regards to the history program. I also wish that I had received more financial aid, though many people I know are very happy with the amount they receieved."
Sophomore,4,I have really enjoyed the atmosphere of non competitiveness with other students. The only one you're agains is yourself to achieve higher standards than previously. The campus is beautiful and there are many small study areas that are perfect hunker down in.
Freshman,4,Mount Holyoke College is an amazing school for those seeking a liberal arts education. Students are given the opportunity to take different types of classes and explore the various departments at the college. Class sizes are small which allows for more one on one time with professors who make the time to get to know you. The Mount Holyoke College community is accepting of individuals from all backgrounds which fosters a good living-learning relationship among students at the college.
Sophomore,4,My experience at Mount Holyoke was overall very good. I played varsity basketball and was very connected with the athletics on campus. It is a very diverse school with a lot of great people.
Freshman,4,"I have only been here for two months, but I am very confident that I made the right decision in coming here. The campus is absolutely gorgeous. MHC is consistently ranked in the top 10 for best campus and nicest dorms. Professors here want to be here teaching and helping their students. There are so many programs throughout the week to make MHC students more successful in their classes, internships, interviews, and future jobs. We have over 100 clubs, so there is something for everyone. Traditions such as Mountain Day, Founders Day, Elfing, First Year Plants, and Pangy Day enrich the campus and connect current students to past generations. Attending a women's college and specifically MHC has bolstered my confidence and self esteem."
Freshman,4,I love MoHo for its diversity and career education but don’t put me in a double room that is as big as a single room.
Freshman,4,"The campus is absolutely beautiful - both in the fall and winter. It's basically like going to Hogwarts. Mount Holyoke is also very generous with financial aid, especially for international students as they're also working towards increasing the diversity on campus. I genuinely prefer the small class sizes in contrast to the large lecture halls in other colleges because the professors actually get to know their students and vice versa which comes in handy when it comes to letter of recommendations."
Sophomore,4,"Good school. Interesting vibe, and had a hard first semester, but when I figure out how to go off campus on the weekend, joined a sports team it became a lot better."
Senior,4,Mount Holyoke is a great school if you're looking for  community and academics. The area is pretty quiet though but you can go into Amherst or Northampton to do more.
Sophomore,4,Mount Holyoke is an incredibly diverse and inclusive community. My experience here has been nothing but positive. The academics are interesting and challenging and the professors are easy to talk to.
Sophomore,4,"Mount Holyoke is a liberal environment with more conservative administration. Its a really good school for academics, but get to be studying all the time. There is a stress culture here. The student body is wonderful, but the administration is not so wonderful. If you have a problem that needs to be solved get ready to be aggravated.  Also housing is mostly singles and doubles. The rooms are nice for some of the dorms, others are very small and uncomfortable. I wish that they had more suite/ apartment living. Another thing is when you randomly get assigned a roommate, its a hit or complete miss and then its nearly impossible to try and move because of roommate complications."
Sophomore,4,I like the type of people I meet at Mount Holyoke. I would like to see a change in the school's form of support to help its students in the Accessibility's department.
College Sophomore,4,My best experience ever. Love Mandelles.
College Sophomore,4,My college is great. I am a transfer student so I am pretty consent with my choice now. This college has a really friendly community.
College Sophomore,4,The best part about this school is its intellectually engaging atmosphere and the strong sense of community and empowerment that comes from experiencing life at an all women's college. I gleaned a lot of useful knowledege from interactive class discussions. The teachers are quite helpful and supportive and I have made great friends!
College Sophomore,4,"The experience in dorms can vary widely. I had a great room in my first year with a window seat, a beautiful view and a building with a dining hall. Many of the rooms have beautiful features and no dorm is more than 10 minutes from the center of campus. There can be unusually small rooms, but many rooms are much bigger than you'd expect a dorm room to be. I love the social atmosphere of dorm life because there's always someone you know in common spaces, but even the party dorms are mellow enough for people like me who need quiet."
College Sophomore,4,"I love the accepting, safe environment at my school. I've met amazing people and had great experiences with all of my professors and staff that I've encountered. I get the impression that my school genuinely cares about me as a student across all departments. The only downsides to my college are the distance from my home and the high cost of tuition."
College Junior,4,"Mount Holyoke College has a strong alumni network from what I have heard.  Currently, I do not have a lot of knowledge about employers recruiting on campus or the career services.  This is something that I plan to look into as an upperclassman this upcoming academic year."
College Junior,4,"The Lottery process is somewhat confusing, especially for first-year students choosing for their sophomore year room assignments.  I have also found that certain Community Advisors are more lenient on rules than others and do not enforce rules consistently.  However, a lot of Community Advisors are great and helpful while encouraging a social atmosphere through hall and/or floor events for residents to attend."
College Junior,4,"It depends on what you're looking for. There's an *amazing* queer party scene that's inclusive to those who aren't queer, but you won't find a lot of dorm parties with boys."
College Junior,4,I haven't really heard of anyone doing anything besides weed.
College Junior,4,Alumnae network is top notch. Career center is definitely a useful tool.
College Junior,4,"Great Title IV protections, beautiful facilities that are accessible to athletes, non athletes and the at-large community."
College Junior,4,"I always miss MHC over breaks. The professors care about students and want them to succeed. MHC is definitely not an easy school, getting straight As requires a lot of hard work and dedication."
College Junior,4,"I love living on campus! There are amazing dorms and there are also dorms that are a little rustic. I have been a Community Advisor, so I loved being able to see how the residential buildings bring people closer. I've made so many new friends only because of my housing."
College Junior,4,"As I am halfway done with college, I have realized that I love Mount Holyoke. The campus is beautiful and everyone is very supportive and understanding. The teachers care about their students, from an academic and a personal standpoint. It can sometimes feel small, but the local bus system (PVTA) can take you off campus to the other colleges in the consortium or it can take you to the nearby towns (Amherst and Northampton). Mount Holyoke has made me more confident."
College Sophomore,4,"This school has made me realize things about myself that I wasn't aware of before college. I am more accepting, more articulate, and more empowered due to my first year here. I feel supported by my peers and professors everyday."
College Freshman,4,"Professors are really dedicated t teaching, atleast so far in my experience but they do give a lot of work! And some professors tend to have this skewed impression that only their class matters. But just be prepared to study, think and you'll be fine. And you can still have fun on some weekends too. But rarely, if ever, do you see people going out for parties during the week."
College Freshman,4,"Things are generally safe here,obviously don't leave your stuff unattended for too long but there's a 5% chance it would go missing. Campus Police installed these blue help signals around campus and tbh I go to my dorm ,which is the farthest, at 2am and still feel very safe but just be attentive and alert."
College Freshman,4,"Sports are not the central focus at Mount Holyoke, but they are greatly supported by students, staff, the administration, and even the faculty. There's never a shortage of involvement on and off the field for student athletes, whose teams of choice are treated equally and respectfully. The athletics facility is well-maintained, and offers high-quality equipment for teams. The school prides itself on its equestrian center, which is ranked as one of the best facilities in the country. Fans support both varsity and club sports with the same level of enthusiasm. As a rider for Mount Holyoke, I have found that the attention given to sports teams is more than adequate without taking away from the other parts of campus culture that deserve to be regarded with great care."
College Sophomore,4,"Our campus police are highly responsive and available. They have a number of programs designed to educate students about sexual assault, personal safety, and self-defense. A significant number of crimes on campus involve students from off-campus and alcohol at cross-campus parties. I feel pretty safe on campus and in the dorm. However, coming from a big city background, I don't think you should drop your guard when walking alone even in the most idylic setting."
College Sophomore,4,"This school falls into a ""baby ivy"" zone that allows access to top grad schools. The alumnae associate is intensely committed. I am only now exploring the possibilities of off-campus internships and school connections."
College Sophomore,4,"My time at Mt. Holyoke has proved that I am able to meet the emotional and intellectual challenges that happen at college and come up with my own solutions. I have learned to self-advocate, to live diplomatically with others, and to find my place in a highly energized pool of incredibly intelligent, strong-willed women. I find my classes and instructors challenging and our intellectual interactions pleasurable. The school has built a live-work space for us that bonds us in our standards of excellence as much as in sentimental ties to time and place."
College Student,4,Um... I think drug kind of is impossible to absolutely eliminated
College Student,4,"We have a lot of sports here. Horsemanship, golf and a lot of other games."
College Student,4,"I have to say that Mount Holyoke is a super amazing college, which give me extraordinary experience out of classes. Doing something like newspapers, video and internship."
College Student,4,It's an all girls school and it is safe and comfortable for all of the women
College Student,4,Getting a job it's difficult and there a strong connection with the alumni and a lot of support
College Freshman,4,The athletic facilities are really good. Just ask an instructor if you don't know how to use them and you'll be fine. Oha and they're open a lot and you don't have to pay.
College Freshman,4,"I've never heard of any crimes being committed on campus. I feel very safe, even walking alone at night on campus."
Sophomore,2,It was a very hard transition from regular classes to online classes. I hope it gets better for Fall 2020 semester.
Freshman,2,"Mount Holyoke College is admittedly academically rigorous. Professors are prone to assign a lot of readings, you're expected to 100% commit to studying. Slacking off will result in poor grades. Nonetheless, the problem I have with Mount Holyoke is its student body's intolerance toward people with different political affiliations. It's fascinating that those who constantly propagate the idea of inclusivity fail to uphold it themselves. The diversity of thoughts are often times villanized if they aren't in accordance with popular opinions (leftism). The school administration mostly avoids this due to fear of controversy. I find it disheartening that there is no direct support from the school itself, a college that promises to offer a rigorous, well-rounded education. I have been lucky enough to be taught by tolerant professors while I am aware that some professors cannot maintain their neutrality when the conversation is politicized."
Freshman,2,"Almost done with my first year at Mount Holyoke and not sure if I will be returning. Academics are not challenging—my high school courses were much harder. Professors are good and do care, which is why I gave two stars instead of one. Social life is absymal.  I have met very few people I want to be friends with, which I haven’t struggled with in the past. Many people are very, very odd or lack a personality, to a comical extent. Anyone remotely normal is vapid and shallow. There’s absolutely nothing to do here and the buses take so long that going off campus is too much of a hassle. If you don’t regularly party or use dating apps, there is absolutely no way to meet guys. If you are on the fence about MHC itself, an all-female environment, or don’t like partaking in cults, do not attend. Sit through the classes and see if they’re your cup of tea. For some people, this is the perfect environment. For me, every day here is hell."
Senior,2,"The academics are great, but the department requirements and lack of diverse courses and lack of  diverse course times makes it nearly impossible to finish your major. The administration is against you, they are very cheap and do not listen to the student body or student government. 
Financial aid will screw you btw. Although MHC says they will meet 100% need-based aid, they are the one who decided how much you need, which will be very little. You will come out of MHC with the same amount of loans as anywhere else BE WARNED."
Freshman,2,"My experience at Mount Holyoke has in no way lived up to my expectations.  Mount Holyoke is a great school for many people, but for a very specific type of person. I was excited for such a high degree of diversity, however, be warned that everyone at this school thinks/acts/feels very similarly. Yes, there is a lot of racial, ethnical,  sexual, and gendered diversity but that does not mean that there is diversity of opinion/thought. There is a prominent movement for inclusion which is great but I find it to be an ""up in your face"" movement where students spend a whole lot of time pointing fingers and not enough time truly embracing their college experience. Also, the school is incredible about emphasizing self-care which is so important for college students. Yet, this movement eliminates opportunities to take risks, and this vibe is especially annoying in the athletic department as the sport that I am a member of is very recreational."
College Sophomore,2,"The issues I take with Mount Holyoke are not in the school itself. The campus is stunning, the kind of place you'd be proud to point to and say, ""that's where I go."" The professors take the time to know their students--I took an Anthro lecture my first semester and the professor made a point of meeting with each of the 40+ students individually and talking with us about our interests. 

That being said, I don't know if it's the administration or the other students driving this, but the environment there is incredibly isolating if you do not subscribe to a very specific set of beliefs. I came from a small town, where I considered myself politically liberal and a feminist. Upon attending Mount Holyoke, I was unsure what to think. At Convocation, it was announced that Mount Holyoke would begin accepting applications from transwomen and anyone who identified as a woman or non-binary, etc. I didn't exactly know what this meant but, as the school year had not begun yet, I didn't think too much of it. 

As the semester progressed, I began to realize what this meant for me. I was constantly being asked what my preferred gender pronouns were, and told to check my cis privilege. At various org meetings, I learned that in a certain light, discussing menstruation could be transphobic. I was called a kink-shamer for my controversial belief that BDSM is abuse. I finished out the semester feeling alone and more out of place than I had ever felt in my life. Then it was announced that the student body would cease to perform 'The Vagina Monologues' on V-Day because 'not all women have vaginas.' That's when I decided I would not be returning. 

Mount Holyoke is a beautiful school, but it is extremely disheartening that America's first women's college is no longer a safe space for women to speak freely as women. If you're not 100% on board with queer theory or identity politics, maybe reconsider attending."
College Sophomore,2,"It's just the few places: Iya, Johnny's and the Froyo place."
College Sophomore,2,I usually go off campus for frat parties and house parties because on campus people call campus police too often to break up a party (even during weekends).
College Sophomore,2,"Dorms are more than 100 years old, poorly maintained and not well-heated. During winter, icy layers will be seen glazing over windows in dorm rooms, making it impossibly cold to live in; what's more ridiculous is that even under these circumstances, personal heaters are not allowed. The only good dorm is Creighton, the newest dorm (built in 2008)."
College Freshman,2,There aren't many parties here.
College Freshman,2,"No one really lives off-campus here. Mount Holyoke housing is good enough that no one really feels any need/desire to live off-campus, but if you do want to there are a couple of houses/options nearby."
College Freshman,2,Everyone lives on campus so no one really needs to look into off campus housing- it's unnecessary
College Freshman,2,There's hardly a party scene. Chapin parties are said to be the best but that's only if you pregame in someone's dorm. Parties are best at one of the other Five Colleges
College Freshman,2,South Hadley is a small town and very rural. If you want to go out anywhere you could take the local PVTA bus but I'd recommend bringing your own car. The food in the Village Commons in town is decent but you get bored of it.
College Sophomore,2,"Not that many people participate, but the team members do get to know each other well. Sports is not a big thing and our teams aren't that strong."
College Sophomore,2,"Food is very restricting. It's frustrating that you can only get food at certain times and that you are forced to have a meal plan. Even if you wanted to cook your own food, the grocery store is very far and it's hard to find a kitchen to cook in."
College Freshman,2,"I have never heard a story of a student feeling pressured to drink at gatherings. In fact, most students at Mount Holyoke refrain from the ""party atmospheres"" that would involve dangerous drugs or too much alcohol."
College Freshman,2,"The school recommends that students live on campus all 4 years. This isn't a problem as most Seniors and Juniors get singles. There aren't many apartment options for moving off campus, and most students choose to enjoy the wonderful dorms for all 4 years."
College Freshman,2,"Winter is truly truly horrible and you have to be prepared. The spring and the summer are gorgeous, and this campus comes alive during those times, but the weather is dismal in the winter."
College Freshman,2,"Its not that its not fun sometimes, because it is, but its just a little lame. Dorm parties are fairly dull and uniform and are usually either very very gay or are for straight girls to pregame before they go off campus looking for men.

Parties thrown in the campus center almost universally suck, but parties thrown in Chapin auditorium can be somewhat fun. Drag Ball is a good, quirky, queer time and certainly embraces an amazing piece of MHC's unique culture, and the parties thrown by MCHASA have amazing music, a more ""party"" feel and attract lots of guys. 

Just know a couple of things about this place. A: the party scene on campus is predominantly queer, if that doesn't jive with you and you want to meet men, be ready to go off campus. B: Expect no true ragers on this campus. You can find them at other schools, but the few that have happened here have been outliers, rather than the norm."
College Sophomore,2,"What is there is pretty good, but there aren't that many options."
College Freshman,2,It is very difficult to get off-campus housing.
College Freshman,2,"Sometimes there are great parties on campus--however, only the student org hosted parties. In dorm parties are very bad. But it is not hard to get to parties at Amherst College or the University of Mass, Amherst."
College Sophomore,2,You really need to go to other campus or travel a bit to get to bars
College Sophomore,2,"There is a couple of shops across the street, that are kinda nice. The town is really cute. But there is not much to do and where kinda isolated. If you drive or take a bus for an hour then you can get to places with some stuff to do."
College Sophomore,2,Rarely seen and if seen at some parties but not usually done by mount holyoke students but rather other college students from the local area.
College Sophomore,2,I am not from the area so I don't have a lot of experience with housing in the Western Massachusetts area but I do know that it is a mainly residential campus. Most students besides the Francis Perkins Scholars live on campus and it will be more expensive to try find off-campus housing.
College Sophomore,2,"Its a womens college so the quality of guys is very poor, but the girls are pretty average I guess."
College Junior,2,"I am not a fan of our night life, at all,  I am not a party person and the parties aren't the best. There are 4 kinds of parties at Mount Holyoke.

The Network:
The network is an org on campus that hosts black light parties and plays house music.

MHACASA - Mount Holyoke African and Caribbean Student Association
They have very popular parties that draw out guys from all of the colleges and people off campus. They play a lot of African and Caribbean Music. (there will be a LOT of guys there)

APAU
Their parties are similar MHACASA....but not really. MHACASA draws more people. They mainly play ""black culture"" music.(there will be guys there...but not as many guys as there would be at MHACASA parties.)

Academic buildings
Very grungy parties in academic buildings. People get wasted and make a mess of themselves.(you will not meet ANY guys at these parties)

Dorms:
There are dorm room parties and those can be cool...but there are also parties that are hosted in some of the common rooms and those parties are...interesting. People drink-non-stop and smoke up a chimney. By far the grosses parties, ever. (you will not meet any guys at these parties... the guys there, there might be one or two, are probably with someone.


The nightlife is my least favorite part about the school. I do not attend this parties. I have only attended these parties long enough to decide it wasn't my thing. Some people really enjoy the parties."
College Freshman,2,There are buses that take you to all the other 5 colleges on a regular bases. But they take a long time to get everywhere. Its about a 45 minute bus ride to get anywhere. Its better to have a car/ be friends with someone with a car.
College Freshman,2,"Athletics aren't a huge part of the social scene.  Within the athletic department, athletics are popular, but they aren't really well recognized by the other students.  Certain sports do attract more fans and attention than others, but there isn't a huge athletic following."
College Freshman,2,If you are 21 you can go to bars that arn't that far away but since it is a woman's college the parties are mostly off campus.
