College Sophomore,4,Drug use and alcohol is not tolerated. All students signed a pledge to not take drugs for drink alcohol at the beginning of their freshman year. Campus safety is a little slow but effective.
College Sophomore,4,"It is simple to get scholarships at bethel if your involved in many things. My main scholrships are from being involved with the music department. You can get scholarships for being in sports, the church match, or even having a sibling attend"
College Student,4,I like that we can use our meal plans at off-campus locations.
College Student,4,"Most of my scholarship money is simply based on my GPA, so it was easy to get."
College Student,4,I like the Acorn and Sufficient Grounds. The DC can get a bit boring.
College Student,4,It's great to live with my friends and have a community around me in the same building.
College Freshman,4,I personally enjoy living on campus at Bethel. The atmosphere is great on campus you get to know a lot of people that you would never talk to normally. Most of the dorms are rather well clean and up to date. The cost is a little too much for its location and the size of the school. But getting to classes are super easy and quick because everything is pretty close to eachother.
College Sophomore,4,The school makes a really big effort to benefit your future career path. Professors help to find you great internship and the academic office really tries to give students the opportunity to find great jobs right out of college. They see that importance in getting an education and make that one of their top priorities.
College Sophomore,4,"On campus we have very stereotypical types of Christian boys and girls. While this is not a bad thing, it does take away from individuality or creativity on campus. Many of the guys travel in packs and feel that need to ""bro"" a lot. Which isn't a bad thing, but when it comes to building relationships with the opposite sex it can be a bit annoying or even when trying to pursue dating relationships. Marriage is actually a big thing on campus, which can be encouraging and also obnoxious. Many girls come into Bethel looking to get their ""M R S (Mrs.) degree"" a.k.a finding a husband. This can be discouraging to other females and maybe males because there is that pressure to get married. And it gets annoying a lot. Since we have stereotypical christian boys and girls, there isn't much variety when it comes to meeting different people. Or at least you have to try and find people who are different and are creative."
College Sophomore,4,"We live on a small campus in the middle of a busy town area, so not many people know we are even there. Since we are a smaller campus we don't have a big security team. There is no crime or unsafe things that happen on campus. While this doesn't happen it is still possible for anyone to walk onto campus and commit a crime."
College Sophomore,4,"For a small school we do have a lot of involvement in sports. Our track team is really big and very predominant on campus. We are actually getting four new sports to the school including men's rugby, men's lacrosse, women's lacrosse, and a drum line. A lot of students attend sporting events, but could be a bit better when it comes to school spirit."
College Senior,4,its a good place to stay
College Freshman,4,The Counseling availability is good. There are a number of events throughout the year to promote health. If sexual assault is an issue no one talks about it.
College Freshman,4,This school is pricey. But if you deserve merit aid you get it.
College Sophomore,4,"The strictness is sometimes nice. Transferring from a school where there were no enforcement of rules and not much care for the students well-being, the strictness is nice. I don't have to worry about drunk tirades on my floor or pot smelling up the halls. The only downside is the no dancing rule. Its dumb."
College Freshman,4,"They are very strict about the dorm visits, drugs, and alcohol."
College Freshman,4,"Over all, the housing at Bethel College is pretty great. The dorms even in the freshman buildings seem to be more spacious than that of other colleges I've visited or heard stories of, and the community is excellent. All of the dorms are pretty very close to everything you need to get to, granted it's a small campus."
College Sophomore,4,"Administration isn't perfect since they won't let us dance, but they do their jobs well and with grace."
College Sophomore,4,"Whatever kind of food you're in the mood for, whether fancy or fast food, there are many options."
College Sophomore,4,Nice dorms that have a good mix of both hall style and apartment style. There's something for everyone.
College Sophomore,4,"This college is in a nice, average size town that has enough to do off campus that you won't be stuck on campus."
Alum,2,"Good professors - they care about you, and it made me stick with Bethel. The students are some of the most inward looking individuals. Bethel does not prepare you for real life. The emphasis on Jesus and ignoring how the world really functions ails graduates once they enter the real world. Graduates of Bethel College will be disappointed that you can't just pray for everything in life when life pushes you down. The number of my fellow graduates who land serious roles after graduation or a few years afterwards is low. I still see graduates working as servers or are totally clueless on how they can take advantage of their bible majors. God's calling I suppose."
Freshman,2,The care more about grades then the religious aspect. The teachers don’t know how to teach and the advisors are rude and make you feel bad about yourself. They ask for a lot of money but yet the campus looks like trash
College Freshman,2,We are not allowed to have parties.
College Freshman,2,Academics are easy. I was at the top of a large class and this school did not satisfy my academic needs.
College Freshman,2,I was basically silenced at this school because I am lgbt.
College Junior,2,I hate snow and cold weather and it ruins socializing and commuting
College Junior,2,Tuition is high and it is difficult receive enough aid esp. if you do not have really high grades
College Junior,2,It is not always reliable esp. if you are a commuter and do not drive.
College Junior,2,Most people are homogeneous. There is not much diversity here.
College Freshman,2,"self transpo, I wish there was transpo to clinicals etc."
College Freshman,2,"Sexual orientation is discouraged as it goes against the beliefs of the college's stated religion as the college is a private religious school. We strive towards acceptance, and there is a lot of diversity for such a small campus however I know of other colleges that have a larger diversity."
College Freshman,2,Being in the midwest the winter months can make it miserable.
College Junior,2,looks of cold and snow
Recent Alumnus,2,"School Seems Desperate – Bethel is so quick to offer just anyone a scholarship for the field they are entering, whether they are actually qualified for it or not. I have seen so many students getting into certain departments and they should not have been. It seems that Bethel is so desperate to grow their programs that they will not turn people away, and they will give scholarships to anyone who applies for them, even if they shouldn't be receiving one. This is what made me question my music scholarship, because at first I was so excited to receive one and it made me feel so much more confident in my skills as a singer. But then I saw other people coming through our music department with scholarships who did NOT have the musical talent that was deserving of them. They only got one because the music department was so desperate to grow. I don't like that."
College Sophomore,2,"When PM classes start, or when there is an on campus event parking gets filled up rather quickly. you may end up walking quite a distance from your class"
College Senior,2,"The town and surrounding area has good shopping and food options, bt there just isn't a lot to do in Mishawaka."
College Student,2,Bethel Is Small Sharing Rides Is Often the Best and Sometimes Only Option – South Bend Airport is only a few miles away from Bethel but not many students need to use it. Most students that go to Bethel live close by or less than a day away from the campus. As a result many students find that bringing their car and simply driving to school is the best option.
College Junior,2,Unless you go to the dinning commons there isn't much variety.
College Junior,2,"During the winter seasons, the snow can get ridiculous as the campus receives lake effect weather from Lake Michigan. Since the campus is small, the snow doesn't affect travel to classes, but transportation outside of campus can get rather hectic at times."
College Senior,2,"There are all types of people in the adult program of all different races, sizes and shapes."
College Freshman,1,We don't have any of these things so I wouldn't know.
College Freshman,1,If you thought your parents were bad.... Administration is super strict and there are rules regarding things like sexuality that are totally unnecessary.
College Freshman,1,Bethel kids think a party is dancing in a barn to outdated pop music and drinking water. Also being terrified of someone brining alcohol even when no one here drinks. This happens like once the whol time you are at school. If people party no one knows.
College Sophomore,1,"We don't have any Greek Life, and I wish we did have some kind of option."
College Junior,1,This past winter was the worst. It was so cold. We never saw the sun.
College Freshman,1,There is never anyone on campus so it's kind of scary at night
College Junior,1,do not have I am an online student
College Student,1,"Northern Indiana is right next to Lake Superior as a result Bethel has sometimes very odd weather due to the lake effect. the weather can be very drastic and fluid, it'll be freezing one day and hot the next. sometimes its hard to know what season we're actually in."
College Freshman,1,Small Christian College – Bethel is a small christian college so the students who choose to attend fit the same basic mold. BC is mainly white with a slight diversity in religious preference.
College Freshman,1,There are no transportation options unless you have your own car or can ride with a friend that has a car.
College Freshman,1,What to Do – Night life/social life is weak here. Wish there were most options.
College Freshman,1,This Is a Christian College – Drug and alcohol use is forbiden and can be penalised because Bethel is a christian college but people don't complain because most students are christians who prefer to stay away from that kind of behaviour
College Senior,1,No Restaurants – The campus has a dining hall but there are no restaurants on the campus. It is a fairly small campus.
