Alum,5,"Very welcoming community with excellent academic staff and support, a wide variety of extracurricular activities, a beautiful campus, and something for every student!"
Niche User,5,"don't have experience yet.I am a senior thats planning on going here, but so far they've been amazing"
Niche User,5,greats at responding and getting back to you on emails that you've sent in. Super nice and caring! All ways keeping in touch with you and check up
Freshman,5,My online class experience was excellent. I took most of them online. My professors made sure to cover every aspect that needed to be covered. If I didn't understand something to kindly explained to me the process of the situation and guided me into path of success.
Freshman,5,I liked everything about the University of Central Arkansas. The people I met so far are polite and helpful. They are guiding me to achieve my goals in life and investing their time and money into me so that I can benefit.
Freshman,5,"I truly enjoy being a student at UCA. The campus is clean. The Faculty and staff are friendly and helpful. All of my professors are available during class, online and after hours to assist their students. The food is great. Campus life is pretty good considering the pandemic and social distancing guidelines. I truly look forward to spending the next few years of my life becoming who I am meant to be at UCA"
Freshman,5,UCA is amazing! Go Bears! UCA is a great college. The campus is beautiful. Teachers are friendly and the students are focused and goal driven.  I absolutely love my school as you can tell. I am looking forward to spending time learning and preparing myself for the world here. I have no doubt I will be a proud alumni!
Sophomore,5,"The staff do everything they can to make sure you have everything you need to be able to focus on learning. The classes are fun and the teachers are enjoyable. Overall, it is a fun place to attend."
Freshman,5,I am super excited to be attending this university in the fall. I have no idea what to expect but I hope my college experience will be unforgettable and I will be able to create memories with new friends that I will cherish forever!
Freshman,5,I have yet to take any online classes! I am excited to see what challenges and obstacles I will come across.
Senior,5,"Overall, attending UCA has been one of the best decisions I have ever made. I truly believe I was meant to be a student here. I have made lifelong friends here and the college has helped me plant the seeds for my future. In every situation, I believe UCA has held themselves profoundly and continue to be an example of what a college should be like."
Sophomore,5,"Its very diverse and the staff is helpful. There are a lot of fun on campus activities that you see everyday, and the food isn't too shabby."
Alum,5,UCA made me feel right at home . They want you to succeed and make it easy for you to fit into their environment. They have a lot available  for extracurricular activities to academics. I LOVE UCA!
Alum,5,The professors want you to succeed and will help you every step of the way ! The classes are small ( what I am use to ) and I love the student /teacher ratio!
Freshman,5,The University of Central Arkansas is an amazing school to attend. The student life is so fun to be apart of!
Freshman,5,"Most of all my teachers are nice, food is pretty good, and the campus has a lot of student diversity so you can find stuff for everyone. It is just the right size of campus for me not too small and not too large."
Freshman,5,I love how they are all about learning. They make you work for good grades and don't believe in slacking. It's a beautiful community and I cannot wait to graduate from here.
Freshman,5,"UCA has a gorgeous campus, and from what I've heard, there is a fabulous biology program, even for those considering wildlife biology rather than pre-med. The dorms are a little larger than normal, and there are accommodations for service animals."
Senior,5,"Truly recommend UCA to everyone. As an international student and former student athlete there are so many resources available for you to feel as though you have a home away from home. The campus is beautiful as well especially in the Fall/Spring. The professors really care and want you to learn and grow and I strongly recommend the EXSS department.  Also, the size is mid-size so not too small but also not too big so class sizes are nice which definitely helps with learning. Overall I would strongly recommend anyone to attend UCA."
Sophomore,5,I am a sophomore in college and I really love it! The atmosphere here is so kind and accepting and the campus is so diverse!
Freshman,5,"Great school, lots of resources, on the cheaper side when it comes to colleges. Feels like a small safe community."
Niche User,5,I would like to further my education at UCA because the overall feel of the campus is so inviting. It feels like home as soon as I arrived. I even attended special programs at this college during my high school career. This university is a beautiful place.
Alum,5,UCA was a place that felt like home. My professors were committed to my educational and personal growth and I had access to numerous academic and professional opportunities that have served me well as a college graduate.
Sophomore,5,"I love this school. The class sizes are small and the campus is really focused on diversity. There are also a lot of benefits that are included in your tuition, such as the Hyper center (for gym activity) and access to the writing  center for tutoring."
Sophomore,5,I enjoy the University of Central Arkansas.  The campus is beautiful.  The professors are outstanding. The diverse student population makes it an interesting environment .
Niche User,5,They are great with their tours. I am planning on going there. My brother loves going to college there.
Niche User,5,"Very helpful in admissions. I called after I messed up my email, and they went in and fixed it for me and helped me with some other things while they were at it. Overall, I was very pleased."
Freshman,5,"Thus far from working with the administrators, they seem to really care about making sure that you're successful and can find good job opportunities after college. So I so far would definitely recommend."
Freshman,5,"The campus is very pretty, but it's looks kind of old and run down. It's somewhat rustic but also feels a little dirty/outdated."
Senior,5,"I love this school because first off, they are do take care of their Veteran Students which I am. They help you out any time you have questions and even contact Admissions if there is ever any issues that need taken care of. The Campus is great with lots of places to study."
Freshman,5,"It is very family oriented with the professors and staff!! Once entering the campus for Bear Facts Day, it is very welcoming and I loveeeee it.  The atmosphere is just like a home feeling and my parents really enjoyed their visit and we decided this is the college of our choice."
Sophomore,5,"I like the diversity that UCA has to offer, as well as the student life opportunities. The campus stays clean, and is well put together, as everything is easy to locate. The teachers are very nice, and are always willing to put things aside in order to make sure the students needs are met. I think that UCA could add more food in the food court, which would draw a bigger crowd and better business."
Junior,5,"I love how close to home UCA is, the amount of diversity and the great campus food! I think it’s a excellent place to attend to get your education."
Sophomore,5,"I love how there are many activities to do at the University of Central Arkansas, such as concerts, Greek life, and the Hper. Going Greek has brought me many life long friends that I could never replace. The Hper is huge and has many workout machines. The staff at The University of Central Arkansas always seeks to improve the campus and are curious about what the students believe could make college life more enjoyable. I often get surveys of what I believe could be improved, and the only thing I ever say is the parking. I love The University of Central Arkansas and I couldn't see myself attending another college I have made many friends in college and there is never a dull moment. The University of Central Arkansas has brought me many memories that I will never forget."
Alum,5,My overall experience at UCA was amazing. I enjoyed all of my instructors from General Education to Honors to Spanish to Linguistics. The Study Abroad department helped me study abroad on two separate occasions. The campus itself is beautiful.
Junior,5,"The campus is stunning. I love that everywhere you go, a friendly face can always be found. The professors want you to succeed and give you all the materials needed to succeed."
Freshman,5,It is a smaller state school where you can get to know more professors. The dorms are designed to help students get to know others in their field.
Sophomore,5,UCA is a very inclusive and open-minded school.  UCA's campus is very welcoming.  The volunteers and staff on campus are very helpful and understanding.  I love UCA and the environment it has provided for me to grow and learn.
Niche User,5,"I personally enjoyed the atmosphere of the campus and the people on the campus. I am going there to play indoor volleyball so the coaches really sold me on the school. By being so nice and helpful, I choose this university to be my home for the next 4 years."
Sophomore,5,"My experience with the University of Central Arkansas such a great one. Many memories were made and also a few long lasting friendships were made also.  They're is a vast number of facility members ready to serve each student and help each single person in there walk in life. I have been one of those students who had been helped by the members at UCA. As a first generation attending at UCA, it was such a great experience overall because of the help I've received and the push I was given to strive for more."
Niche User,5,"I love the campus. It is layed out in a square shape, and is easy to navigate. They offer a lot of classes and have a reputation for professors that care.  UCA offers a variety of courses in multiple degrees.  The quality of education is supposed to be excellent.  I like all the degree fields, and they continue to change and provide new opportunities for growth.  I also like the athletic program, and I would love to play baseball for them in the future.  I hear great things about the professors...especially about how much they care for their students.  There are many student activities available including SGA, intramurals, different clubs and organizations, Christian organizations, and on-campus dormitories."
Freshman,5,"The University of Central Arkansas is voted #1 in the most beautiful campus in Arkansas and that is definitely not a lie. UCA is filled with so many wonderful opportunities for students of all ages, ethnic groups, and much more. I highly recommend anyone to UCA!"
Freshman,5,Love this college its so pretty and amazing to be at. I stay there every year for band camp and love it so much.
Graduate Student,5,"I loved getting to be part of such a great sports team and there are so many things going on campus that I didn't want to miss out. Student Activities does a great job of entertaining students and fulfilling needs of the students from all different backgrounds and cultures. I learned a lot just by attending events to make European, Asian and Spanish students feel welcome."
Niche User,5,"I'm an upcoming freshmen at the University of Central Arkansas; though I have only visited there a couple times, the few times I have visited I've always felt such a warm welcome and the feelings of a good and friendly environment. The campus police are very protective over not only the campus but the students and I love how all around the UCA campus they have emergency buttons just in case danger occurs or help is needed. The cafeteria has such a wide variety of food it's amazing! The dorms are very nice and are slowly getting renovated from what some of the staff informed me on. I also got to meet one of the professors in the Behavior Health and Sciences, he was super nice and friendly he also was very great on not only giving advise but also relating it back to his personal college experience at UCA. All I can say is now is that I am beyond excited to start college, further my education  and make new friends at my home away from home at the University of Central Arkansas! GO BEARS!"
Freshman,5,"The school has a great atmosphere, focusing on educating ALL and providing a deverse, challenging method of learning. The professors and administrators take time with their jobs and genuinely enjoy themselves. There is a lot of effort in communication for students."
Freshman,5,"UCA has a very good autism and disability support program, they are very willing to work with you if you have issues"
Junior,5,"I love it here! Such a beautiful and diverse campus and MANY professor that genuinely care about are success. There are so many resources for students and even the faculty. Also, there is always some activity to get involved in and several opportunities to get volunteer hours. I do not regret choosing this university!!!"
Niche User,5,Staff and tour guides were really friendly and welcoming! The campus is very beautiful with many new upgrades. I loved the idea of residential halls and I can't wait to be there next year!
Niche User,5,"I have toured the campus one time, and I enjoyed every minute of it. I am going to be a senior next year, and I hope to be enrolled by the fall of 2020."
Niche User,5,"This campus is great for someone looking for a college where they never have to leave! There's great food served in the cafeteria, a mini food store, a post office, and much more for students to use."
Graduate Student,5,"I love the people here, the campus is beautiful, and I love working and attending classes here. I feel at home once I step foot on this campus."
Niche User,5,The college is very up to date and beyond beautiful! They really do try their best to help the students! <3
Senior,5,Everything!!! This is an amazing school! The academics are amazing as well as the faulty. There are so many RSOs on campus that help you get involved!!!
Niche User,5,"The University of Central Arkansas is my first choice of universities. Their campus is beautiful and diverse. Conway is a beautiful city because there is a lot to do in the city. The University of Central Arkansas has a range of opportunities to choose from, major-wise."
Senior,5,Diversity is a huge thing I like about UCA. So many cultures and backgrounds surround you. Everyone is so friendly. Their academics are outstanding. They have some of the most competitive programs in the state and nation.
Niche User,5,Its  a GREAT campus and I can't wait to go in the fall of 2019. They are very welcoming and it seems like a great place to start my education for the next stages of my life.
Niche User,5,"The University of Central Arkansas is well located school in Central Arkansas. Professors go above and beyond for each student. The students are family. The campus is gorgeous, and is always well maintained."
Freshman,5,I am a freshman this year and so far the staff has been very helpful and excited for you too be here. It very hard to not be excited about this school with so many smiling faces and uca pride. I’m very honored to have attended such a great school as this
Niche User,5,"Right when I visited campus, I noticed the beautiful landscaping and new buildings. The people were so friendly and welcoming!"
Senior,4,"The campus and the staff are amazing. It still lacks things that almost every campus does, food options, accessibility, insane tuition, but overall I have loved my experience here."
Senior,4,So far my professor have done a great job at making students feel safe and heard with their concerns on in-person learning. We have all adapted to almost complete online learning with only a few short classes being held in person with social distancing.
Alum,4,"I never personally took an online course, but I heard from other students that had positive experiences."
Freshman,4,I have heard very good things about this college.  I have family members who have went to the college and that is one reason that I chose to go.  As well as the nursing programs that are offered!
Freshman,4,I feel that online anywhere can be challenging.  So based on the school they are fine but based on what we have to have on a personal level is okay but it takes time.
Senior,4,"Due to COVID-19, all classes were forced to become online courses. This transition was not easy, but UCA made it very comforting. The professors were prepared as if they knew there was going to be a pandemic! They communicated effectively, for the most part, and were always prompt."
Senior,4,The University of Central Arkansas is a student centered campus that focuses on student success. There is a culture here that I have never experienced before. Each professor and many of the students feel like a family away from my own family. The classes are very engaging and are medium in size! This allows one-on-one interactions with the professors!
Sophomore,4,"The classes went well. Patience can be a difficult quality to demonstrate at times, but the instructors handle issues reliably."
Senior,4,"It was an entirely new environment that I had to adjust to. I was nervous at first about being at an entirely new university, a new city, very different surroundings. UCA made the effort to adjust to a new social/educational classes easier by offering resources such as clubs, work-study offers, and restricting classes to a fair student-to-teacher ratio."
Senior,4,"The online experience has been very different, especially since the COVID-19 pandemic, and as expected feedback time is nowhere near in-person classes, but UCA has offered excellent resources to make the transition easy as possible by offering tech grants and flexible and understanding professors"
Junior,4,"I love UCA, its very welcoming and it is a family like atmosphere, but with anything there is always cons. I think that they can work on there diversity and having more professors that are minorities. They can also work on getting more parking and having more spot available for classes that are necessary for graduation."
Senior,4,"I am a student who struggles with online classes. I need in class sessions to understand material. At UCA though, I have found that their online structure has helped me grow in my understanding. Professors are there for you and can help you learn at your own pace. All you have to do is ask for assistance and they are there to help."
Sophomore,4,"I prefer learning in person so I wasn't the best at online classes. However, the professors take great care in making sure students understand the assignments and are great at answering any questions you have."
Sophomore,4,UCA is a wonderful school that celebrates its students and helps every student succeed. The president of the university loves to get involved in students' lives and will make sure your experience at the school is amazing. He comes to every sports event and loves interacting with students. This school is very diverse and celebrates everyone's differences.
Alum,4,"I loved UCA! I met so many people as well as formed bonds with professors that I will value for the rest of my life! The professors really work with you to make sure you understand the material, and there are so many resources for you whenever you need help around campus!"
Freshman,4,The University of Central Arkansas is a beautiful campus. It is located in a great city with many things for college students to do.
Freshman,4,I enjoy the welcoming feeling of safety on campus. I like the diversity of cultures and races on campus between students and professors. The resources we are provided are very nice.
Sophomore,4,I love the the friendliness of the instructors and the willingness to help students. The environment of the campus is very welcoming and clean in the sense of how put together the campus is. Student life is very important to me and UCA has great student life and it shows that the students really enjoy being there.
Freshman,4,"All of the staff is kind and welcoming, the students are even more so. I went for a band audition and was greeted by many staff members and was befriended by a student immediately."
Freshman,4,I really loved my visit. The staff was incredible and the food was great. Only problem was the amount of construction going on.
Freshman,4,"I have had a good experience with UCA so far, but the changes I would like to see is that the University decrease their tuition and make it more affordable for those like myself to be able to attend without having to take out so many loans or just didn't qualify for scholarships to help pay for the tuition. The atmophere at UCA is great and it is pretty diversed. Overall UCA is a great school and I would recommend it to those that would be interested in attending."
Senior,4,"I love the atmosphere the campus has. It is very conducive to learning, everyone is very helpful and friendly."
Freshman,4,I am planning on getting a degree in music.   They have a excellent music program....   The trombone choir is well know and is one to the best around.  I'm looking forward to enriching my education with the tools UCA has to offer.  I have already been accepted and look forward to starting college in the fall on 2020.  I have done research to see what colleges offers the tools I need to grow and UCA is what I am looking for.   Music is a big part of my life and I know UCA will help me to succeed.
Junior,4,"I love living here at UCA. The school has so many different activities for the students to get involved and have a good time. There are countless church organization on campus if you're into that, and there are non religious ones if you aren't as well. The teachers overall have been pretty good, but there will always be that one bad teacher you get in the bunch of good ones too. Overall I think this is a really good school with amazing people and I wouldn't want to go anywhere else."
Sophomore,4,"I love the atmosphere of the campus, while it has a lot of reported crimes, there IS an on campus police patrol. The housing, unless you pay for the expensive apartments, is not the most modern of well maintained. Saying this, the Professors are extremely intelligent and involved on campus. Academics are very strong here and is the best choice I've made for a a college."
Niche User,4,"I like the overall atmosphere of the campus, such as professors, diversity, and the food. I also like how it is close to home and the sports that they have."
Freshman,4,"The campus is very diverse and has a lot of programs to get involved in. The one thing that I wished was better was the times of classes. As a college freshman, I work two jobs and the scheduling of my classes makes it hard to do that. Other than that, the school is great!"
Sophomore,4,"The campus is absolutely stunning. It is beautiful year round. Unfortunately, some of the dorm halls are not so beautiful, or clean. The food is decent, but not worth the money you pay to go there. Professors are great, but sometimes you can get a bad apple."
Sophomore,4,"I believe The University of Central Arkansas is a fantastic school with so many benefits. This school helps people branch out introduces them to so many clubs and organizations. its just up to them if they are willing to learn and take a step into success.  the campus is so beautiful and has so many open spots where students can study, enjoy the weather and just socialize."
Sophomore,4,"Needs better parking!!! Overall, the students and faculty are very friendly and helping. The campus hold certain standards of maintenance, so they will be mowing all the time. The resources that are available will help you throughout your college career, you just have to find out what they are and take advantage of them."
Junior,4,Great campus with a good balance of academics and fun. The area around campus is beautiful in the fall.
Senior,4,"The advisers are helpful,  the Campus is friendly and easy to navigate. The professors are willing to talk and help students through any problem. Only downside is that printing papers costs 0.10 per page, while at a local community college that's part of UofA is 0.05 per page. Things are slightly more expensive for a college with more student body traffic."
Sophomore,4,"When I first got to UCA, I was undeclared in my major but after many meetings with my adviser I was finally able to decide my major and major concentration. UCA offers so many career options and graduate program options, and they offer many different departments such as biology, liberal arts, mathematics, therapy, health care, etc. UCA offers a spot to anyone who is trying to better their careers! The campus is beautiful and the safety that UCAPD provides the community is unbeatable. Also, there is many helpful programs such as the food pantry, sexual abuse reach out, and different helpful opportunities to reach out during rough patches in life. The professors that I have had are so caring and take the time to work with us so we understand the material and are genuinely good caring people. Also, class times at UCA are easily managed because every class offers different times and you can always fix your schedule to make it work for your daily life."
Sophomore,4,UCA has a beautiful campus. Many good studying opportunities. I like how UCA provides many tutoring services. Some changes I would like to see is a more organized system in class schedule making and financial aid service.
