Niche User,4,"I loved Brigham Young University because of the sports. There's nothing I love more than college basketball, and BYU's team was fun to watch. The environment of the games was absolutely astounding. Light shows and loud music ringing throughout the gym made my heart happy. Not only was it fun to watch basketball games, but volleyball, soccer, football, and even tennis were all impressive and exciting matches and games to attend. One thing that could change about BYU is the diversity. It would be nice to see a more diverse student body and participate with people from different backgrounds."
Freshman,4,Most professors knew what they were doing but there were some that had trouble getting a hang of it.
Sophomore,4,"Brigham Young University has an excellent geographical location, pleasant weather, devout religious culture, low tuition, and outstanding academic performance. Business (accounting), computer science, education, and law major are popular for students. It is a good choice for those who want to save money and interested in these majors."
Junior,4,"Like all universities, you get a mix of amazing professors with some mediocre ones. It is great for the value you pay for a private university, though. The campus is beautiful but always seems to have one part in construction. If you are one who enjoys the outdoors (like I do) and don't mind a lack of diversity (that was a change from southern California) it has a great social life."
Junior,4,The layout is very plain and simple and the professors I had try to work with you and respond much faster via email than my in-class professors. I found it to be much more efficient to read the video lecture than watch and pause every thirty seconds.
Alum,4,"I did well at BYU. Some people say it's a hard school, and the data do show that accepted students have higher GPAs and ACT scores. I didn't think it was hard. I never had a problem with safety, but I've met people who claim they were assaulted on campus. The school has a no alcohol policy, so parties are rare but not nonexistent. I wasn't blown away by the psychology program, but I got the degree I needed."
Sophomore,4,"I haven’t taken classes online yet, but I have heard from others that it is well organized and easy to succeed."
Senior,4,"I really like the university. There are a lot of students and therefore a lot of resources for different kinds of research, majors, activities, clubs, etc. It is also nice to have a conservative, kind feel. It is definitely not a party school."
Junior,4,"All of my classes switched to remote learning in March. I took a Spanish class over zoom, but the rest of my classes were just online assignments and readings."
Junior,4,"I love how BYU creates an environment where everyone can feel comfortable and loved. Students are all very intelligent and hard-working, which can create unwanted competition."
Junior,4,Professors do their best to create an environment where students can learn and grow as much as they would attending a lecture in the classroom.
Junior,4,My experience overall has been amazing . One thing I love about BYU is that it’s always trying to incorporate a diverse opinion. Diversity is growing and I feel more at home
Junior,4,"Because of Covid, it’s been a weird yet interesting experience . All of my professors have been there for me in regards to grade, tests or lectures. I really like it ."
Freshman,4,"Most of the professors have experience with online teaching methods, and they adapted very quickly to using Zoom as that became more popular. For the teachers who don't have as much online experience, they are willing to accept help from the students to create a positive learning experience even with the challenges of remote learning."
Junior,4,"So much of my online learning experience is due to Covid, so there was a lot of teachers not used to teaching online. But they did their very best. They adapted very well. And, blended classes are really amazing."
Freshman,4,"Starting after spring break, my Classes were switched from classrooms to online due to the Covid crisis, and my professors did a great job at keeping students involved on such short notice. Some teachers broke up the class into smaller groups to encourage interaction with other students."
Alum,4,"Incredible training in my field, wonderful teachers, beautiful campus. I do wish the student body was more diverse. I loved my time there, and had many opportunities to travel and participate in activities through the school. There's also some amazing cafes on campus!"
Alum,4,"I didn't take any online classes at BYU, but I did use resources online while studying. I used dashboard and blackboard. I felt that online resources were adequate."
Sophomore,4,"My classes all switched to online halfway through the semester. It was very sudden so some teachers weren't exactly sure how to handle it. But after a week or so, things started to run more smoothly. Most of my teachers did a great job of condensing their material into the new online format. A few of them gave us way too much work in a short amount of time. We had such little time to get multiple projects/assignments done that I wasn't able to really enjoy them or learn as much as I would have liked. This was likely because many of the assignments would have been done during class and just a few would have been homework, but because it was now all homework it felt like too much. Overall though, given the circumstances, my online experiences were great."
Sophomore,4,"The University has many opportunities for all majors, as well as traditions that get students involved. There is also a national and strong community of school pride."
Freshman,4,"I, personally, have not yet taken any classes online from the University. But with COVID-19 impending on everyone's future, BYU has stepped up in a large way to help students further continue their education with as little disruption as possible. They are offering many classes online this upcoming semester, and are constantly working to improve said classes and circumstances for learning. I am excited to see how the classes will function online in the coming weeks of my enrollment."
Junior,4,"I have thoroughly enjoyed my time here. Excellent professors and campus, amazing library, and just an all around good feeling. It's not perfect, it's fairly conservative, and they've got themselves on a bit of a high horse with their requirements, but it is a good school."
Freshman,4,"Zoom and assignments are easy to follow and turn in. I'd prefer in class learning, but zoom closes the gap fairly well."
Freshman,4,I love how friendly and open the staff and faculty members are. I feel like I can go to them for help if need needed. I wish the campus was fully open for fall semester.
Junior,4,"I was worried about taking online classes, but the two I took ended up being very well set-up, easy to understand, and geared towards helping the student understand the content, instead of just a bunch of reading."
Junior,4,"Classes were well adapted for online. Some teachers struggled to implement student involvement over Zoom, especially with large classes, but on the whole they made it work. Reasonable expectations were given by making exams open-book."
Niche User,4,I have not taken online classes at byu but everything that I have heard has been fantastic. online activities and the learning expirience during the pandemic has all gone amazingly smoothly and I have been very impressed.
Senior,4,"I'm not one that prefers learning online instead of in a classroom setting, but overall the online classes are presented in an organized way."
Sophomore,4,"I like the environment and the people that come here. There is a lot of Church culture that I am not a fan of, but I really love all the genuinely good people that are here. It is easy to have a lot of fun! I wish that housing was better and that the University did not try to get you for every little thing. They charge you for things that they do not need to often. The housing is incredibly expensive and there is not much you can do about it. Management of the housing always is pretty bad, but it's truly the owners fault and they never fix anything. Overall, I love the people for the most part  and the education is fantastic."
Sophomore,4,Online learning was straightforward and professors were very open to adjusting the format of the classroom to meet needs of the students.
Junior,4,"BYU is a special school that is specifically directed towards members of the Church of Jesus Christ of Later-day Saints. Because of this, sometimes there is not much diversity in the school and the demographics are very limited. Though, the academics are top-notch and it is one of the best schools in the nation."
Junior,4,"Although I dislike learning online, they have been very understanding and made the transition as smooth as possible. I feel I am learning as much as circumstances will allow."
Senior,4,"The classes I took were due to Corona, some professors switched very well, others struggled. It was a fairly good experience."
Senior,4,"It is an amazing college! Like all colleges, it has some good and some bad professors. It has an amazing atmosphere!"
Sophomore,4,"Due to the Corona Virus, I have taken a few online classes. My professors have all adjusted well to this change; I know they have spent hours accomodating their original courses to fit their students' needs. I have learned a lot from these classes. Chances are, I will take another online class later in my career; BYU's requirements for online courses and material for students can be difficult, as is their on-campus classes, but it is doable and appropriate."
Freshman,4,"I have only heard about online at Brigham Young University, but many good friends who have done it have said they loved the freedom it gives them and that the professors were extremely helpful."
Freshman,4,"My online experience came about because of Covid-19. Professors and TAs were very helpful and understanding about providing new and additional resources for success. I enjoyed the online experience because I was able to access previous lectures multiple times, I could get help at any time, and because I didn't need to go around campus, I was able to get a lot more done."
Junior,4,Didn’t take classes online except for after corona shut everything down. I don’t like online but I imagine they are generally good.
Sophomore,4,"Great school for an even better price! Amazing professors and staff throughout campus! The whole atmosphere of the school is indescribable, but amazing in every way! The honor code is very restricting to students, and can be severely misinterpreted at times. However, the overall prestige and beauty of the school makes up for its strict rule book."
Junior,2,"I don't think it's a bad school, but trying to work part time and go here is impossible. If you're trying to pay for your own school and get good grades... Think again. Grades or pay rent take your pick. The teachers all assign work like their class is the only one you take and it's annoying as heck. Sorry I wasn't a valedictorian and want to have friends. I stay at the library for 8 hours and still have 2 hours of homework left to do when I get home. I can't learn when I'm too stressed out to even breathe. The tuition is nice though."
Alum,2,"I had always dreamed to go to BYU. My parents both went here and had an amazing experience. I would say that my freshman year was a good year. BYU has a great environment and I absolutely loved my dorm roommates and on-campus job. After returning from a 18-month church mission, BYU was just not the same. It tries so hard to act like and Ivy League school. It pushed students to perfectionism and insanity. I did appreciate the spiritual aspect of attending, but that was about it. About half my professors were genuine and helpful. But the comparison and outrageous expectations made it so I did not feel welcome, capable, or happy while attending. I always thought I'd send my children there one day, but I am hoping to send them somewhere else after the experience I had."
Freshman,2,"Do not come here if you are not LDS. It is kind of a difficult social environment due to the fact that most activities are church based. Also, if you are looking for diversity, BYU is not the place for you. Provo, the town where BYU is, has been rated the least diverse city for like the last ten years."
Sophomore,2,"Run by the LDS church, teaches church history inaccurately and in a skewed light.  Culture of shame and conformity, a toxic environment."
Niche User,2,"Brigham Young University is a rigorous academic institution that has all the resources to provide its students with an excellent university experience but doesn't utilize them. There are constant issues of homophobia, racism, sexism, religious discrimination, and so on and so forth that horrify students and are ignored by administration. The Honor Code Office is a terror force focused on punishing students for minute mistakes. There is no room for any failures, whether spiritual, academic, or healthwise.  I cannot think of a more hostile environment to try to receive an education."
Alum,2,"Made some good friends at BYU. Also enjoyed some of my classes. Experienced a lot of racism - oftentimes not malicious, just naive (microaggressions). Graduated with a self-esteem problem over my ethnicity that took years to heal from. This was in some way aggravated by professors who talked about race in class in harmful ways (not intentionally - but out of lack of knowledge). Also experienced a lot of microaggressions from classmates and students who were strangers to me. Religious environment is both uplifting and harmful (harmful because causes a culture of judgement).  However the degree itself has helped me a great deal with my career and I am grateful for it. Also grateful that I even had the opportunity to go to college. The library is wonderful - one of the best university libraries in the country."
Freshman,2,"I didn't like BYU at all. everyone there is super judgemental, the classes are big, and there isn't any one-on-one time with the teacher. There are also a lot a cams that take place here, so campus is always crowded with little kids and teenagers."
Senior,2,"The professors are kind and open minded that I had, if you are liberal, lgbtq, a poc or just in general dissenting in opinion from a mainstream lds mentality, I would caution you away. Not worth the trauma."
Junior,2,Awful. Sexist. Bad weather. Bad teachers. Bad school policies. Mean students. Please get me out of here. Religion classes are needlessly hard and take the spirit out of the gospel. If you aren't on board with a Trump presidency you will not be welcome with open arms.
College Senior,2,I don't know about Greek life
College Freshman,2,"There is very little diversity on campus. This goes for race (almost exclusively white), political beliefs (almost exclusively conservative), religion (almost exclusively Mormon), and sexual orientation (almost exclusively heterosexual)."
College Freshman,2,"The school in generally is sanitary; I see janitors everywhere, but their food and handling license at the BYU Cremery should be suspended. I got horror stories from my friend that worked there. And I was food poisoned twice by their daily-made products."
College Junior,2,"When there is a sporting event plan on not being able to park anywhere on campus for your classes that day, especially later in the day. So you better just get dropped off, also if you don't absolutely have to don't go anywhere on those days because the entire city is jam packed due to the sporting event."
College Sophomore,2,We don't really have one as far as I know. I'm not positive though.
College Sophomore,2,"I was at a surprise pep rally in the library on campus at the end of last semester, the football players were the opposite of excited and enthused and preferred to slap people rudely in the face with free t-shirts that actually motivate students. personally since then I have become an anti BYU sports fan due to that scenario and many others that have occured."
College Sophomore,2,There isnt a whole lot of diversity
College Sophomore,2,There isn't really any greek life at BYU...
College Student,2,Hard to find something comparable to the on-campus dorms.
College Freshman,2,"Due to VERY limited availability of on-campus housing, everyone who is not a freshman has to live off-campus.This makes BYU feel like way less of a community and it's hard because the approved off-campus housing is disgusting and if you want to live somewhere clean and nice it's very, very pricey."
College Freshman,2,Little party scene. Mostly off campus.
College Sophomore,2,I just don't know what is available to me. I wish I had someone who worked a little closer with me to help me figure things out. I am the first one to go to college in my family and I really don't know how to work the system and play the game.
College Junior,2,"There are some really great facilities for the official athletes, but for other students the facilities are old, and overcrowded."
College Freshman,2,"I tried to get financial aid, but am still working on getting anything to help me pay for school. It's tough."
College Freshman,2,BYU is definitely not a party school if you're looking to party look somewhere else.
College Freshman,2,Getting a scholarship here is quite hard. Tuition is cheaper than other places but getting a scholarship is beastly
College Freshman,2,Lots of cookie cutter Mormons. Lots and lots and lots. There is a USGA (pretty much a Gay Straight Alliance) that is super big on campus. I love seeing even just a little bit of diversity in that way. My roommates and I used to compare how many black people we saw on campus each day because there were so few.
College Sophomore,2,nothing fun to do here.
College Junior,2,"BYU is relatively cheap, which is really nice, but the financial aid is extremely competitive. I feel like people who really need it don't always get it, even if they have good grades... it's the people who came in as valedictorians of their high school and freak out if they get a B. Many of these students don't need the financial aid, but end up getting it anyways."
College Sophomore,2,"'Parties' are not so much parties, usually. 'Dessert party' etc. Maybe there are good parties out there but I've never been to one. I usually study or chill with a smaller group of friends instead."
College Freshman,2,It is tough getting any type of reasonable normal housing. It feels like everything is really nice or really bad. No middle ground.
College Freshman,2,I didn't receive anything. It is hard to get scholarships.
College Freshman,2,There is no party seen. Enough said.
College Sophomore,2,"Parking.... don't get me started. I wish they would build a parking garage to deal with the number or cars parked on the street. It's a hazard, especially with the large ditches (trenches) near the edge of the streets. There needs to be some sort of parking permit system where you can have a guaranteed spot and not have to worry about walking an extra 15 minutes to campus."
College Freshman,2,"It is near impossible to get an academic scholarship here, but the school is so cheap that it doesn't bother me."
College Freshman,2,I haven't found a party that has been super fun yet
College Freshman,2,"From what I know, everything is falling apart. I've been to a few friends' places, and it's always cold and dirty, and it makes me not want to live in Provo."
College Freshman,2,"Since this is a college town, most of the food places hire college students. They obviously don't care about anything, so the quality of your food suffers for it. Not fair, huh? Also everywhere is crowded. It's the worst."
College Freshman,2,Students are very religious and mostly closed minded. If you are coming to school for a purely academic experience then this is the place for you. If you want to get married then this is the place for you. The dating scene is huge. The social life however is very different from most other colleges. There is no drinking. There is a curfew. There is a dress code. If you are not prepared to follow these rules then the social life will be really hard.
College Freshman,2,There's the honor code. If you don't know about the honor code you better look it up or you're in trouble (unless you're mormon in which case you probably already do all that stuff anyways.) But people aren't breathing down your neck so you could get away with a lot if you wanted too. Except for visiting hours in the dorms. Those are really enforced and at Helaman halls it's really inconvenient.
College Junior,2,I do not really even know what is meant by the questions asked haha.
College Senior,2,"People assume they're safe here because of the general conservative Mormon population, so when you have an actual issue nobody takes it seriously. Crime and safety issues are here, but nobody reports or talks about them seriously."
College Senior,2,"I didn't live on campus housing because I got here on my sophomore year. Only freshman live on campus housing and I heard it is pretty expensive for just a shared room without kitchen and much comfort. However, there are new on campus housing been built and becoming available. I guess it will be better in a few years."
College Senior,2,"I think our campus, specially because of its religious beliefs( word of wisdom), should have more availability of healthy food options. At the food-court we only have one restaurant that offers salad options, but it is extremely expensive. The other (cheaper) restaurants have very oily food, that I am not sure if it is safe to eat. Vending machines only have a few options of healthy snacks. A lot of people tend do get bigger after their freshman year here.

When it comes to safety, we just had a series of sexual assaults from one of the track team guys. However, I feel safer at BYU then other campus."
College Senior,2,"I wish there were more help available to students besides the school scholarship. I am a great student but scholarships here are over the top competitive since the school is already known by having a low tuition with great services. So, a lot of low income students compete for the same scholarship."
College Freshman,2,Very tame but you can go off campus.
College Sophomore,2,"Everyone signs an honor code prior to attending, which lays out a long list of rules that all students are expected to follow both on and off-campus (even when they go home for the summer). It includes stuff like absolutely NO drinking, smoking, drugs, sex, and a strict curfew. No one is allowed to have a member of the opposite gender in their bedroom at any time, and they're supposed to be out of your apartment by midnight. On-campus it's extremely difficult to get around any of these rules. Off-campus it's a bit easier since there aren't RA's constantly supervising you, but if you get caught doing any of that stuff you can get kicked out of school. Some people get reported and are let off easy, some are immediately expelled. It depends on where you live. It's the kind of thing that's great if you're extremely religious, but can be extremely stifling for any students who want to experiment with anything that's against the honor code."
College Sophomore,2,Cost of living seems too high. An apartment of 6 guys will be as much as 2000 a month!
Recent Alumnus,2,In the 1950s it was good.
College Sophomore,2,They should have more choices and student discounts.
College Senior,2,The schools so competitive. I still need financial aid and can't find any.
College Junior,2,We don't really participate in the night life.
College Sophomore,2,"BYU, due to the strict honor code that bans all drugs and alcohol, as well as initiating a strict curfew, doesn't have much of a party scene. However, there are still plenty of campus events going on that it isn't difficult to find something to do."
College Student,2,"Because BYU is a private religious school, there is a great lack of diversity regarding religion, sexual orientation and general beliefs. BYU does, however, make an effort to vary race and ethnicity and provide an accepting atmosphere in that regard."
Recent Alumnus,2,"There isn't much ethnic, economic, political, religious, or sexual orientation diversity that I have seen."
College Sophomore,2,There is not much diversity here. People from a different cultural background might experience a big cultural shock.
College Senior,2,I love BYU but there is little to no diversity.
College Freshman,2,I always park my car at the apartment that I'm renting and walk to school because parking is pretty hard to find.
College Sophomore,2,Its way far out from campus
College Junior,2,"A few years ago they moved my major to the business school and now I feel like over half the classes I'm required to take have nothing to do with what I'm planning on going into. In total I only have to take 5 classes for my major specially and I think that is ridiculous. The major classes aren't a lot of work, they're fantastic, but the business classes require a lot of effort. Internships are mandatory and volunteer hours are mandatory, which is nice, and like 98% of students end up passing the certification exam."
College Freshman,2,"This is not a party city. There are some, but not many"
Niche User,1,"I actually didn't take any classes online, I took summer courses in person for four years. I know, pretty crazy right?"
