Niche User,1,"Brigham Young University, where do I begin? For starters, I have never seen a private institution make a statement for publicity and then rescind that same statement as quickly as BYU did about their stance on LGBTQ relationships on campus. Then there is the whole honor code, which is not only outdated and sexist, it's a safety net to free the school from accountability whenever anything goes wrong. While we're here let's talk about how BYU is ""allegedly"" accepting of everyone, however, the disgusting VAST white majority of students who barely put in the work to get into the school treats the minority group of students TERRIBLY, even though the ethnic population of the school worked their butts off just trying to be considered for admissions. My overall experience with BYU is that BYU isn't amazing or a safe haven for anyone who isn't white or Mormon."
Sophomore,1,"It was incredibly hard to take classes online. I hated that we paid the same amount for terrible learning. I am not truly learning anything. The teachers try their best, but it is not their fault. The school should have done better. The housing tried to make it nearly impossible to let students out of their contracts, it was horrible."
Alum,1,"Don't make the mistake of coming here. The suicide rate is appalling, with next to no help or support from the University. Their acceptance and expectation for students to blackmail each other is short of criminal and - that was me keeping religion out of it. If you're looking for Diversity or a place to expand your knowledge and concept of the world, this is not the place for you."
College Freshman,1,We don't have a Greek life at Brigham Young University.
College Sophomore,1,Greek life is basically nonexistent here. I haven't heard of a fraternity yet...
College Sophomore,1,We don't have Greek life
College Junior,1,No Greek Life. Instead there are lots of clubs!
College Sophomore,1,We don't have Greek Life............................
College Sophomore,1,"We don't have it so I""m not sure how it is to be honest."
College Sophomore,1,"Uh, we don't have Greek life at BYU.  We don't have frats or sororities either.  There are honor societies and tons of clubs to join though."
College Freshman,1,As far as I know the Greek life on my college campus does not exist.
College Junior,1,There isn't Greek Life here.
College Junior,1,We don't have greek life.
College Sophomore,1,We have no Greek Life.
College Sophomore,1,We don't have any sororities or fraternities.
College Freshman,1,"BYU has a low party atmosphere (party meaning the traditional sense with beer and drugs and sex). BYU has fun, clean gatherings where students get together and have fun and enjoy themselves without drugs and alcohol. Because these social scenes are not considered the usual party scene, I would say that BYU has a horrible party scene, but in my opinion, that is awesome. I am against the consumption of beer and alcohol, so anything where that is the normality is not good in my opinion."
College Freshman,1,I personally don't even know what this is so it's possible BYU doesn't even have one.
College Freshman,1,Greek life is not available here
College Freshman,1,There is no Greek life
College Freshman,1,Not a university to come to for a fraternity/sorority.
College Student,1,"There is no greek life at byu, fraternities and sororities are not allowed."
College Freshman,1,HAHAHAHAHAHA!   BYU DOESN'T HAVE FRATS AND SORORITIES!!
College Sophomore,1,BYU doesn't participate in Greek life or fraternity and sororities. (And I'm an international student so I really don't know what any of these things are?)
College Junior,1,We don't have greek life.
College Freshman,1,"I attend a religious school where drinking and clubbing is not only frowned upon, but also against our honor code. While there is no ""Greek Life"" here, there are so many fun, clean, and friendly oriented student activities that make up for it. I would not have it change one bit."
College Senior,1,"I do not have an adequate option listed above.  Greek life is non existent at my school. As a private religious school, my school does not allow Greek life. I have not felt like this was a great loss to the experience I hoped to have in college.  Other clubs and professional organizations on campus help meet varied student needs and interests."
College Sophomore,1,Not a very big night life
College Freshman,1,No Greek Life at BYU
College Sophomore,1,"There are no fraternities or sororities on campus, which allows all students to feel included in the general whole of the University."
College Student,1,We don't have fraternities or sororities
College Sophomore,1,"So..BYU doesn't have Greek life...

aka: It is difficult to get into because it is impossible.

It is the worst...because there is none? Or maybe that makes it the best? I don't really know...I've never experienced it, so it doesn't really effect me."
College Sophomore,1,The school is not lenient at all on these types of things. I know we signed the honor code but still...
College Freshman,1,There is none because of the Honor Code. Partying will get you kicked out of school
College Freshman,1,"I'm never going to marry someone from here, let alone date."
College Freshman,1,THEY'RE ALL SO LAME!!! Never go to the parties.
College Senior,1,There are no sororities or fraternities at BYU.
College Junior,1,"Not too many parties in this area, you will find something to do with your ward and things"
College Senior,1,There are only white blonde people here.
College Senior,1,School policies are too strict.
College Senior,1,It's the cheapest college housing you could ask for.
College Senior,1,Worst. Party. Scene. In. The. World.
College Senior,1,"Utah is full of repetitious franchises. If you find a nice little locally-owned place you like, it will probably close down in a few months because college students are cheap."
College Sophomore,1,"I do not know of many, if any, Greeks or sororities/fraternities..."
College Sophomore,1,"I can't get financial aid cause my dad has such a high salary.  But what they don't consider is that there are 11 kids in my family and my parents are trying to help each of their kids but there is only so much they can do. They can't afford to support us all so I pay for housing, books, food, clothing, etc. by myself.  Its very difficult and stressful."
College Junior,1,There is no greek life here at Brigham Young University
College Sophomore,1,Dont even know what it is
College Junior,1,We don't really have a Greek life.
College Sophomore,1,"There aren't any fraternities or ""Greeks"" on campus as far as I know."
College Junior,1,No party scene at all.
Recent Alumnus,1,It's a gosh darn racket. Have your parents sign a waiver and live outside the purity ring. You'll pay about 1/2 the price and get twice the room.
College Junior,1,no greek life at this school
College Junior,1,"There is basically no real party scene out in the open. There are some there, but they are secret, since you could get kicked out of school for that kind of partying."
College Junior,1,"Ya, we're all basically the same."
College Junior,1,"There is a joke on campus that the most diverse things on campus are the plants. The stereotype is white, blond, Republican, and pretty well off money-wise. It is hard for minorities to feel accepted sometimes. Most people keep their sexual orientation to private to avoid being ostracized. Being white is the shared trait more than being Mormon."
College Senior,1,The parking is horrible. There is no where is for students to park and constantly empty faculty lots.
College Senior,1,There are no sororities or fraternities.
College Sophomore,1,There aren't enough parking spots allocated to students
College Sophomore,1,The visitation rules for the dorms are ridiculous.
College Sophomore,1,There is virtually no drug use at BYU.
