Freshman,5,I love the environment here on BYU campus. It is very accepting despite everything going on with Corona. The faculty and staff also do their best to make learning still engaging and exciting despite the new changes and regulations due to Corona.
Freshman,5,"I've loved my time at Brigham Young University! I think all the professors are well educated and they are able to effectively teach and connect to their students. I've met many wonderful people and become friends will them. One thing I love about BYU, is the sense of family that is established by the school itself. I feel like everywhere I go on campus there are people who are happy to help me and who care for me individually. I've been really impressed at the efforts of the staff here to make sure we, as students, are having a good time and a smooth transition into college life. I think I have been given many resources to ensure that I have lots of success as a student and I know where to go if I need help with anything. BYU is doing a really good job at making sure students stay safe, but at the same time I have still been able to meet new people and make new friends. I also love the academic environment that we have here where everyone is trying to do their best in school."
Freshman,5,"This year has been super unique, but I've been super impressed with the efforts made by BYU to make sure that our online experience is going smoothly. All my professors have the tools they need to make teaching as fluid as possible. The start of the school year was very smooth and easy for me and took of a lot of stress and anxieties that I was feeling about the start of school. Professors have made sure to make classes still engaging and possible to participate while also keeping everyone safe. Although, it's a lot harder to meet people in my classes I think BYU has done a good job still making that possible; for example, I have been able to put small study groups together to meet both over zoom and also at the library and prepare for tests. I was nervous to see how online learning would go, but I have been pleased with how organized it has been."
Senior,5,This university has a strong sense of campus culture where we look out for each other. The curriculum and content is intellectually enlarging and spiritually strengthening. The professors and teacher's assistants are willing to help and accessible. The campus has student programs that help students network and take their skillset and what they learn on campus to the workforce.
Freshman,5,"It's been way better than I could have ever expected an online college experience to be! I have actually really enjoyed my classes through Zoom, and my assignments online. It's definitely a different and new challenge to be facing, but it provides everyone a chance to grow in ways they didn't know they were capable of. Online learning has been an experience that has required flexibility and patience, but it has given us the chance to still feel the college experience at a lower level."
Freshman,5,"The very first thing that I loved the most about BYU, was the beautiful campus! It is such a beautiful environment everywhere you go, and so peaceful, providing a lot of study places and opportunities. Every one here is motivated and focused with their studies giving great opportunity to be in a professional and influential environment. There are so many opportunities and resources everywhere you go! The professors, staff, and administration are all so encouraging and supportive. Going to BYU provides you with a safe, comfortable place to study what you love at an advanced level. It's a positive and great environment to learn and grow!"
Sophomore,5,I've loved my experience here so far. I like how challenging yet fulfilling the academics are here. There are lots of opportunities to network and gain good skills. Beautiful campus.
Freshman,5,BYU is a great school. Excellent professors and a very friendly and open environment.  It is school very focused on helping individuals apply all learning to broader application and purpose.
Freshman,5,I am currently taking all 15 credits online. It's different but teachers have adjusted very well and it doesn't impede education whatsoever.
Senior,5,I have loved attending Brigham Young University. The classes are rigorous and challenging and the unique rules of the BYU campus have made it easier to focus on school. I have also been impressed with divisions of the school such as the Ballard Center and Marriott School of Business. Having them on campus has provided students with unique opportunities to participate in groups and classes that wouldn't normally be provided by the school.
Senior,5,Teachers work hard to make the online learning experience beneficial. Most of the online classes I've taken have been fantastic and engaging. It's also nice to have the added flexibility provided by some instructors.
Senior,5,"Brigham Young University has provided me with not only a fantastic education, but has been a place where I've been able to network and form a group of friends that will be a benefit throughout my life and career. The tuition is minimal compared to the quality of education. Truly the ""Best Value: college I know of!"
Freshman,5,"Most classes have been online, but substance is still great and there is so much to learn. There are also still ways to meet others and have fun."
Sophomore,5,BYU is an excellent school for the price. They usually are very helpful with technology and can be very understanding.
Senior,5,BYU is a great school for people who are looking for a campus that's fun and safe. Professors are kind and tuition rates are great!
Senior,5,I've started taking online classes and they've been going great. I have no complaints and/or worries!
Alum,5,My overall experience with Brigham Young University was uplifting and academic. Every class I took tested me and helped me improve my understanding of the world and its functions as well as help me appreciate the world that I live in and my purpose in it.
Graduate Student,5,"BYU does a great job in focusing on experiential learning — they have great academics, while providing opportunities to apply learning outside of the classroom or in lab settings."
Graduate Student,5,"BYU has everything! The campus is beautiful, the athletic teams are great and fun to watch. The campus feels really safe and there are great activities in the city and on campus."
Freshman,5,"I just got here as a freshman this year. I moved in last week, and my experience has already been amazing! As my dream school, they haven't let me down! My teachers have been great at communicating what I need for classes. They've been so understanding with COVID-19 happening, and they're finding new ways to make class just as fun and personable as when we could go all the time in person. I've loved every second, and I'm hoping to continue that love throughout the years."
Freshman,5,I have not yet taken my online classes through BYU but it appears that they are very prepared to make it a good semester with online classes. Several teachers have already been in contact with me about class work that is already available online brought different sites such as canvas.
Freshman,5,Brigham young university is a very good school. The academics are very sufficient and the tuition is cheap. It is a great school for me because I am a member of the church of Jesus Christ of Latter Day Saints. Unfortunately this year has been messed up by Covid so I haven’t gotten the full college experience because my classes are all online. But when they do have events there is a lot to choose from and it is a very nice school.
Junior,5,"I have loved my experience at BYU! The campus is beautiful, there are good mix of challenging and easier classes (especially depending on the subject), and lots of excellent people! I love the emphasis on lifelong progression and service. I have a lot of respect for nonmembers (of the Church of Jesus Christ of Latter Day Saints) who attend BYU, because I think it could prove more difficult (like it would be with attending any religious school while not being part of that religion). Because of the religion, parties are a lot different than would be expected from most people, but there are still parties and lots of other social activities! Tuition is remarkably cheap for the excellent education that is available! Highly would recommend!"
Junior,5,I think BYU did an excellent job with transitioning online during the COVID-19 pandemic. They were very fair and understanding to the students and are always open for questions/suggestions.
Sophomore,5,"BYU has an excellent balance of scholastic excellence, social life, and spiritual well-being.  It it a very welcoming community full of students and teachers who want to excel in their respective disciplines."
Sophomore,5,I've had to take some classes partly online due to COVID-19 and they were excellent. Very organized and easy to participate in.
Sophomore,5,BYU is a great school with lots of opportunities. There is a loving atmosphere there and lots of opportunities to make friends or do what you love.
Freshman,5,"I know that in BYU they use the Canvas learning platform to do study online. It's fairly straightforward and easy to use, and my.byu.edu is really easy to navigate, as is the online Learning Suite. I like how most professors communicate really well with students about assignments. I'm excited to learn more about it as I go into more classes."
Freshman,5,"I love my university because of our high standards, dedication to learning and developing spiritually, emotionally, and academically. The teachers are committed to making sure each student has a safe and memorable experience, the campus life is relaxing and fun, and there are so many wonderful opportunities for socializing, work, recreation, and applied study. One thing I would like to see more of is racial diversity - the Black and Hispanic community makes up less than 2% of the student population at BYU, and as part of that small percentage, I feel it is a great responsibility to be an example. I definitely would like to see larger acceptance of a variety of students from different backgrounds. Another thing I have high praise for is the affordability of the school, and the ability to find a variety of jobs on and off campus. They definitely make sure you have the tools to succeed in whatever field you are interested in, as well as many resources like peer mentoring, counseling, etc"
Freshman,5,It is a large school but it is so well organized that you can feel right at home very easily. I have not met a member of the staff that was rude or dismissive. They have been respectful and helpful.
Alum,5,I like online classes. They allow me not to be held back or bothered the cumbersomeness of classrooms/large classes.
Alum,5,"I only took 1 class online. It was great, but I never felt any need to take online classes when there were so many fantastic professors in real life."
Alum,5,"My experience at BYU was everything I could have asked for. Classes were hard, but I was given clear reasons why I needed to take what I did, and I got the job I wanted. I qualified for a couple scholarships and grants and graduated without debt. The social atmosphere is amazing, and I jumped into sports, clubs and church activities. Unless you're looking for alcohol and partying, this is a place to have a good time. I had several professors that were fantastic, and at least one that was absolutely life changing."
Alum,5,"Absolutely loved BYU. An amazing experience and a unique culture. Many opportunities to engage in sports, activities, learning, and growth."
Sophomore,5,"Great positive environment, filled with friendly people and professors. The class sizes are very large, especially for general requirements. Unfortunately, there isn’t a whole lot of diversity."
Sophomore,5,Everything has gone pretty well initially the classes were more rigorous and difficult than in person classes due to COVID-19 but then they mellowed out. You are still taught the same things they just put more focus on trying to provide you resources to help.
Sophomore,5,The education provided is some of the very best in the world. A lot of professors are leading in their industry and remain engaged in their field. They focus on your education and keep the courses rigorous and you are forced to be engaged with the classes. The quality of school is great. I was able to tour many ivy league schools and no offense to their campuses but BYU tops them all. There isnt a whole lot of diversity but they are putting a focus on getting more diversity. There is an honor code so alcohol is not allowed to be used. There may be lots of rules but the education is worth it.
Junior,5,"I've loved my time at BYU so far! Most everyone is nice, teachers are always willing to help you learn, and the campus is beautiful. Not to mention how cheap tuition is!"
Sophomore,5,"My experience with the online classes offered by the university have been satisfactory. I have taken 2 online classes. Teachers have the topic learned and organized from the beginning. They also have questions, answers, and exercises prepared for the students. They offer immediate help and accept different learning methods that lead the student to success."
Sophomore,5,"My experience from the beginning was pleasant. They have offered me a lot of guidance and help to start my first semester with strength.
I like this university because it shows great interest in each of its students. It also has different types of help such as academic, work, or personal.
What I would like to see change is how they distribute scholarship information to new students who are starting the semester."
Niche User,5,"A great school, lots of diversity, large campus, cheap tuition, friendly students and professors, awesome facilities, large library."
Niche User,5,"I did not take classes online during my attendance at this school, because I did not need to for this time period."
Freshman,5,"The classes are like every other online class, they can be difficult to adjust to but it's been easy for me and the professors are very compensating for the switch and difficulty of technology."
Freshman,5,I love their school spirit and focus around living a good life with God in your life. They encourage that you are involved with clubs and activities you like. They also have a great system to support you in you academics and getting good grades like free tututoring.
Freshman,5,"There is a very positive perspective on campus, and the students have a strong desire to work hard in their classes. The atmosphere can come across as competetive at times though, which can take some time to adjust to. There are dozens of different resources to help the students cope with the stresses and challenges of college life, and there are always fun activities going on in the various departments."
Freshman,5,All the professors are so positive and engaging and give you every resource to succeed in their class.
Freshman,5,It's very convenient and they offer a lot of different online class formats (like live zoom sessions or on demand learning) and the same amount of resources you would expect in a classroom.
Freshman,5,They have handled online classes VERY well. The professors are caring and want all of the students to do well.
Freshman,5,I have been able to learn the material well while not having to go to class. Professors have been very understanding about stress during online classes.
Alum,5,BYU promotes and inspires lifelong learning and service and offers a wonderful variety of studies while providing students great resources for learning and growth.  I love how BYU's mission aligns with that of the Church of Jesus Christ of Latter-Day Saints.  Students who are seeking a rich education while trying to grow closer to their Savior Jesus Christ will surely find a wonderful home here.
Alum,5,"I didn't take any online classes while I was going to school, but I used many online resources such as AIM, other student portal resources, BYU's websites, etc. and always felt that BYU's online interface was resourceful and navigable."
Junior,5,"I love BYU. There are some problems with diversity, however the culture, people and facilities are very nice."
Sophomore,5,"I love BYU. Prior to finding my niche, I struggled with enjoying school and the culture. BYU has a large population of students with the same religious background and similar backgrounds (to a degree obviously), so for outsiders this may present unique challenges. I believe that many of the student body would gladly welcome and befriend others who may not share as much with the student body at large, however, just the unique differences might intimidate those who attend that might not fit the more traditional mold. Again, the student body is awesome and inviting, the plain differences might just be intimidating. Also, it is a very conservative and religious school so be prepared for that."
Sophomore,5,"Online learning at BYU is very effective. I have loved taking online courses and the professors and their TAs do an awesome job in helping the students to succeed. It does take self-discipline to log in and push forward, but if you have the desire BYU certainly provides the resources to succeed."
Freshman,5,"Brigham Young University is very diverse, which I find to be really cool, since students from all over the world come here. Also, the teachers here are amazing. I loved all the professors I had last semester, and I'm sure that's not a coincidence"
Sophomore,5,"I have really loved BYU. The education is amazing. I always feel like I am learning something valuable in my classes. There is an amazing feeling on campus. I have always felt safe and cared for. Students are there to gain an education and make new friends, not just party. Students are very responsible and, because of the Honor Code, they live great lifestyles for their age. I love this school!"
Junior,5,"BYU is a place where learning is highly encouraged, as well as the highest conduct of moral standards. 
I'd like to see more diversity and have the university be more representative of the worldwide membership of the Church of Jesus Christ of Latter-Day Saints."
Freshman,5,"Every person that I have come into contact with concerning my classes, enrollment, and housing has been extremely helpful and patient. They are clearly trained well in their expressed areas of expertise and know how to help student with their many, varying problems and concerns."
Junior,5,"They've taken it to the next level; as things have crashed, their response has been phenomenal. From the top down to the teachers, everyone has been willing and wanting to help make this crazy time easier. They have lessened the stress level and helped us to figure out our lives in a fantastic fashion."
Junior,5,"I've loved my time at BYU. The campus is beautiful, the classes are engaging, and the professors are dedicated to helping students succeed. There is a lot to do around Provo, and BYU holds a lot of fun activities and clubs."
Freshman,4,The teachers are doing a wonderful job at making the online learning doable and engaging. They still have high expectations but are also very understanding with the current situation.
Freshman,4,"My current freshman experience has exceeded expectations, especially in regard to a COVID-effected first year. The academics and student resources here are phenomenal. My professors have found a fine balance between leniency and strict priority. In spite of social restrictions, I have had the opportunity to safely meet peers from many different socio-economic backgrounds and nationalities. Student jobs have provided the opportunity to find a cohesive balance between school, employment, and student life as a whole.


My largest complaint would have to be in the dance programs. Without scholarships or previous experience, progressing has been quite difficult. Because of COVID restrictions, practice space is limited and priority is most often to students of high-level students, thus severely limiting the progress of us beginners. This goes without saying that there have been little to no entry-level classes available."
Senior,4,"I took two classes online through Brigham Young University. There were always help sources available, and I learned a lot through the classes through collaborating with other students from around the country."
Niche User,4,I really like the campus. I've been to it a lot of times and spent weeks there at campus and it's really nice. This college has been recommended to me by a lot of peers and family who have received their degrees here and I'm looking forward to continuing my education there.
Niche User,4,"I took online classes with brigham young university for a while and didn't love it that much, but in person classes are much better."
Sophomore,4,"I like how BYU offers a lot of online classes so I can make my schedule more flexible. I'm not really an online learner, but it was all doable. Easier than in-person classes depending on what course you are taking."
Freshman,4,"My online experience has been great. I enjoy having the opportunity to experience class while lessening COVID-19 risks. I moved off-campus to my parents' house and being able to still attend class while living more remotely has been a great blessing. The teachers try hard to facilitate the experience, and while we do have technical problems some days (my Chemistry teacher sometimes has difficulties figuring out audio), overall it's really nice to be able to communicate with other students during class about what the professors are teaching. I think if this were an option in the future, I would definitely like it."
Senior,4,"The college has done a great job of transitioning to online learning. I was enrolled in classes for winter and during both the spring and summer terms, so I had the chance to see the transition. Most classes were able to make the switch quickly. The biggest holdup has been getting older professors used to the new technology."
Freshman,4,"Classes online are more difficult, but teachers and ta's are always there to answer questions and help out."
Senior,4,Overall the education I have received at BYU has been exceptional. Professors as a general rule have been very kind and very passionate about the topics they teach. Any issues I have with BYU have less to do with the university and more to do with the culture. I would like to see a cultural shift towards greater diversity and greater empathy among the students and faculty but I do feel that I got a quality education for a very fair price.
Freshman,4,"The people and professors are so nice, and the atmosphere is great. The campus is nice and it is easy to make friends!"
Junior,4,"BYU is currently offering online and hybrid courses due to COVID restrictions, and these seem pretty standard as far as online courses go.  The professors and TAs have scheduled opportunities to interact live with their students, and apart from a couple of hiccups as far as correctly listing email addresses, it feels almost easier to get in touch than before online courses were being used."
Junior,4,High education and professional yet fun teachers. Material is challenging and teaches you many new concepts.
Junior,4,Online is tough but nothing impossible to manage. Teachers give you good resources to stay on task in the class.
Alum,4,"The online learning experience was surprisingly good. I took many online or hybrid courses throughout my college career and never once did I feel as though it was lacking in material, participation, professor interest, or applied learning opportunities. 

Even when COVID-19 hit and campus had to shut down, the faculty and staff quickly created and easy-to-navigate online adaptation to complete the semester fairly. This was especially impressive for my lab classes such as anatomy and chemistry."
Freshman,4,"It's been a little difficult getting the hang of everything, being a new freshman and all. But, the professors have made online learning so much easier, and they've been so helpful to all the students. Whether it's answering questions, or making sure we have the right resources, or just understanding when things get a little difficult. They're awesome, and I can't wait to continue."
Sophomore,4,Online classes are done very well considering most professors are out of their element when it comes to teaching online.  The professors are always willing to help however they can.
Freshman,4,"Super fun! Culture can be a little annoying at times, but it's a lot of fun if you meet the right people. Always a lot to do."
Freshman,4,"Online learning wasn't my favorite, but the professors were understanding and willing to work with you. It was super unorganized but that's expected; the professors didn't know that was going to happen either."
Senior,4,"I felt that BYU adapted very quickly to online learning. The professors are so dedicated to their students, that they all did what they could to make the transition as fair and smooth as possible.

I feel like my professors have been great at using online tools and making things run smoothly in that way. However, I do feel like sometimes the online workload needs to be lessened just a bit to account for the circumstances not being prime for every learner."
Senior,4,"I felt that BYU adapted very quickly to online learning. The professors are so dedicated to their students, that they all did what they could to make the transition as fair and smooth as possible.

I feel like my professors have been great at using online tools and making things run smoothly in that way. However, I do feel like sometimes the online workload needs to be lessened just a bit to account for the circumstances not being prime for every learner."
