College Junior,4,I think the dorms are just as good as you'll get anywhere else. If you average it out most girls are 3-5 on a bathroom which isn't that bad at all when everyone has different schedules. There's free laundry and tvs in the lobbies. Smaller kitchens are available for use for everyone. Most people enjoy living on campus and the friendships that are developed there.
College Junior,4,"There are options for those who are looking for them. A lot of people end up at the same places over and over again, but that's their choice. They aren't deciding to take advantage of what there is."
College Freshman,4,Most of the dorms here are nice and spacious except it may be a bit small in the freshman dorms. It is kept very clean and everyone is friendly to each other. It is mostly quiet so it is easy to study and sleep.
College Freshman,4,There is a large variety of diversity on campus that mostly includes ethnic groups. Sexual orientation is highly scrutinized so if other than heterosexual it is kept quiet.
College Freshman,4,There are plenty of places to go eat or shop and there is a mall with a movie theater and also bowling is another fun thing to do.
College Freshman,4,I feel very safe to be able to walk on campus at night alone. Nothing ever happens but one concern may be that there isa lack of cameras around the campus dorms.
College Freshman,4,Here on campus you practically end up knowing everybody because it is such a small school. It's very easy to make friends because everyone is generally very nice and like to do fun sports and do bible studies or study groups.
College Freshman,4,"This is a Christian university, so many of the campus rules are rather strict including alcohol use, drugs, and going to casinos. You cannot do any of these things on or off campus if you are enrolled even if it is on breaks. The dorms are separated boys and girls so visitation is only twice a week for about 8 hours each of those days. Curfew is until 2:00 am every day of the week."
College Freshman,4,"The academics here are really good and that is thanks to the help of the professors. They are always there to help you whenever you want, you don't even need an appointment to see them. Many of the classes here prepare the students for real life situations and show how the job really will be. There is also free tutoring everyday of the week including the weekends. Registration can be rather complicated if you haven't asked someone what to do."
College Junior,4,There is great debates between students and professors about diversity.
College Junior,4,I am happy so far with the Rn to Bsn program and glad I am able to take classes online to further my education.
College Junior,4,The facilities are up to date and look great.
College Junior,4,I have only had postive experiences so far with this school.
College Junior,4,I have yet to have an internship. In my field you must get beyond certain classes in order to get an internship. I do plan to have one as it will give me some great hands-on experience without any safety net to catch me if I mess up.
College Junior,4,"There have been a lot of changes within my major since I've been here. I would still choose the same school if I were to do it all over again, but I would want a bit more consistency within the program. I don't have any concerns about finding a job after I graduate."
College Junior,4,"The specific programs at OKWU are set up so that each student has the opportunity to do their absolute best. The workload within each program is such that you will know what you are doing once you graduate and step into the ""real world"" of jobs."
College Junior,4,"The food is good and you can always find something that you like. The dining hall is being completely renovated, so it will be very exciting to see what all they have planned for this next year."
College Sophomore,2,"At Oklahoma Wesleyan University, students may not live off of campus grounds until earning a total on ninety credit hours. The ""off-campus"" options are across the street from the campus, have RA's on duty at all times, and the same curfew hours as those students who live in dorms."
College Sophomore,2,"The party scene at Oklahoma Wesleyan is completely non-existent and contains a strict no-tolerance policy unless thrown on campus by campus staff. At these parties, there is to be no dancing, profanity, and all students must be back in their dorms by curfew."
College Sophomore,2,"For students looking to attend Oklahoma Wesleyan University, it should be understood that the school is located in the small city of Bartlesville, Oklahoma. If you are looking for vegan, vegetarian, or higher quality options most of the students here will make the forty minute drive to Tulsa, Oklahoma to find what they are looking for. As well as late night options, because Bartlesville is so small, the fast food options here are both scarce and close before midnight. Unless you are a fan of Taco Bell, Taco Bueno, McDonald's, Burger King or Sonic, you will find yourself having to make a trip to Walmart to satisfy your late night study cravings."
College Sophomore,2,"While I can appreciate the Christian values at Oklahoma Wesleyan, not all of the policies are viewed as reasonable. Policies regarding social life do not allow of-age drinking or tobacco use off of campus, students at the age of 21 consuming alcohol off of campus will still face consequences of suspension or removal from the university. As well, for students of opposing genders, any sort of visitation outside of the given two hours a week will face the same consequences. In short, for those students who have grown up in homes outside of the Wesleyan church, the new policies can be difficult to adjust to."
Recent Alumnus,2,Its very good some days and will make you sick the next. Pretty sure they re-use food for weeks until its gone. Reheating and cooling it everyday. Not many options and not many healthy choices for athletes.
Recent Alumnus,2,The rooms in Susana Wesley hall are too small for two people.The bathrooms are disgusting and aren't cleaned properly when they ARE cleaned. The smell is awful. Quiet hours aren't enforced.
College Junior,2,Our private university is not approving of parties. I think this has a positive impact because it keeps most students out of trouble. It also helps the students focus on class and what's more important. The town doesn't have much of a nightlife since most stores and restaurants are closed by 10 pm during the week. It is frustrating at times but has a lot of good results.
College Sophomore,2,People are loud at night people generally do not observe quiet hours
College Sophomore,2,"I have lived on campus my whole time being at Oklahoma Wesleyan. However, I have heard from other students and friends of mine that the cost of a lot of the places here in Bartlesville is a little expensive. They are all about 10 minutes or more away from campus. I also here that it is hard to find one as well. Therefore, teh availability is bad."
Recent Alumnus,2,"Have Your Own Car or a Friend With a Car – There aren't really any buses or anything in Bartlesville. You can ride your bike if the weather is good, but there aren't many bike paths and it can be a few miles to get to Walmart or whereever you may want to go. Your best option is to have your own car."
College Junior,2,"There is not enough parking, especially for special events.  It has gotten better, but we still have problems."
College Junior,2,"One Cafeteria With No Variety – We have one cafeteria for everyone with no other places to eat.  The food isn't bad, but it is the same food nearly every day and week, and it is not healthy."
Freshman,1,"Nothing fun to do in town, not a college town... and not worth the price. Dorms are filthy and small. You pay $30,000-$40,000 per year. For a college worth $5,000"
Freshman,1,"STAY AWAY!!! It’s terrible. Most freshmen transfer away after the first semester, as did I. They pride themselves on being a “Christian” school yet they lured me in with lies and deceit. This place is an absolute joke."
Freshman,1,"If I could give it 0 stars, I would. Went here my freshman year and half of the kids transferred out. Not a college experience at all. & I questioned the education I was receiving: it o graduate from here will I be prepared for my career."
College Junior,1,We do not have Greek Life on campus. I like that we do not. We have strict rules and the reputation of Greek life does not fit under those rules. At most campuses Greeks seem to be at the center of all the events. Here we do not have that so everyone is equal.
College Freshman,1,The only set back to the school literally!
Recent Alumnus,1,All we have is taco bell. Nothing is open after 10 but that.
Recent Alumnus,1,Christian school so there are no parties unless they are secret. You can get kicked out if they find out about them.
College Sophomore,1,It is horrible if you are an out of state kid such as myself it was very difficult to get anything if your not from Oklahoma it is very challenging
College Senior,1,"Mob Mentality and Little Tolerance – Essentially if you do not rat yourself out on something that you did wrong, expect the worst. If someone rats you out, there is a tendency for harsh consequences. Essentially, if you want to skirt around the school rules, you don't tell anyone you did so, or you will find yourself kicked out"
College Junior,1,"No Parties – There is a no drinking/smoking rule here on the campus and this stops any kind of alcohol consumption by the students. This leads to a huge underground movement of nightlife, rather than the parties every weekend that are campus wide and known."
College Freshman,1,This place is awful most transfer away after first year.
Recent Alumnus,1,"If I had to do it over again, I would not pick OWU. The academics are not very good. There aren't enough professors and you get a lot of professors who don't really have authority in their department. If you have a handicap, it is really difficult to work with faculty and staff. The whole school isn't very organized and if you ever need anything, you are sent from office to office because no one really knows how to answer any questions. The whole school is very disorganized and poorly run. The only positives are that the students are generally nice and they just built a nice new library."
