Freshman,4,Penn college is a very prestigious institution but they'll let anyone in. The acceptance rate is too high
Sophomore,4,The good qualities are the professors are accommodating especially since I'm a student-athlete.  One thing that I might change is maybe update some of the dorm rooms to make it more livable for some students
Freshman,4,I like the classroom setting where it’s small class size and able to talk to professor and get feedback.  The employment opportunities when you graduate are great for the money you are spending to attend.  The dorms are nice and good size depending what building you end up in.  The food is good and has a good variety of choices.  Have to be social to meet people because of smaller school.
Sophomore,4,I Like the education and how it provides you with the necessary skills to succeed in the job you choose. A lot of hands on job training and practice.
Freshman,4,"The biggest thing for me that I really like about the college is how they have everything that I'm looking for with lower prices than colleges that have similar majors.  They have construction management at Penn college, and it is more than half of the price for the same major at Pratt Institute.  Also, the guarantee for a job after college is really high, so I'm also happy about that."
Sophomore,4,I enjoyed the professors here they really know how to teach the classes. Being a hands on school we get a lot of lab time to work on labs. Also most professors have worked in the industry they  are teaching. This allows them to bring real world applications to the class room. Another nice thing is you can get two degrees in four years. They offer a variety of two plus two degrees.
Junior,4,"This college is beautiful and very historic. Buildings are scattered through the city of Williamsport giving you the feel of being a true student. Campus life is really pretty. The dorm rooms are very large and better than most I have seen. Yes, very pricey but worth it if you want the college feel. If you are just trying to get a degree, then maybe you could find a cheaper way to do so. Very good courses with great teachers and education oppurtunatieis."
Freshman,4,"I enjoy the atmosphere at the Pennsylvania College of Technology because it is a smaller campus and everyone, from students to professors, are so kind and caring every day. I have met so many wonderful people in my last few months here. I find it to be a very practical institution to study at because they are extremely devoted to giving you the best education in your field and providing hands-on training."
Niche User,4,"so far, everything I have seen I have liked. I have been on campus three times so far and have not been disappointed.   I am currently looking for off campus housing.  It would be nice if there was more housing options located closer to the earth science center.  It is nice that there is a bus line that runs from the main campus to the off site areas so in bad weather I can ride the bus instead of driving from campus to campus."
Freshman,4,"I am currently a transfer freshman studying Emergency Medicine at PCT. My experience has been very positive. I live in an apartment close to campus. Being at PCT truly is a great College because they offer so many different majors for real world jobs. I am studying to become a paramedic, but I know students who are becoming mechanics, construction management, nursing, radiology, and many more. This school offers so much!"
Freshman,4,"I love the more one-on-one setting between student and professor. It is very easy to reach out for help on this campus, whether it is personal or academic."
Sophomore,4,I love it here! It is a beautiful school kinda in a crappy area but that doesn't put a damper on your education. This school makes you feel so connected and welcome and the faculty is great and gets to know you and I enjoy having small classes here.
Niche User,4,"A friend of mine attends here and I constantly visit this school. The school has a beautiful campus with many restaurants nearby. From the stories I hear from my friend, the professors actually care. She needed help in a course and went to the professor and her professor was glad to help"
Sophomore,4,"Pennsylvania College of Technology is a great place and I really enjoy being a part of this college. There is almost always something fun going on, trips, carnivals, late night snacks for everyone, good food, and a bunch of pool tables for people to just chill in between or after classes. Health services, free counseling, fitness center, and just so much more that comes with being a student here. I have an 8 month old baby girl and a finance now and I love how Penn College hosts family friendly events such as Halloween parties, trick or treating, and Easter eggs hunts, you name it. It's great! All of the professors I've had were wonderful! They are so passionate about what they do. I highly recommend this school!!"
Junior,4,"It seems like a really good school for skills based learning. The teachers I have had for my major classes have been really awesome and knowledgeable, with helpful personal experience of the industry they worked in. It has the usual trappings of a college atmosphere/environment but it can be avoided.  There also seems to be great opportunities for adult learners to go herer and truly learn new skills."
Sophomore,4,"What I like most about Pennsylvania College of Technology is it offers free tutoring , and hires passionate instructors that are willing to help the student any way they can. What I would like to see changed in the college is the expensive prices on food products."
Junior,4,The advising at Pennsylvania College of Technology has excellent advising and great teachers. They make sure that you schedule for the correct classes in the correct amount of time.  The class sizes are small and are all in class rooms rather than big lecture halls.
Niche User,4,"The campus and housing are absolutely wonderful. The dorms are so nice. Unfortunately, the local area is not exciting and does not offer much fun on weekends and when you do not have class."
Sophomore,4,"Great education, crowded parties, some classes you don't need to take, and the girl to guy ratio is finally evening out more and more."
College Junior,4,So far it's been a very good experience all around
College Junior,4,There are a lot of opportunities here to get a job in your field and experience
College Junior,4,Technically I'm working towards getting into my major which I know is a rigorous program to begin with so I know that a lot of time will have to be dedicated to this program
College Junior,4,I've transferred here and so far I'm really enjoying the atmosphere of classes and how the professors are texting classes
College Sophomore,4,Most of the professors have real world experience which they share.
College Sophomore,4,The welding engineering labs and equipment are first rate.
College Sophomore,4,It's been exactly what I was looking for.
College Junior,4,I was able to switch around my classes to fit with my work schedule.
College Senior,4,"I personally think I chose a great school to study my major at. There are a couple things that I would like to be made better. For example, the crime rate off campus it pretty high during the fall and spring semesters. I would feel safer if there were campus police who patrolled around. As far as academics go, I think I have learned so much and would not choose another school if I had the opportunity."
College Freshman,4,I have had no problems.
Senior,2,"I attended Pennsylvania College of Technology in the fall of 2016. My experience at this school is an authentic experience. The location of Penn Tech is in the city of Williamsport,pa which is a predominately  Caucasian  area. The school was not diverse at all due to it being a Tech school in the middle of Pennsylvania. The make up of the school was primarily white male who were very ignorant in understanding other peoples culture.The frustration I faced being a Haitian- American at Penn Tech is one of kind. The up side of attending Penn Tech is my amazing teacher in my Human Service program who cared about their student. These teachers are people who invest their time in their students and want the best for them. I am glad I encounter them my last year at Penn College."
College Junior,2,The cost is very high but it is hard to tell where our money is actually going.
College Senior,2,The student body is mostly adults whom go home at the end of the day and the rest of the student body are your typical country folk who like trucks and drinking.
College Senior,2,If you want classes where you do the minimum work and get a good grade these classes are for you.
College Senior,2,Extremely expensive for out of state students. Spending way more money than I needed to.
College Sophomore,2,"I have just been keeping to myself and trying to get back to Johnson and Wales University
"
College Sophomore,2,The kitchens are not up to par and do not provide the experience i am looking for.
College Sophomore,2,My school is very male dominate and and has a very week Greek life.  Along with other clubs.
College Sophomore,2,It is very expensive to go to the school.  You need to be dedicated and willing to graduate.
College Sophomore,2,I don't believe we have much of a student body at all. this school is so diverse with our majors that there tends to be a lot of cliques with whoever you have most of your classes with. In addition PCT has a lot of non-traditional students so a good majority of students do not even live on campus.
College Senior,2,"My program was less than 4 years old when I started, so I felt like the school was using the students for experimentation to see what about the program worked and didn't. This, I felt, affected the education I was receiving. As I said previously, some of the staff haven't been on the floor in years and some of them have different levels of teaching degrees (some earned their teaching credentials with a 2 credit class)."
College Senior,2,"With being in the nursing program, we are stressed to learn the most up-to-date information. However, there certain nursing professors who haven't practiced bedside nursing in over 5 years, some almost 10 years. Luckily, there are a small few professors who have a passion, which makes it enjoyable to learn."
College Freshman,2,Community College – I feel like the education I am getting is from a community college. They do not give out enough financial aid for this school & they rip off the health students majorly.
College Junior,2,"College Is Costly – The cost of my education is cheaper then most of the other branches of the Penn State affiliated schools. Even though,my college is cheaper than others that are affiliated with it, I still need money to pay for my tuition. I think the cost is a bit high for my budget."
College Freshman,2,Good but Bad – Great School with a great learning atmosphere but the guy to girl ratio is probably an 8 to 1. It sucks being a guy cuz all the girls are taken. It has a great program so come to learn. Not for a relationship
Niche User,2,"This school is awful. This school is awful. If you think ""pimping out"" your truck is a cool idea and you enjoy wearing camo outside of hunting season, then you belong here. The majors are awful (construction, carpentry?)–do something better with your life. I'm going here to get my GS done and transfer to a reputable college where I can actually find a job outside of hick towns and earn six figures. Sorry to be rude, but use your 2 to 4 years wisely and go somewhere half-decent. Penn Tech, Degrees that [just] work! The professors are either stupid or brilliant (but only a handful). We have a sociology professor teaching philosophy and sociology professor also teaching psychology. Professors are supposed to profess, not teach. Some of them actually read from the book and they are generally uneducated. Williamsport is crime-ridden, dirty, and absolutely boring–you'll understand when you get here. The view from one of my classes is a burnt-down laundromat. Parking sucks as well and muggings constantly occur in the parking lots in the fall and spring. Penn Tech also does not offer ""internal"" financial aid; you have to just rely on government aid, which is extremely inadequate. On average, you get $100 off a credit (for $400 credits). Again, save your money, save your time, save your life, and go somewhere and make something of yourself. Don't look at the college's ""looks,"" look at the academics."
College Junior,2,"Tuition is decently high at college. It is very difficult to get financial aid because it is all based on FAFSA, including scholarships. In my specific case, I cannot get financial aid or any support from FAFSA, my family, nor the college."
Sophomore,1,"This college is not made for online learning and that was shown clearly to be the case during covid 19. The classes are supposed to be hands on to aid with learning, so it is hard to learn hands on information from online classes."
Freshman,1,if your racist as hell and hate diversity country and come on by!  They take only take in white folks so beware of that.
College Senior,1,"Ive gotten hardly any aid for the administration doesn't have there stuff together. And in every class they are trying to sell a product or get you to buy into another ""quick degree""."
College Senior,1,"Most of the work i have been shown are, things i would have hoped the students should have known before attending."
College Senior,1,"A lot of rude, obnoxious people. Lots of smokers that don't have any sense of common courtesy."
College Sophomore,1,I do not like their printing system at all it is unorganized and i do not like that i only have a 1000 sheets to use a semester. 
