College Freshman,1,"it was horrible trying to get financial aid, and the school doesnt give financial aid to those who really need it"
College Sophomore,1,"They say that there will be all these activities when you are in on campus housing, but I don't know anyone from any of those activities. Of which, there were few. Also, on campus housing is way too expensive! I looked off campus and I would have to pay less than half and get all the same amenities and my own room. Also, when I tried to move out they said that I would either have to leave the school or just move to other on campus housing. They wouldn't even let us try to sell our contracts."
College Freshman,1,"There are a number of Asian and Middle Eastern exchange students, however, the majority of the school's population are still mormon caucasians (this is Utah, after all).  I'm pretty disappointed with the school's lack of focus on assimilating their foreign students into our community here."
College Freshman,1,"The cafeteria is ridiculously overpriced for the quality of the food.  They have the staples like pizza, fries, burgers, and a salad bar.  There are other options that change daily, and these are very hit-or-miss.  It's very hard to be a vegetarian at this school, as most veggie dishes offered are, well, nasty. Of course, even as a meat-eater options are few.  However, if you like carbs, this food is perfect for you..."
College Sophomore,1,There is little to no nightlife in Cedar City. There are a few bars and maybe one club in town. It's up to you to make your own fun.
College Sophomore,1,Miami to Utah – Coming from Miami to there is absolutely no real nightlife at SUu. Really just those few kids who throw parties at their apts. just to get trashed.
College Sophomore,1,"First and Last – I went to one Chi Phi party while I was at school, and it was a complete s***-show. My friend and I ended up cleaning vomit off the couches and carrying boys to beds so they would fall asleep and stop picking fights."
College Sophomore,1,"Ther is really no public transportation on campus, and Cedar City isn't very big so you kind of need a car to get around the town."
College Sophomore,1,"Parking Garage – There are plenty of permits that students can purchase for parking, however, there are not enough parking spots around campus to fill all of those orders.  There are many students that park off campus and pay for permits who have the impression they will have somewhere to park.  They desperately need to build a parking garage.  The cost of a parking garage would be regained after a few years of purchased parking permits.  All of the non-permit parking lots are a few blocks from the campus.  The guarantee here is that many more students would purchase parking permits if they had somewhere on campus to park.  Not to mention that all of the locals would regain the parking in front of their homes that they reserve the right to use, but students take those too (because there is no parking).  My suggestion, walk, carpool, or have someone drop you off."
College Sophomore,1,There is few racial or ethnic background diversity. There is a lot of diversity in sexual orientation.
College Sophomore,1,"Greeks Are Lost – Our school only promotes Greek life when there is a charity/event that costs money. Otherwise, we never hear about them."
College Sophomore,1,"Apartments Not Cheap – There are various apartments available for students, but most are very old and expensive. The newer apartments are better looking, and less expensive, but they are mostly only female/male housing, not co-ed. Not a friendly atmosphere for newlyweds/fiance's/couples/really close friends."
College Senior,1,"Not Much – There are only to bars in town so the night life if your over 21 is lacking. There are alot of house parties but they get bust most of the time, and it doesn't matter if your over or under 21 in Utah you'll probably get a ticket of some kind. Then everything closes early so if you want something do at 11 pm its pretty much go to dennys or walmart."
College Student,1,"Worst Deal on Campus – The experience in the cafeteria is overpriced and low quality. The menu is very repetitive. It is very easy to grow tired of the lack of variety. If a meal plan weren't required for student housing residents, I'm sure students would eat elsewhere."
College Freshman,1,Not Much Choice – There are only two fraternities and two sororities. All houses are located right next to campus. The Greeks aren't a big deal at SUU mostly because their events are only open to Greeks. They try to be exclusive.
