College Senior,4,I have taken online classes at two other schools and I have to say that the system at Brazosport is the simplest to use. The head of the online education office is a very knowledgeable and practical person and it is evident in how the system is run.
College Senior,4,"Brazosport College is a small school, and professors here are not paid as well as they would be at a larger institution. This shows in the fact that most of the higher qualified professors seem to actually care about teaching and are not here mainly for prestige or money."
College Senior,4,The counselors are very willing and available to help out. The meetings are not timed like they can be at some larger schools.
College Junior,4,"There are two things I love about BC. One is the gallery. It is in the main building; and, it will hosts some of the most interesting pieces of art. The other thing is the science labs. They are well equipped and set up in a very inviting way!"
College Junior,4,"It is reasonable priced. It does cost a little bit more if you are out of districts, which does add up over time. However, it is very reasonable priced considering all the free tutoring and mentoring available."
College Junior,4,The college is very interactive. There is always something going on!
College Junior,4,"This particular college has grown so much because of the fact of its availability of classes,variety of classes  and the top   Job aspects. Brazosport College emerges with some of top leading companies to ensure students with many options for job placement. I am currently enrolled and will continue to enroll until I revive my degree."
College Junior,4,"job prospects 10/10
career center 10/10
alumni network- not sure"
College Junior,4,"Gator loft (weights) 9/10
Student Center (Tutoring) 10/10
Library 10/10
Campus Activities 10/10
General Campus aesthetics 9/10"
College Senior,4,"Accessibility to computers around campus is very good. There computers located throughout the campus and the wireless network is very good. Sometimes the system runs slow, depending on the number of students logged in, but most times it very reasonable. The library has printers and copiers as does the learning center. Some printing is free as part of our student fees, but for some copies it can be five cents a sheet, which is reasonable."
College Senior,4,"There are many activities around campus in the student center, fitness center, and game room. The numerous clubs have various events happening regularly as well. "
College Senior,4,"Being an older adult student, I do not associate much with these much younger students but from my classroom experience with them  most are very serious about obtaining good grades and moving their education to a higher level."
College Senior,4,"The classes are easily accessible online and system works most of the time. I never experienced any down time due to the connection or web site having problems. Each professor has a different teaching style which takes a few class sessions to adapt to, but overall most are helpful as well as accessible with in a reasonable time frame. The workload depends on the individual professor and the amount of materials that must be covered during the semester. 
The registration process online is quick and easy as well as making online payments. We have a call center, where I work part time, that is there to answer questions as well as assist students with finding their way around the college website. The website is very user friendly once the student has some basic understanding of the different information that it contains, like add/drop classes, finding the cost of classes, and the course schedules and catalog that are there for them to refer to.
"
College Senior,4,"The school is small, but well equip to handle the students needs. The school has an excellent library and learning center. There are several perks that are included in our fees such as free tutoring, plenty of assessable computers, and people always available to help the students with academics, registration. and financial aid.  "
College Senior,4,"I went to Brazosport to get my associates of art, but I honestly didn't take many art classes. I got my basics down, but because it is still a fairly small campus there isn't a massive selection for course loads. I ended up having to take another biology class for my extracurricular because there weren't anymore art related classes to choose from. The job opportunities at the school are just student worker positions working in the office or the library. The only job related to a form of fine arts was a position I took in the theatre as a crew member. "
College Senior,4,"Although there were bugs on occasion, the system is relatively easy to use and very convenient. In my experience the workload is quite reasonable. Generally one assignment is due every week, and after the selected number of chapters are up you take a unit test. In the classes I've taken we have always had assignments that involved posting information on a selected subject on a forum and then commenting on another students post. This was an interesting feature that definitely made it feel more like a classroom. "
College Senior,4,"There is a lot of things we can do together as students. We get encourage to go hangout at the ""Swamp"" which is like a game room and other places like that. "
College Senior,4,They cool thing about the school is that they encourage us to call and email our teachers. The school makes sure that each teacher tells us (the students) when they are available to meet. Each teacher is just a few moments away from a phone call.
College Senior,4,Every one is nice. A little town with a big heart.
College Senior,4,There is some classes where the professor can only be contacted through email.
College Freshman,4,"They have a lot to offer, regardless of your age, grades, or situation."
College Senior,4,I chose Brazosport College because it had a magnificent dual credit program with my school and was located conviviality. I also liked how flexible the times were for classes. Brazosport even offers online classes if the scheduled class times on campus don't work with a student's schedule.  The teachers are also very thorough and the curriculum is well planned.
College Senior,4,I love the fact that our classes are usually composed of a small number. It makes the classes feel more personal and it is easier to form an awesome student-teacher relationship with your professor. The small class sizes also give you more ample opportunity to ask questions and get help. The educators are also quite fantastic. I have yet to have a professor that wasn't willing to work with me or any of my peers if we were having trouble or needed something explained.
College Senior,4,Our school has a massive variety of people attending. There are students from just about every age group and ethnicity. Everyone is very friendly and in attendance to learn. Brazosport College definitely harbors a great community feel among the student body.
College Senior,4,"Brazosport actually has really fantastic on-campus resources! We have a great gym, a sizable library, and quite a few computer labs. My favorite thing about the campus is the fact that we have easy access to a writing and math center along with tutoring and study rooms complete with a white board and markers in the Student Success Center. There are a plethora of clubs to join on campus as well, including the ever famous Zombie Club. The campus also have a few places to eat or catch a quick coffee before that 8am lecture. There are even tons of comfortable, quiet places to study all around the campus. All in all, Brazosport College is a very well equipped campus!"
College Freshman,4,"We have a huge student success center, and the library is very up to date. The fitness center has all the latest equipment. Also, student committees and organizations are always doing something. And the campus is really lovely."
Sophomore,2,"Constantly changing degrees/courses.
Add requirements that force you to go backwards
Always not offering  the advanced/senior classes but numerous beginner/freshman classes which leaves MANY students unable to finish their degrees.
No real support from administration except shrugging shoulders.
Teachers not showing up for classes, leaving you to teach yourself.  Many classes are going to online versions, still full/not available.
Just sick of the money we have put into this school with NOTHING to show for it!!"
College Freshman,2,I prefer in the classroom
College Senior,2,There is not a lot of help for my field
Freshman,1,I don’t like it. I’m being blunt because my teacher has never worked in the field. I’m trying to get my education up but my add  impedes . We lack in money so we can barely get money for a physical dignaostic
Recent Alumnus,1,Do not help at all! Thank god its not a super expensive college or no one would be able to receive any benefits from FAFSA or other scholarships.
Recent Alumnus,1,I really do not like online classes for reasons I have said before in this survey. Not being able to ask questions and have them answered immediately is terrible.
College Sophomore,1,Login Issues – The only problem I have found lately is the issue with logging in to my IT account to get transcripts and info.
College Sophomore,1,"After my first two semesters I went to the financial aid office to fill out my paperwork for my second loan.  I was told on the first day of registration that Brazosport has a requirement of 31 credit hours for freshman before more financial aide can be achieved.  I work a full time job and have completed 16 credit hours in two semesters, one of them was summer, and can't afford to pay for college.  That day I registered for 13 more credit hours to be told that I have less than a month to pay $618 plus books to be able to go to school for the fall semester.  I do think that this can be changed through the proper channels."
