College Sophomore,4,"The only downside to off campus dining here is that there are no/few student discounts, and very few places within a 5 minute drive from campus.  If you've got time for a 10-20 minute trek, you can get just about anything, and for very reasonable prices too- assuming you don't choose an extremely swanky restaurant.  There are almost all the classic chains found in most regions, along with some great local restaurants and plenty of fast food options.  If you wanted to, you could eat out for months without repeating a place."
College Senior,4,"It takes some time, but by your 4th year hopefully you know some good spots to eat outside of campus. There are plenty of ethnic places in the city. You can find great Mexican and Thai food. Sushi's okay. Chinese is okay. Italian-decent. Greek-pretty good. Mediterranean-not bad. Indian-not bad. BBQ-pretty good. A lot of fast food around. Everything is really cheap here and all pretty much within 15 minutes of driving. Student Discounts? I've never heard of any, but that'd be cool. Some places to check out- if you enjoy authentic Mexican-El Rancho. Hands down, my favorite restaurant in town. Eat right. Eat with the locals."
College Senior,4,"Crime on campus? Out of the 2 years living on campus, I've never had any major problems. I have never felt in danger while on campus. The police are usually patrolling or on duty 24/7."
College Senior,4,"So far? Well I am a Senior Filmmaking Student at UNCSA and have a few more months to go before I graduate in May. Favorite experiences? Too many to name. But in broad terms, it definitely has to involve fellow students from the school. What makes UNCSA, UNCSA? Our mascot. I would not take back my 4 years if I had the opportunity to. I actually moved out all the way from Bay Area, California to transfer to a community college in order to study here. And after all that- it was still worth all the trouble. Come here, you won't regret it!"
College Senior,4,"For what you pay, it really is some of the best you will get for the rest of your life. Unless you move to a third-world country. I lived in the dorms my first year (the worst living experience in my last 4 years). My second year was at the Bailey St. Apartments (a lot better) with four people to a small apartment (bathroom, living room, kitchen). My third year and fourth year have been a house shared between four other UNCSA film students. Our rent is a little under $300/month + utilities= ~$350-$400/month. We also have a front and back porch, 3 bathrooms, 2 living rooms, and 2 kitchens. It doesn't get much better than this. Our landlord is a nice guy, but our house has been broken into! Parking is great and easy like the rest of the city. The school does not specifically help students search for off-campus housing other than their Center Stage Apartments, which are not worth the $$ IMO."
College Sophomore,2,"The dorms are very old and need to be updated. The bathrooms are almost never clean, but the resident life is good."
College Sophomore,2,The school itself does not deal much with scholorships. But will easily point you to a loan
College Freshman,2,This school does not have a good amount of parking. The only parking lot that is available to students is extremely far and is most of the time not worth the walk.
College Sophomore,2,"You'd better find a friend with a car, or be prepared to wait a half hour for a very expensive cab."
College Senior,2,"UNCSA not have a sports team. However, the school does have a mascot- ""The Fighting Pickle"" which has been on a list for some of the cheesiest college mascots across America. We have a pretty good school gym that is within walking distance from the dorms and Bailey Apartments. The field that we used to play ultimate frisbee, football, and soccer is now under construction..."
College Sophomore,2,"A portion of the school is under construction and that portion used to be a parking lot that is now blocked off. So that gives most students with a car a limited place to park. The only place to park is a parking lot south of campus that can be a very far walk from dorms, classes, and academic buildings. If you're an RA you can park behind the dorm. But if you park illegally the campus police do give tickets and if you avoid the warnings your can get towed. So really you just have to follow the rules as far as parking goes, until construction is over, and there is more places to park."
College Student,2,the programs here are very demanding and do not promote a lot of free time for this sort of recreation.
College Sophomore,2,"You'll find many characters at School of the Arts. There's 5 programs - Music, Dance, Film, Drama, and Design& Production. A certain level of artistic sophistication is located in every department, but each has it's unique set of stereotypical qualities. Drama tends to be the most stuck-up. They dress up in all black ninja-like outfits everyday. Also they typically display fake personalities, as they are always acting. I have found several to be talking in a strange irish accent for a week at a time. They use life as a stage, and are constantly playing pretend with themselves. Music kids are the hermits. It's hard to describe them because they are too busy hiding indoors. Ironically, they are never seen nor heard. Film kids are the quirky, hipster kids. Pretentiousness is not hard to find. They spend most time disagreeing about the quality of movies and participating in strange activities. I have found a group of film kids dressing up as pirates for no reason. If you like mainstream Hollywood cinema, then keep your mouth shut around them. Dancers have a New-York esque flair to them, and if they are male they are most likely flamboyant and homosexual. Not afraid to express themselves in any way. The most attractive women are found in dance, but their intelligence lacks. A lot. Design and Production students are like hardworking ants. Underground, straightforward, and sketchy. They work hard. They are technical geeks. They could build you a stage in a week. And they will not hesitate to tell you how busy they are. That's Uncsa students in a nutshell."
College Junior,2,"Cars Are Your Friend. while UNCSA has buses, they mainly take the high schoolers who live on campus to walmart once a week.  Cars are your friend for the most part.  The closest walmart is about 10 minutes away by car and off of a main road that is not bike friendly.  Most places are more than a few blocks away from campus so either have a car or make friends with someone who has one."
Junior,1,"This school is a scam. It is basically a for-profit institution where the administration is in it for themselves, and the professors privately acknowedgle the multiple issues with the film school on a creative, educational and personal level."
College Sophomore,1,UNCSA does not have a Greek life community.  If you wish to go to Greek parties and get involved with that you can go to Wake Forest College nearby.
College Sophomore,1,We don't have athletics at UNCSA.  Our mascot is the fighting pickle and there are no football teams or other sports teams available
Recent Alumnus,1,The UNCSA Police Department is a joke. They spend all of their time writing parking tickets instead of patrolling the areas where multiple students get mugged and assaulted.
Recent Alumnus,1,The dorms are absolutely disgusting and should be torn down and rebuilt
College Sophomore,1,"There are actually no sports on campus.  I think there might be inter murals for some things, but it's rare.  We are a very demanding school academically, and sports would make good grades near impossible.  Plus, it's an art school."
College Junior,1,Dont go to graduate school here if you want an education that supports you as an artist or critical thinker. Only sheep will do well here.
