Freshman,4,"I am currently a freshman here at Ship. So far I am pleased with my experience. I enjoy the suite style living, the small class sizes ,and the amount of clubs the school has to offer."
Sophomore,4,I love some of the professors here and the marching band is awesome. I know exactly what classes I need to take each semester.
Freshman,4,The focus at Shippensburg University is Face-to-Face interaction. Every professor I have had to date has been focused on interaction with the student. The process to schedule classes and make choices is also personal. In order to register for classes you are required to see the adviser and the adviser personally gives you a pin to access your scheduling. All the on campus groups and organizations also have a personal and welcoming touch.
Senior,4,Shippensburg University is the place where I'm not only receiving a good education but I also made life long friends. The campus life is excellent and very student first.
Freshman,4,"After going over to the campus and taking a tour through the buildings and site, I really felt comfortable in the area there. I think that the students and teachers there are very fun and pleasurable to be around with my time hanging out with them. The area where the students and I would live in is very sweet because of how much they make it look like home. Overall, I think that Ship would be a great place to be in."
Sophomore,4,The campus life is very good. The communication in the dorms could be better. The professors are easy to wok with and understanding. Parent involvement is nice.
Freshman,4,I love how everything on the campus is pretty much altogether and easy to find. Everyone on campus is very friendly and will help you with anything.
Sophomore,4,"Shippensburg University is a good campus and it has decent  professors, but it was placed in a boring town with not much to do."
Niche User,4,"I went to visit Shippensburg University this year for the exercise science program. I really enjoyed talking to the different students in that program and learning more about the jobs you can get after completing that degree. I also got to take a tour of the campus and eat in the dining hall which was mainly the only thing I wasn’t impressed with. The dining hall food wasn’t terrible but I thought it couldn’t been better. Along with that, the buildings all around campus are extremely nice and modern but the landscaping makes the campus feel very industrial. Above all, I really enjoyed this University."
Niche User,4,The campus is very nice. people are super friendly. The dorms are really nice and up dated. A lot of food options around campus and safety is a big priority.
Niche User,4,Shippensburg is a very nice university with a very nice campus. The dorms are top notch and I really enjoy the food.
Freshman,4,The price of Shippensburg University is very cheap compared to other colleges around. I work in the registrar's office and there are very nice people who I work with. I am also on the Frisbee team and it is a lot of fun.
Alum,4,"It is in a great area of the State of PA. Close to major interstates, Philadelphia, MD and mountains.  Beautiful campus, and nice little town.  Outdoor activities include hiking, biking, fishing etc. opportunities for employment while going to school.  Good social scene and plenty of academic and social organizations to join. Classroom size is small, and many upgrades to campus.  Including dining halls, lounges and student union."
Sophomore,4,Its the only place I've gone to because I procrastinated in the process of college searching. I can't say I regret procrastinating the college search because I've made a lot of good friends here and the professors are very helpful as well.
Junior,4,"School is very nice, very up to date and features many outside of class activities.  The school seems very safe.  Professors are extremely smart in the college of business."
Sophomore,4,"A great campus that is still making renovations. Professors, students, and other staff are all happy to help with anything. Very easy to communicate with. I would have given a 5 star but because I recently transferred here, I am still new and learning everything here."
Junior,4,"I like the people and some of the teachers. There are only a few things that bother me. The school is not big. The food isn't great. There is only a small town outside of the campus. Police are cracking down on parties. The campus is dry, so no alcohol allowed. The dorms are way too expensive when the off-campus housing is almost half of the on-campus price. However, the school has many accreditations. The people are great. Lots of people help with charities. We have pretty good athletics teams that consistently win."
Senior,4,Shippensburg University has great programs that fit my needs in Communications. I have found my niche in the basketball as well as in other sports leagues in the community. I am happy I chose this to be my college home and look forward to continue going here.
Senior,4,Ship has a friendly atmosphere and very welcoming to all of its students. I love meeting new people and having the opportunity to learn with them.
Senior,4,"People often say that Shippensburg University has something for everyone, and after spending 4 years on and around campus I would have to agree. With hundreds of clubs, sports teams, and constant free activities, it is truly difficult to be bored. Coupled with amazing accredited academic programs and professors with real-life experience in their respective subjects, it is easy to see that Ship is it!"
Senior,4,Shippensburg is small enough where you can get to know the community and make the school feel like home. There is a good atmosphere for learning.
Alum,4,"Shippensburg University creates a community that provides a home-away-from-home feel. It is big enough that you do not feel like you are constantly seeing the same people, but small enough that you will see a familiar face as you walk across campus. It provided me the opportunity to become an independent woman as I earned my degree."
Sophomore,4,"This school is definitely a second home to me. The residence halls are very nice and the RA's are very involved. There are many social events to go to such as movie night, bingo, skating, laser tag, and dances. The professors are very hands on, they want to see you strive for greatness and want to help you as much along the way. The only thing I would consider changing is the food, they make the best food for open house, but when all the families leave, it goes back to mediocre food. If you want a home away from home and to feel 
a part of something this is definitely the school for you."
Junior,4,"Shippensburg University is a great school to get an education. They are an accredited school for business which was a must for me. Some of my favorite classes I have taken would be Business Law, WIFYS, and Accounting. I really liked the insight Business law gave me. It made me realize that everything you do may have a consequence which is not always in your best interest."
Freshman,4,"Shippensburg is a good university, the tuition isn't too expensive and the professors are usually very nice and helpful. It's a dry campus so there aren't too many situations where the neighbors on campus are loud. The suite style dorms are wonderful because there are bathrooms for every two people to a room. There is also a police station in the middle of campus and the blue help buttons are scattered all around the side walks."
Alum,4,"The size of the school was perfect. Not too big or small. The location, however, was in an extremely rural area and I was the town was built up a little bit more to involve more community activities."
Freshman,4,The college is small yet big in learning and experiences.  I exciting about learning new things and meeting new people. I wish it was closer to home.
Senior,4,I like the variety of clubs that are on campus. There is a lot to choose from to help get you involved on campus and in volunteer work. Most of the professors are very nice and willing to work with you to help you understand the material better.
Sophomore,4,"Shippensburg University is a wonderful university! The program for those interested in becoming educators is phenomenal as well as the business programs. Students are provided with many opportunities to build partnerships with future employers and other students through internships. There are also plenty of activities for students to participate in, as well as a concert venue on campus (H Ric Luhrs PAC) which provides great entertainment year round."
Freshman,4,"My experience at Shippensburg University so far have been a really great one. There is a lot of resources on campus to help you when you need it and also the professors are great, they try to help you in any way they can. One of the great things that Shippensburg University has to offer is a class that helps you throughout your first year of college."
Sophomore,4,"I like Shippensburg best for its education. There are many clubs and organizations you can join, but the food could be way better."
Freshman,4,I like that the Professor's are very easy to talk to.  They give you positive and negative feedback and lead you in the right direction to correct the negative.  The classes are challenging but if you put 100 percent into your work you will earn  good grades.  I believe if you invest your time into your education at Shippensburg your return will be of high value in your future.
Freshman,4,"I like that Shippensburg is in a good area that gives you both a taste of country and city life with just a short drive. I enjoy the college and its professors are quite intelligent, but most of all I love the fact that I'm more than a number to them and that they truly want to see us do our very best in college."
Freshman,4,"Shippensburg University is a very friendly and challenging environment. The school itself is amazing and the so are the people there. The studies are challenging, but are rewarded with positive professors that are willing to  help."
Freshman,4,"I like the intimacy of Ship it's a very small school which I personally love. Being in a small/medium sized town you get to know a lot of people, not to the point where you know everyone and everyone knows you which is nice, but in the sense that you get to make a good amount of friends that will stick with you forever. Another aspect of Ship that I love is the housing and dining services. The dorms are extremely nice and accommodative,  and make you feel right at home which helps settle in your first year away from home. The food is amazing and you get a lot of options which is nice it's not the same food everyday, and you also have late night options for late night study sessions. If there was one thing I could change it would be to have a more diverse campus. Because Ship is a smaller school people don't really come from all over the county or world even to attend and I really wish there was a more diverse population."
Senior,4,"Shippensburg is a welcoming place. Coming from a small town, I was able to appreciate the diversity spread across campus. Within the residence halls, you build a family and notice that there are many engaging activities that include talking about diversity. They challenge everyone to face the reality of racism, privilege, and hardships that people don't necessarily want to talk about but need to if they want to experience change in this world. This was an amazing experience- if given the chance to do it again- I would continue to go to this campus forever. If you're in search of a mid-size home where you can make a difference, then Ship is the place to look into. You will not regret it."
Freshman,4,"My experience at Shippensburg has been great so far. I like how friendly everyone is on campus. The campus is very safe and protected by campus police. There are many types of dorm selections to choose from. The classrooms are nicely sized and has good professors. Also, there are plenty of resources on campus that can help you with your work. However, I say that the food on campus can improve and the prices can be lowered. Overall Shippensburg is a well built University."
Sophomore,2,"While Shippensburg's tuition is very fair for the education you are receiving and access to the updated facilities are great, the culture there is toxic. For a division 2 school, athletes are not dedicated and each sports team only has a couple of good athletes to show for, don't let recruiting fool you. If you enjoy partying and getting drunk, this is the school for you! Admittedly, nights on Richard Ave. are fun, but the culture of drinking every night causes its own set of problems. Police presence is ridiculous, and they hand out underage drinking citations like its candy. If you want alcohol poisoning, join a frat or date someone from a frat. Or hang out with the Track & Field, Lacrosse, or Swim Team. If you go here, don't let the excitement of the night life distract you from classes! But most of all, TALENTED ATHLETES & STUDENTS SHOULD NOT GO HERE."
Recent Alumnus,2,I don't really see the point in having greek life at Ship.
College Sophomore,2,"Can not be around campus if intoxicated or drinking in the dorms.  Can not park anywhere not allowed without expecting a ticket. cops are not social or talkative, mean even when just registering for parking permit."
College Sophomore,2,"Its all pretty much just pizza, bar food, and diner food. Something unique would be nice."
College Freshman,2,"There are a lot of ethnicities, but people tend to stay with their ""own people""."
College Freshman,2,"I'm in the school of business, but right now, I'm just taking gen-ed classes."
College Freshman,2,Teachers are selfish and think that you only have one class.
College Freshman,2,There are some study places in the dorms which is cool. The Dauphin Center is 24 hours.
College Freshman,2,There's nothing around here. I rather be home.
College Freshman,2,"I would definitely choose a different school. I would choose a bigger, more athletic, and a school with more opportunities. I would also choose one within the city."
College Freshman,2,"I haven't heard much about sexual assaults on campus, but there is a place called the ""rape steps"". The health center is pointless. They really don't know what they're talking about."
College Freshman,2,It's so hard to healthy on this campus. The food is very oily and lacks taste. Some of the food doesn't seem cooked thoroughly. The lettuce are usually shriveled or brown or a combination of both. I rather cook myself.
College Freshman,2,I understand it's a state school but I could definitely use more aid.
College Freshman,2,Summer orientation is a bad experience. Students are all over the place with questions where others do not have the answer. Then the disappoint comes when the parents wants their children to get an education here and there questions gets unanswered or the staff ignores them. I had that experience last summer.
College Freshman,2,"I didn't receive any scholarships, but I got semi-good financial aid"
College Senior,2,I have seen better days but recently the nightlife has sucked.
College Senior,2,The police are undercover racist who use our school privelge against us to take away our fun.
College Senior,2,"The cost of living is the best feature however, the nightlife and transportation needs can be improved tremendously. It would change the attitude of the student body for the better."
College Freshman,2,There are parties practically every night.
College Junior,2,You must have a 3.0 to get into the major and keep this major. The requirements are strict and they hold you to high standards as future educators.
College Sophomore,2,"The only aid I received was the worst aid possible from the government and none from the school itself. My family is literally about $200 in income above regular aid help. However, my Family is more in debt than which allows my school to be efficiently paid for. I had many expensive medical bills throughout my upper lever education from 6-12 grade and continuing. This bump in the road caused us to pay off my medical debt and overlook other debt that was racking up. As of now, our debt is high and while trying to pay off that, the school debt is an even greater challenge. It would be nice to have some help and consideration for the current situation I am in as it is not my fault."
College Senior,2,"Up in the mountains, mother nature can be harsh."
College Sophomore,2,Its a small town.  Nothing really to do.
College Sophomore,2,The system in place is very inconsistent.
College Freshman,2,"Nightlife sucks, theres never a definite party going down and when something big is going down the cops shut it down right away."
College Freshman,2,"Few good places to eat off campus, just mostly fast food."
College Freshman,2,Only way to really get around is by walking or driving yourself
College Sophomore,2,Nothing really to do outside of campus.
College Freshman,2,"The financial process if very stressful, especially if you don't complete it on time or right away because you won't be offered much money or you'll have to take out loans. Getting scholarships at Shippensburg is somewhat difficult since there is no application you can turn in; officials will look at your grades or scores from high school and see if you qualify for any scholarships offered at the university."
College Sophomore,2,"I applied for a lot of scholarships and did not receive close to what I need to make it through school. I am still applying for scholarships, as I struggle to pay for school. "
College Freshman,2,"Way too uptight, I thought I'd have more freedoms."
College Freshman,2,"A large majority of the kids smoke marijuana. If they're not doing drugs, they are drinking. Shippensburg is notorious for partying. "
College Freshman,2,"The financial aid process was fairly easy at Shippensburg. The best way to receive aid and to resolve any questions is by contacting your school, or by talking to a counselor. "
College Freshman,2,"Off-campus dining mainly consists of fast food and small diners. The diners are decent, however."
College Freshman,2,The Greek life is kind of a joke. They take themselves way too seriously and the houses are disgusting. 
College Freshman,2,"Campus life is okay. My dorm is very tiny and I live in one of the oldest halls. However, the people in my hall make living there better. "
College Freshman,2,The town is rather small and boring. There is not much to do on weekends and there are mainly thrift shops and small restaurants. 
College Freshman,2,"The only sports that attract above average attention is football and rugby. Fan support for the football is very apparent. Students and family represent wearing school merchandise and cheer for the team. The rugby team doesn't receive that much attention, but is one of the best teams in the nation. The rec center includes basketball, racquetball, an indoor track, and a weight room. The weigh room is very small, but accommodates a fair amount of students."
College Freshman,2,"There's not much crime on-campus. Most crimes are juvenile, such as stealing flags or small vandalization. Walking across campus alone is not a problem due to the size of the campus. Throughout campus there are several emergency buttons that can be pressed that will sound an alarm and attract attention. Most campus police travel off-campus and patrol up and down the party streets."
College Freshman,2,"The arts and architecture of the school are very limited. The rec center has a large 4 court, basketball court. The weight room is very small. There are plenty of campus events located in the student center. The student center has a dining hall, snack shop, a game zone that includes pool, ping pong, and air hockey, and there is a quiet TV lounge."
College Freshman,2,"The new suite style halls are very nice, but are designed very poorly. Second floor stairs are located right next to elevator, which is pointless. Social interaction in suites seem nonexistent. Suite style is a more homely living feel, but the price difference from traditional is just too much. Laundry isn't very expensive, but size is small, so more loads are required. Wi-Fi is very poor, cuts out very often. Most dorms are located right next to each other, so traveling to class is equal distance. The housing process is very basic, first come first served basis"
College Freshman,2,"There are plenty of places to eat ON-campus so not many students feel the need to travel off-campus. However, there are various places to eat off-campus. There's minimal restaurants, but fast food joints and snack places are not far from campus."
College Freshman,2,Most students fairly same background. Some unique individuals.
College Freshman,2,On-campus students fairly quiet. Quiet college town
College Freshman,2,A big hassle. Very long process. Got expected aid.
College Junior,2,Only certain major groups to be a part of. Kind of like High school.
College Junior,2,It's a dry campus and police are constantly a pest.
College Junior,2,"The police force aren't anal about the guidelines of underage drinking unless you are bringing a lot of unwanted attention to yourself by stumbling, excessive noise, or destroying property. Besides people who might endanger themselves or others, the cops don't bother you that much. But they do have a prejudice against drivers and will give you a ticket for anything and everything."
College Sophomore,2,I don't pay attention for this. I don't care about how good our teams are.
College Sophomore,2,There is a mall with a movie theater in Chambersburg. It is a small town.
College Sophomore,2,"Most classes require you to do volunteer, or outside arrive work. If you don't drive and have a car, you may struggle to meet class requirements, and may be forced to withdraw from the class. Avalible public transpiration is scarce, and does not really meet the student's needs."
College Sophomore,2,In the social work classes there are very few men in the field then women. The ratio is this particular course of study is about every 7 girls to 1 boy.
College Sophomore,2,Not much student life in buildings. The bathroom facilities are low quality.
College Freshman,2,Everyone get along for the most part but some people are just weird
College Freshman,2,The greek life is boring. It supposed to be an organization where you reach out to indiviuals and help them as a group. They arent really together they rarely throw parties. They don't take it as serious as they should especially at Shippensburg
College Senior,2,"not good variety, bad hours (close early), expensive"
College Sophomore,2,"There are a few labs in various buildings around campus but not all labs can be accessed by all students. The main spot for computer usage is the library and even there the amount of computers seems very slim compared to the amount of students who need to use them. 

The system itself is very slow and it takes forever to log on and to load programs and web pages."
College Freshman,2,"The storage lots that first year students need to park in are a good 5 min walk from the nearest dorm... assuming that's your dorm... and in pouring rain, it sucks haha"
College Freshman,2,The process was slow. I was on my own with little help from the university.
College Junior,2,There's a lot of off campus parties & if you have a car there's stuff in Harrisburg and chambersburg
Junior,1,"I would have liked if the professors were more acceptable of our online situation when classes went online because I had many issues online. And my two professors did not even care that I had to work still and if my internet went out. Also, my one professor added a new system onto the syllabus so we had to learn a whole new website instead of introducing it in class at the beginning of the semester instead of throwing it into our face while we were already struggling with the transfer of classes going online."
Sophomore,1,"Terrible financial aid, will not help assist you in getting help. I had financial issues and they still refused to help me. Now have to find a way to pay thousands before doing rotc for this school. Don’t know how I will pay for it or where I wi
ll even sleep or eat there."
Sophomore,1,"Don’t go here.

When I first arrived at Shippensburg for my orientation, they made everything appear to be a lot better than it actually is. For one, Shippensburg University leads the entire country, yes the entire COUNTRY, in student arrests/criminal activity in relation to student entrollment size. This is absolutely ridiculous and should not be the case. I have been to other colleges where the drinking, drug use, and actual crime is much, much higher than it is here. The police around campus are out to get students, and they are in it for making money for their department. They are disrespectful and offer no real help to the students. All they care about is busting kids for smoking weed and drinking."
Freshman,1,Pick another school!!!! Everything is a joke from the frats all they way to administration. Majority of kids who go here are fake and are either high or drunk. Not a place to excel academically. Frat parties are fun the first 2 times then it’s a repeat of the same music and people. High crime with a police department that doesn’t care about solving them. This school is only good if you need to propel yourself to a certain GPA to get out of this STD riddled school.
College Freshman,1,"I'm used to late night food. The only option that is 24/7 is Sheetz and it's so unhealthy, and walking there at night and in the cold is the worst. The food just like the food at the school just with a better taste."
College Freshman,1,I am not part of it. It has no baring on me
