College Junior,1,I have not received any financial aid since I was a transfer student. It is also hard to get scholarships unless you are an A+ student or if your family is in the poverty category.
College Freshman,1,"I hate my dorm (Naugle) it's the absolute worst. The bathrooms are completely gross, not that the staff doesn't take their time cleaning it everyday but the people here just have no home training; which is crazy since the girls' bathroom from what I hear is the worst. & my dorm doesn't offer air conditioning or the ability to move the furniture around if we wanted to."
College Freshman,1,It is generally very cold since we're up near the mountains. I'm not used to the harsh climate but you become used to it.
College Freshman,1,The food on campus is nasty! We pay amounts of money to go here and the food is disgusting
College Junior,1,"There is parking on campus but the cost of a parking permit it $67 per year. For this 67 dollars, there aren't many commuter spots and those that are available are on the outskirts of campus and not close to academic buildings. There are many faculty and staff parking close to campus. There has been construction on campus and so the commuter and resident spots have been taken away and they've given more faculty staff parking. It can be very frustrating trying to find a spot."
College Senior,1,Diverse school surrounded by a narrow minded community
College Junior,1,Nothin to Do around here at all! Chambersburg and Harrisburg are we're you go to watch movies and stuff
College Senior,1,Shuttle service is very unreliable. They do not follow the pickup schedule that is posted.
College Freshman,1,"If you are an incoming freshman and plan to bring your car to campus, you are forced to park in one of the two storage lots. These lots are located far from the dorms and are notorious for causing damage to your car. They are not monitored for safety and are on the outskirts of the campus, making them kind of unaccessible. If you are an upperclassman then you can park in any of the commuter or resident lots that are located outside the dormitories and class buildings. However because this is a relatively small campus, there is no need to drive between classes, making those lots kind of impractical,"
College Sophomore,1,"Whoever said this school is a party school must be living in the past or under a rock. I have been to every single spot in Shippensburg, from Creekside, to Frat Row, to Bard, you name it and they are all ass. No one dances, kegs kick at 11:30 and they all get busted.  Two years ago this may have been a party school but not now."
College Freshman,1,"Very Unhelpful – The employees of the financial aid office offer little to no help to students and are very rude when you go in or call to ask them questions. If you email them, it could take weeks to get a reply."
College Sophomore,1,"The commuter parking at Shippensburg is pathetic.  There is one huge lot on the far end of campus.  It is often cut in half because of events happening at the Luhrs Center across the road, or other events that need parking.  They block off the closest end of the lot, so students are jamming into this lot and walking very far to class.  There are a few other parking lots for commuters on campus, but all have 30 or under spaces, and are always full.  Not to mention the tiny spaces - I was T-boned in the parking lot because of how tight it is.  Poor visibility and not enough room."
College Freshman,1,"Bring an umbrella. It rains about 75% of the time here (especially during the spring and fall) but when it isn't raining, it is absolutely gorgeous here!"
College Freshman,1,"Drugs Are Everywhere – I can smell weed in my residence hall. There are drunks everywhere. The RAs do not crack down on the intoxicated, even if they are causing a scene."
