Alum,5,Most people don't think much of ship until they've experienced it. I really enjoyed my time as a business student and found the faculty and students to be very open and friendly.
Alum,5,"I loved my time at Ship! I met some of my best friends there who I still talk to even after graduation. The professors are some of the most caring individuals you'll ever meet, they really care about you and your future."
Freshman,5,Shippensburg has been very professional and openly communicative with the recuritng process. When I went to visit they did a outstanding job in making me feel welcome. So far i don't seek any changes.
Freshman,5,"I haven't taken no online courses. But for the orientation the professors and advisor was so friendly and professional, it felt like they knew who in was already. And i really like that alot."
Freshman,5,I am currently a freshman business/accounting major. I feel that my overall experience at Shippensburg has been good. The challenges and impact of COVID-19 has effected my spring semester. I was hoping to adjust and be open to joining several clubs for the social experience. Shippensburg is in a rural area and some limited resources. I am hoping I will take my car for sophomore year to allow accessibility off campus. The college is smaller and my classes were convenient from my dorm. They have multiple resources available for education and social atmosphere. I am looking forward to returning to school in the fall and continue my education.
Niche User,5,I started my career at Shippensburg University as part of the Ship Start program and plan to continue my career there in Fall 2020. The campus is beautiful and I never felt unsafe on the campus. All of the professors I have came in contact with were welcoming and there to help me at any time. I commute to Shippensburg University every day since I only live 20 minutes away. The campus has many parking lots for commuters and they are not far away. I loved my experience as a Shippensburg student this far and cannot wait to continue my journey.
Freshman,5,"For an example, during this pandemic staff have been very cooperative. The dorms style, and campus is ideal, same with athletics."
Freshman,5,"they take your academics serious and try all they can to help you pass. they offer tons of resources for you to help with grades, health, or finding friends."
Alum,5,"Shippensburg is a great mid-sized university where students can blossom in and outside of the classroom. Currently, Shippensburg is renovating campus in all aspects from dorms, athletic centers, and classrooms."
Sophomore,5,"I love it here! I am studying Math and I love all my professors. They are very willing to help and want you to succeed! I have only been here two semesters, but I enjoy my time here very much."
Niche User,5,"Shippensburg is an amazing campus, everything about it is stunning. It really makes me feel at home. I enjoy each and every day I am on the campus. I cannot put into words how great each person that is associated with Shippensburg is."
Niche User,5,"I attend the BSW cohort program and find it to be appropriately challenging. As a non-traditional college student, the fixed schedule is great. I love the professor's,  and the connectivity woth my cohort classmates."
Freshman,5,the campus atmosphere is relaxing and inviting . the dorms are very nice and the college offers array of courses and student support.
Freshman,5,I love Ship University. The friends I have already made here are very kind and it is nice to be in a school with such wide ideals and dreams. I am excited to continue my education here.  I wish they would improve on the food side of things but overall my general experience here is everything positive.
Freshman,5,"Shippensburg is a very fun school. There is a lot of new faces and people to interact with. The professors are nice, most of the time. It is an excellent experience, especially when there is a lot to see and do."
Sophomore,5,I've been at Ship for a year now and I love everything about it. It feels like home to me. The atmosphere of campus is healthy and welcoming. Everyone is so friendly and helpful.
Junior,5,"I have visited a ton of schools since I was a junior in high school. I could not say this about the others but how welcoming Shippensburg 
University was with the students and parents and how much they really care about the community. This campus really made an impact on my decision.  I really felt like I fit in for once and I could not have made a better choice for my education. This place gives off good vibes that I didn't feel anywhere else.  I feel honored to work with an institution that really cares about the students success and future."
Freshman,5,"I have visited many times and cant wait to start my freshman year, but from the times that I have been here and what my buddies all say about things that i haven't been lucky enough to experience yet it is the place to go and it is a magical place."
Freshman,5,I am choosing to attend Shippensburg in the fall of 2019 because there is so much to do around there. There is so many outside activities you can do when its warm and all the farms there are so pretty. There is not much to do around the campus but the campus itself is amazing and gives you so many different options of things to branch out on and learn more about yourself.
Freshman,5,"I love it here at Shippensburg University. The students are willing to help, they hold the doors open for you, they'll give you directions to the stores off-campus, and tell you where to find the buildings. They are also very polite always saying thank you or you're welcome. The teachers are always willing to work with students. They'll work with the student's schedule to make sure they can get one-on-one time to work on classwork or homework. The student life is amazing, there are always things going on for students to get involved in."
Freshman,5,"All staff are very helpful and resolve issues immediately. I love the campus, its always so clean and pretty. There isn't anything wrong with the campus. The class sizes aren't large, the surrounding area is very pretty with lots of options for food and shopping."
Sophomore,5,"I am in love with Shippensburg University.  It has a beautiful campus, up to date dorms, any resource center you can think of, limitless clubs and sports, activities almost every day, and teachers that are willing to help you every day to succeed. Every teacher will schedule time outside of their office hours to help you, in addition, there are tutors available all school week and Sundays.  The health center is easily accessible and reliable and the Staff members seem to actually enjoy helping you with your classes, financial aid, housing, whatever you may need.  The staff are always a joy to talk to at Shippensburg University."
Freshman,5,It is a very welcoming environment.  They do their best to make you feel at home and run events to keep you busy.
Niche User,5,We took a very beautiful campus tour.  The tour guide was very helpful and showed us around the very nice campus.  I liked the dorms and the location and campus size was just right.  After this tour I took I am very interested in going to this college it is my first choice.
Junior,5,"I love Shippensburg University. They have an amazing Political Science and Business programs. They have an amazing Greek Life, who are always there for eachother no matter what letters you wear. The professors know you by name and will do anything to help you in whatever you do. The sports teams are also pretty well known for being a D2 school. The dorms are super nice and basically like living in an apartment! The downtown of Shippensburg goes unnoticed a lot, but they have a bunch of little shops! The off campus living is way cheaper than other state schools and it's easier to deal with private landlords instead of company realtors."
Junior,5,I love how diverse the students are. The students and professor have positive attitudes. When you go here or even visit here you feel connected to the campus and the people. This school is in a smaller town but the party scene is awesome.
Freshman,5,"It's very beautiful and the professors actually care! Whenever I've toured, the staff and students were very polite and helpful. I am so very excited to continue my schooling in SU."
Junior,5,"I love this school! Everyday there is something to do, I feel like I am living in a teen college movie. I have visited almost all of the other PA state schools to visit friends, and none compare to Ship and our parties."
Niche User,5,"I have been accepted to Shippensburg University, this was my number one choice. I loved the campus, their Education program and all the amenities. I am looking forward to exploring the campus when I move in next summer"
Freshman,5,Everyone at Ship is super nice and ready to help you when you need it. There are multiple options for food choices. Most of the class buildings are close to each other so you have time to get to each class you need to. The diversity is incredible. The dorms are super amazing. I don't think there is anything that i would want to change.
Junior,5,"The school has been great, from our visit, to move in to all of the activities to the classes and professors. There’s always something to do and someone to help."
Junior,5,"Ship is lit!!!! The cops dont care about people, the townies dont care about people either. Its like a zoo and we can do whatever."
Junior,5,"I’m a junior at Ship and I don’t think I could be happier anywhere else. It is on the smaller side of medium sized schools, but student involvment is huge. The greek presence here is huge, and practically run the school. The athletics are also good, especially for just a state school. There are parties every day of the week, day drinking everyday, wibs every night too. I feel like I am still getting a good education while still getting to party like the bigger schools do. My only complaint is that greek life needs more housing."
Sophomore,5,"There are many things I like about Shippensburg University. It has a nice sized campus, its not too big or too small. All the professors are very kind and understanding and will do anything to help you. There are many things to become involved in on campus which I also enjoy.  The food is isn't the best but it could be a lot worse. And one of the most important things to me is that I feel safe."
Sophomore,5,"I absolutely love my university and all of its fun events, people, academics, and opportunities to thrive."
Junior,5,"As someone who grew up being homeschooled, Shippensburg University has allowed me to meet new people from different backgrounds and meet some of the greatest friends I have ever had."
Freshman,5,My experience at Ship this past year was really great. I made some new friends and had great teachers for my classes. Each one had a unique teaching style and I had some fun along the way. I would highly recommend anyone to go to Shippensburg University if they're considering on going there.
Freshman,5,"First off, the campus is absolutely gorgeous. Shippensburg University extraordinarily spacious, there are huge grass lawns scattered everywhere. The dorms are place close to food and dining halls making movement and time management that much easier. Secondly, the faculty and educators are particularly personal. They are willing to help you progress at your pace while keeping you moving with the rest of your class. The advisors are willing to spend the extra time to make sure you make the right choices in classes, and take the right classes at the right time."
Freshman,5,"Shippensburg is a great school! Most people are fairly spirited and on a normal day you will see like 60% of students wearing shippensburg apparel. The party scene is great, there are options almost everyday of the week! A lot of parties do revolve around greek life though, so if you like to party definetly go greek!"
Freshman,5,The professors are amazing and super helpful. Everyone is really friendly and the buildings are up to date.
Freshman,5,I love it at Shippensburg.  I feel like I am apart of something bigger than myself.  Everyday I feel like there is something new to do.   All the teachers are really helpful and always try and connect to the students.
Freshman,5,Shippensburg has a great community. Part of the benefit of a school like ship is that you always feel at home. It was easy to get used to living there as a freshman and it was easy to find my way around campus. One thing that could be changed is the food. A lot of the food at the dining halls is not desirable. Also it would be nice if more food at the cub was available with a meal swipe.
Junior,5,Shippensburg University is my first university college. The campus has a delightful atmosphere and is breathtaking during the fall. The students are bright and professors make it worth to attend class.
Niche User,5,A lot of my friends from High School go to Shippensburg University. I have heard very good things about this campus. I would love to go here. The students and the teachers are very kind.
Sophomore,5,I liked the academics that are being taught here and would like to see more diversity in the university.
Freshman,5,"I love Ship its such a great school, the environment is friendly and their are great resources on campus like financial aid, academic advising, health center just to name a few"
Sophomore,5,"Shippensburg University is a fantastic place to be. The University is located in the Cumberland Valley in Pennsylvania. Campus is beautiful with large areas of open fields and adirondack chairs to lounge in across campus. The University offers seven different on-campus residence halls, one traditional and six suite-style residence halls. The suit style residence halls offer various room arrangements, with a private bathroom for every two residents. Suite style residence halls have laundry on each floor, a TV lounge on each floor, study rooms on each floor, and a kitchen/game room on the ground floor. Every student at Shippensburg University has access to the ""Ship Rec"", our gym and recreational facility. The University offers many dining options such as Reisner Dining Hall, Kriner Dining Hall, Century Cafe, Papa John, SubGen, Mondo Subs, Tomato, The Test Kithchen, The Grill, Sushi Do, Chickendipity, Dunkin' Donuts, and Starbucks."
Freshman,5,Small town with plenty of surrounding entertainment locations. Campus safety and preparedness is a major plus. Professors are friendly in and out of class. Plus a Starbucks on campus!
Sophomore,5,"I absolutely LOVE Shippensburg University. The campus is beautiful and everyone you meet always has a smile on their face. Of course the cow smell can be annoying at times, but I would not trade it for the world. Of course it is college, so the classes are hard work but you should be working hard anyway. All of my professors so far have been easy to talk to and they are very flexible with schedules. And don't forget about the Starbucks on campus! It's my home away from home!"
Niche User,5,I enjoyed looking at the beautiful campus and the environment of the students. The academic programs that are located at this school are also ones that will help those undergraduates figuring out their future. 
College Sophomore,5,"Honestly, campus housing is what attracted me to this school and made my freshman year 1,000 times more enjoyable. Being in an apartment type setting with 3 other girls with 2 bedrooms and 2 bathrooms with a kitchen and living room was awesome. They had pretty much everything you would use off campus and it made it really easy to get together with friends and meet lots of people. The cost is a bit up there, but it is a fair trade off for everything you are getting. Since basically everyone lives in these new suite style dorms, the process is easy and it is convenient. They are right on campus and all near each other."
College Senior,5,"Depending on the sport were consider top 20 in D2, I want to say our best sport is track, volleyball, field hockey, and baseball, but make sure you research to make sure."
College Freshman,5,"The people are lively, and welcoming"
College Senior,5,Safey is very important and they school does everything in their power to keep the students and faculty safe.
College Senior,5,It was very quick and easy and if there were any complications of discrepencies with my application they called me and sorted everything out.
College Senior,5,"I've been to a few schools before attending shippensburg, and what I realized when I began attending shippensburg university was that ""it's the perfect weird little school for me""."
College Sophomore,5,There are career fairs very often.
College Sophomore,5,Made me think outside of the box more often.
College Sophomore,5,Perfect blend of work and play
College Sophomore,5,Brings people together as groups and individuals.
Alum,4,Only had one online class and it was fine. Nothing great nothing bad. I've heard from others online classes are pretty simple.
Junior,4,"The only online classes I have ever done was during the Covid19 crisis in March of 2019. The adjustment was not the best for anyone, so I feel as if I cannot judge the professors for not knowing how to complete an online class. But from my experience due to the pandemic, online classes were not terrible."
Junior,4,"I think that my favorite thing about Shippensburg is the campus and the class size. This campus is not that big, easy to navigate, and you can walk across the whole thing in about 15 minutes or less. To add, I love the class size Shippensburg has. My class size ranges from about 20-30 students per class with the exceptional big lecture classes here and there. Unfortunately, the only downfall I have with Shippensburg is the food options, yes there is plenty, however, there is not many options when it comes to name branded food areas on campus."
Freshman,4,The online classes were overall easy as long as you had your books on hand and access to Zoom. The professors provided scheduled hours that they were available for Zoom meetings the same as office hours would on campus. The responded to emails quickly and provided very detailed information on assignments.
Freshman,4,"My experience at Shippensburg was good, regardless the fact that due to COVID-19 the semester was ended quickly. The professors were easy to make relationships with and were very helpful. The food is exceptional, and the on campus store has a good variety of things. The campus provides many different types of organizations to become involved."
Junior,4,"The college was great to go to. I only went for one semester and still an on going student. The way that they handled the pandemic was smart and I'm glad they did what they did to help protect their campus full of students and faculty. I hated that we were online but it was for the best. For the fall semester, I think we should not be on campus if the cases are still increasing. Also, it would be nice if we could all get a discount for the pandemic and classes being online."
Freshman,4,"I'm an incoming Freshman.  The campus is beautiful, the food in the dining halls is great.  The open house options were so exciting.  And communications from the school have been good."
Sophomore,4,I took online classes in the second half of my second semester. It was not planned but some professors were more flexible about assignments and zoom calls. It was a little stressful because it was a lot going on with the pandemic but I was able to make it through with a great GPA.
Sophomore,4,"When I first arrived it was challenging to find friends. After a couple of weeks, I found a friend. My second semester was going to be when I branch out started doing more activities but covid-19 happened. My first semester was good but it could have been better. there were couple of racism slurs said during my first semester. I loved a lot of the classes I was taking, my advisor was amazing and very helpful. He was also my professor so I could go to him about multiple things. My campus was very open I loved that there were chairs placed outside to sit."
Freshman,4,"I just went for their Dock At Ship Day, but it was a great experience. I will be attending their this fall. The staff is very kind and helpful and the campus is beautiful."
Freshman,4,"Due to Covid-19 occurring in the middle of my spring semester, I was forced to have my classes online. Although it was a very stressful transition for most students, Shippensburg University alleviated a lot of the stress. The university was willing to provide laptops and hotspots to any student that didn’t have access to them. The university was also providing lots of information regarding Covid-19, as well as updates daily regarding the transition to online courses. The professors at Shippensburg were also a big help in making this tough time not as stressful. In my experience, all of my professors were willing to provide extended time on assignments, online copies of textbooks, and any other resource a student needed. Professors also were available for their students at any time of day and any day of the week; they checked their emails regularly, answered any questions asked, and were willing to communicate via Zoom or over the phone with any student that needed extra help."
Freshman,4,"My first year attending Shippensburg University was overall very enjoyable. I love how the university gives students multiple opportunities to meet new people and lifelong friends. The university also provides students with multiple resources; anything from providing students with counselors to help them with their mental health needs, many centers for students to get tutoring help, as well as providing many opportunities for students to get internships. One thing I would like to see in the near future would be more professor office hours. Although every professor is required to have office hours throughout the week, their office hours are only a few days a week and for a very short two-hour period. Many professor I’ve had are unwilling to meet with students outside of their scheduled office hour time periods, which can cause lots of stress on students. All in all, I am very pleased with how my first year at Shippensburg University went and I can’t wait to go back in the fall."
Freshman,4,"The professors are always extremely passionate about the subjects they teach, even if it's as something as simple as a University 101 class. There are tons of opportunities for students, whether it's work, academic-related, or play."
Freshman,4,"Only one of my five classes had regular meetings, while another had weekly meetings. The remaining three classes were entirely online via the professor speaking over a PowerPoint or a video explaining a source. The workload was somewhat cut down to account for the transfer to online learning, and it was manageable."
Junior,4,I chose Shippensburg because of their accredited business school. I enjoy the classes that I am able to take and learn a lot from the material taught. The environment on campus is nice because it is calm and we are all a tight knit community. I prefer this over a large campus because I feel like nobody knows each other and I would get lost. One thing that I would change about Shippensburg is the advising availability. I ask about my Degree Audit multiple times a semester and hear different responses from different people.
Freshman,4,"Choosing a college as a senior in high school was a very hard decision for me, but I feel that I made a wonderful decision when I chose Shippensburg University. Thus far, I have loved all the professors and faculty that I have worked with at Shippensburg. They are all committed to the betterment of the students and it is obvious. The campus is its own little tight-knit community while still feeling big enough to find and be yourself. One of my favorite parts about Shippensburg is the vast opportunity to get involved in undergraduate research, which I believe is a key component for the learning process. Overall, I would recommend Shippensburg University to incoming freshman and beyond."
Junior,4,"The Grove College of Business is extremely good at this school. The staff in the business college does an incredible job of helping students to succeed as well as make connections for job prospects in the future. Like most colleges you do have your good professors and bad professors, but for the most part I've had a higher than average amount of very good professors. Can't say much for other majors within the campus, but the business college at the very least is extremely good."
Alum,4,"Shippensburg University was an excellent mid-sized university on a rural campus. Buildings were easy to get to and campus security was excellent. The class-sizes were about 30 students on average, which made for an intimate setting and enabled students to positively interact with professors."
Freshman,4,"The overall environment is very friendly and everyone is very nice. Academic wise, the professors seem to be helpful and there are many opportunities to be successful on campus."
Niche User,4,"This school has the most polite staff, and the most impressive campus i have ever seen. Highly recommend!"
Freshman,4,Beautiful campus and perfect for my dual certification major of early childhood and special education
Alum,4,One professor almost ruined my entire experience. I think professors should not have the option to single someone out and treat them unfairly. I went to the higher ups and it was handled but it should not have gotten up the point that it did.
Junior,4,"In my personal experience, Shippensburg is a great school with very kind people and excellent programs. Some of Shippensburg's programs are unfortunately small, but I'd take quality of quantity any day."
