Junior,4,"It's an unprecedented situation- most of my professors have been understanding and working well with students, but others haven't at all, which is frustrating for students."
Junior,4,"Big culture shock at first, but caring staff and very active/involved community has made it a great place to be."
Junior,4,"UCSB is a very welcoming and inclusive school. Students are very open minded and not too competitive when it comes to sharing notes or creating study groups. People like to hang out and help each other a lot. I love the UCSB community and how there is a high environmental awareness on any activity the campus does. 

There is not much I would like to see change at UCSB, but now I am hoping that all staff, professors, students and families are staying safe and that after the COVID-19 pandemic calms down that the down to earth community in Santa Barbara continues to grow."
Sophomore,4,"This school is very academically rigorous (especially in STEM fields), but the teachers are available for help."
Senior,4,"The campus is beautiful. The community is very open and welcoming. The academics are challenging, but there are resources available to help students. While these resources are there, they are not equally available to everyone all of the time. Mental health resources usually get taken up quickly and students find themselves waiting weeks or even a couple of months to talk to a licensed psychologist. Professors are not always understanding of students' unique circumstances, but that is probably what it is like at most colleges. Everyone says how important your mental health is, yet I don't think that there is enough patience or care given to those who are struggling with mental health issues. It is a good school overall, I just wish that the resources didn't feel so limited at times. Outside of academics, there are a lot of beautiful places and things to explore and discover, which can make the years spent here really fun and worthwhile."
Freshman,4,I enjoyed the campus atmosphere and the opportunities presented by the campus. I do wish there was more diversity on campus.
Freshman,4,"UCSB is rated as one of the best universities in the nation due to its location, research, and education. Living in Isla Vista is one of the big upsides of going to school at UCSB. You will find an amazing college atmosphere in our little town along with an environment that many consider a paradise. The classes are difficult as expected from a UC, but you will find that many of the professors are very passionate which is very motivational."
Sophomore,4,"UCSB still has a party reputation, but don't let this scare you off because it is a highly ranked academic college. Students at this school develop great time management skills as they manage a quick paced quarter system full of rigorous courses while still maintaining a vibrant social life. Professors, more often than not, are there to support you in office hours even if they seem intimidating. Overall this college is a great choice for people seeking a worthwhile education but also appreciate the breathtaking views of the ocean that can be seen from the library."
Senior,4,"I am a first generation student and although these institutions pride on being a Hispanic Serving Institute it hurts to say that it is not always that way. Most students have to demand certain changes/help when these individuals should be the first ones lending out a hand to the minority students. The scenery at UCSB is beautiful, the students here stand in solidarity with each other for the most part, the non-profit organizations do amazing jobs being a resource the community. UCSB is by the beach, the professors are usually understanding and we get to learn a lot from them. #COLAFOREVERYONE"
Alum,4,As a first gen person of color there was definitely a lot of having to reach out for extra assistance which I thought was very much available. Work opportunities however were difficult to come by on campus.
Freshman,4,UC Santa Barbara gives the students a proper feeling of freedom and independence without allowing the student to go through their college experience without proper resources. The physics program is also very extensive making it good for those who are interested. The teachers of course vary and social life is also very good considering how close the campus is to Isla Vista
Sophomore,4,The location of the campus is beautiful. It is relaxing and there are many great spots to study outside your dorm or apartment. The classes are engaging and professors do a great job teaching.
Freshman,4,"UCSB has this aura surrounding it that makes it enchanted. The skies are usually clear and the weather is splendid to the point that some people could get sick of the sunny weather, but not many do! Many professors express enthusiasm for their subject; however that does not include the math department. Those professors in humanities have passions for social justice primarily, but everyone on campus believes in improvement, hence the organized demonstrations that occur quarterly. We are a united, diverse campus that voices concerns in regard to any social reform. Just recently, we joined UCSC by standing in solidarity with the graduate students fighting for COLA. This campus may have difficult courses, but the resources available to its students has made it manageable to keep up with course material. The CLAS program is especially useful in my case for chemistry and math. The extra practice and one-on-one attention keeps me motivated and productive."
Freshman,4,"I love the people/community, location, resources, and just overall vibe of this campus. I feel honored to be able to pursue my dreams in one of the best schools overall in CA."
Alum,4,"I had a few incredible professors that I will never forget. Other professors seemed too involved in their research or too comfortable because of tenure to put in effort to teach well. I made some amazing memories and life-long friends along the way, but I wish that I would have been warned that my major does not lead to many good jobs. I just picked what I enjoyed studying without knowing where it would take me after I was done with college."
Junior,4,"I truly enjoy the learning experience at University of Santa Barbara.  Excellent faculty and teacher's assistants, help clarify any concerns I have regarding a course.  I especially enjoy the resources available to us including the transfer center, career services, and counseling/psychological services.  Additionally, academic advisors made transferring a much easier experience, providing assistance on my course planning as well as any other issues that arise."
Senior,4,"Some professors are difficult but the location is beautiful. The campus is very beachy, and there is a huge party scene. The professor and academics can vary based on the major and the dorms are close to dining halls. The dorms are average to poor and local area has more Asian food. It can be dangerous during night time in Isla Vista for a girl."
Niche User,4,I don't attend this school but hopefully I will. I have been to the campus twice and I felt like I was at home. The environment is calm and casual and beachy if you like that then this college will feel right at home.
Niche User,4,"I loved the area. The town of Isla Vista is a great college town, right on the beach. There is nothing that I would change about my experience at UCSB."
Freshman,4,"My experience as a first year at this school is fairly positive I enjoy the campus and diversity the school has. I enjoy going to class due to the interesting classes and professors. One thing I would like to see change is maybe the campus dining hours as sometimes the interfere with class hours and I believe that there are other schools that don’t have Dinning halls close. Another thing I find difficult is the fact that semiconductor years can’t live in school apartments until there third year, it can be expensive to live in dorms for 2 years. Overall the school is great and very considerate to students needs"
Freshman,4,"I think that UCSB is a pleasant enough school. It is not too hard to find a group of friends or get into activities such as student clubs, project teams, sports, etc. Professors are not too bad, but bad ones still exist. I would not recommend going off campus because IV is ugly and loud and downtown is far off."
Freshman,4,"University of California Santa Barbara has a beautiful campus and offers many opportunities for involvement. Many of the professors are engaging and passionate about the subjects that they teach. The university, however, should look to clean up the beaches nearby as they are constantly covered in oil and tar."
Freshman,4,"I love being literally right next to the beach every day and, since I don't drive, being able to take the bus into town for free whenever I'd like. There are also over 500 clubs on campus to get involved in. If you are interested in the performing arts, all of the plays that the Theater & Dance department offers hold auditions for anyone interested, regardless of major. While there is a definite party scene at UCSB, it is not as intense as it used to be and is easily avoidable if partying isn't your thing. For the most part, everyone on campus, both students and staff, are very friendly and approachable. There are also really good services that UCSB offers such as CAPS and CARE and many offices for different ethnicities, cultures, and sexual/gender preferences that anyone can visit anytime. They are also great places to meet new people with similar backgrounds and interests too."
Freshman,4,"My first six weeks there, I met so may inspiring people.  The school is very active, and people are open minded.  I also love going to surf or just walking on the beach after class to reduce some stress."
Freshman,4,"The campus is beautiful and there really is a place for everyone. There are many clubs, and things to do to meet new people. Everyone looks out for each other and the community is absolutely great."
Sophomore,4,The professors here know their stuff pretty well. Just that some are better at teaching the material to students and some aren't as good. It's a smaller campus if that's what you are looking for. You can bike from one side of campus to the other in 5 minutes.
Freshman,4,"It is a great school. Great weather, welcoming culture. The party scene can be wild, but do not let that deter you. Many students do not partake in partying, and focus on academics. The academics are world-class, with amazing professors."
Sophomore,4,"The student life is great and the campus has so much to offer.  There is so much to do in Isla Vista, very close to campus.  There is a beach within walking distance or enjoy the ocean on warm days.  Surfing or bike on nearby trails. Enjoy excellent food at local restaurants in Isla Vista, Goleta or take a drive down to Santa Barara which is just 15 minutes away.  The campus is small enough to bike everywhere and large enough to explore. It's a safe campus and there is a diversity of students and activities for everyone.  Great place."
Senior,4,"UCSB is a great school, I came in as a transfer and they have a lot of programs, and even apartments to make the transition smooth. Some parts of the campus are a bit run down, but overall the campus is very beautiful and less than a mile away from the beach. It is a pretty big party school, but there are many other ways for students to enjoy themselves such as student organizations, and places to road trip near by such as Big Sur or Solvang. I do think more can be done with sexual assault as with any campus, but I think there should definitely be more programs focused on that matter. With the school being a party school, I believe sexual assault is more likely to occur."
Junior,4,"UC Santa Barbara offers a wide range of academic and professional opportunities. However, a large of students are not aware of the resources available to them."
Senior,4,"UCSB is a wonderful sanctuary for students to express themselves and to expand their minds on issues in another perspective. While there is culture shock coming to campus as a person of color, there are student facilities that cater to the marginalized students on campus. I wish to see bigger facilities, more participation, and more funding to these great organizations. Santa 
Barbara is an expensive place to live, but it definitely is a beautiful place to live."
Senior,4,"In terms of appearance, the campus looks nice, as it is located near a beach. 

The social life, from what I have observed, is not too bad. There seems to be a lot of amiable and approachable people.

The academic life is typical. Even though UCSB is stereotyped as a party school, a lot of students devote most of their efforts into studying. The thing about UCSB is that people do not tend to be very cutthroat when it comes to achieving their best academically.

In terms of the scientific research, there are a lot of opportunities at UCSB. I don't really know much about the research outside of my field, but I do know that UCSB is well known for its marine biology research and research in materials science. It would be better if UCSB has more medical research, but I can understand why it does not because it does not have a medical school. Nonetheless, there are a few medical research taking place there."
Alum,4,I had a really great college experience at UCSB. I only wish that I had participate more in clubs and other extra-curricular activities besides my Major/Minor focus. The teachers are great and the campus is beautiful. It is always nice to walk around and see smiling faces in town.
Sophomore,4,"UC Santa Barbara is a wonderful institution that provides great opportunities and truly cares about its students. No other university spends so much time and resources to ensure that their students get involved in research early on. The professors are generally good and interested in their students success, but not all. Most students live off campus in Isla Vista, a community made up almost completely with students, as it is more affordable. The student community is very friendly and easy going. Just be careful if you aren't a self-motivated individual, it is easy to get caught up in the fun and distracted from your studies. Classes are hard, but you get a lot out of them. UCSB is on the quarter system, which means you take more classes but they're very fast paced."
Sophomore,4,"UCSB is what you make of it. The campus is beautiful. Yes, there is a big social scene, but only if you choose to partake in it. Classes can be challenging, but professors and TA's are mostly good. Political Science department can be frustrating, but it sometimes feels the university underfunds humanities departments in favor of STEM departments."
Sophomore,4,One of the best UCs for STEM majors and it's got some pretty great professors. Great atmosphere too!
Freshman,4,I have met amazing people and the classes are very interesting. The reason I did give it five stars is because of the obvious gap between the privileged and those who are not as privileged. Also because it is not the safest school to attend.
Junior,4,"UCSB is overall a great environment. With the academics increasing in depth every year and the social scene vibrant with beach life, it can often feel like this school has it all. Sometimes UCSB can feel clique-y, and it lacks the diversity of big city schools."
Sophomore,4,"This is an awesome school, with great classes and professors and a beautiful campus. Living in the Santa Catalina dorm, while it was further from campus, was great, as was the food at most of the dining halls. It's a super social campus which has its pros and cons."
Sophomore,4,"This university is a canvas of innovation and possibility, and I am proud to be attending this university."
Sophomore,4,"Some majors are extremely weak at UCSB, such as computer science engineering... However, the environment here at UCSB is a very work hard play hard vibe, where you have time to hang out with friends but when its time for finals all students will buckle down and get to work. Of course everyone says we are a party school, but that's because we throw the best parties because of our amazing location. Face it, you can find parties at every single university, it just so happens that SB's parties are better."
Senior,2,"Online learning is a scam at the moment. Although nobody can help the current situation, the college is not offering any leeway in terms of tuition costs."
Freshman,2,It is very over promised and under delivered. The lack of school spirit here compared to other schools is atrocious
Junior,2,"I had a wonderful time my first semester at Santa Barbara, but that is because it took time for problems to accumulate. The school works very hard at flooding optimism your way- beware of orientation which makes you pay $84 per person for a week before registration. It is useless. In outside apartments, you have room to experiment with music, recreational activities like pool, frisbee, surfing, and friends because of their plethora of rules and regulations. What hurts the school is its lack of dedication to academia. The film department is very lacking in professors who actually care about incorporating method and practice. More, they obsess over appearances and reputation. If you don't have the name or the look they’re looking for you are taken major advantage of. The easiest way to tell if a professor cares is if they have 1 TA. If  they have more they are not grading your work and do not care. Getting the scoop for classes and professor involves lots and lots of eavesdropping."
College Freshman,2,Triples is being enforced for freshmen this year and it's very expensive for a crammed little room of three. Not enough closet space either.
College Sophomore,2,Chile I hope I get a job after this...
College Sophomore,2,We don't even have a football team.
Recent Alumnus,2,"If you don't for sure want to go into research, don't go to this school."
Recent Alumnus,2,"The professors here are here to do research, not to teach, and it shows. They teach in lecture halls of up to 800 students in an inherently disengaging manner. Students end up cramming and regurgitating information for tests every few weeks.

My interest in mathematics was seriously curbed when I came to this school because I simply did not learn the way it was taught. I'm not alone in this viewpoint.

The classes are as difficult as the professor feels like making them, rather than as difficult as the subject inherently is.

I have not grown in any academic disciplines whatsoever since I have been at UCSB. In several disciplines, I have regressed considerably."
Recent Alumnus,2,They keep letting in more and more freshmen so rooms intended as already small doubles are now triples with 3 people sharing two closets. Alcohol and drug policies are overreaching and ruthlessly enforced. Even the farthest dorm is only a mile from campus; the others are within walking distance of class. Social atmosphere in the dorms was great. I'm still good friends with a lot of the people I met three years ago.
Recent Alumnus,2,Wouldn't choose this school again if I had it to do over. Not the right environment for me at all.
College Sophomore,2,Crime is common in IV and cops seem more focussed on ticketing people for sitting on curbs than curbing sexual assault.
College Sophomore,2,Athletics are not very important to UCSB. We get our kicks elsewhere.
College Sophomore,2,no variety of courses at school some classes can also be very big
College Sophomore,2,not worth what we pay
College Freshman,2,Lots of the groups have bad reputations.
College Freshman,2,"I like to be alone and I like quiet, but I ended up in the two tower dorms with 10 floors each.  My floormates (who I do not call friends) have never socialized with me, and rarely do I even get a smile from them as a hello.  Also, they don't respect quiet hours and although I brought this up to the RA, I still wonder if the RA ever said anything to them.  The room is spacious compared to other dorms, but still cramped feeling.  Being off campus is a bit of a struggle, but having to bike to class makes you not get that Freshman 15."
College Freshman,2,"UCSB has been known for its partying and there are visible signs of that. However, there are also a great deal of students who choose not to participate and peer pressure is very minimal."
College Junior,2,"Honestly, I go to a small school, an art school none-the-less, we don't have a gym, but we have studios to work in 20 hours out of the day, and our faculty usually have a fitness awareness day, or a 'relaxation' day for the students to enjoy several times every month"
College Freshman,2,"Drug and alcohol easily visible to students, used by others daily, peer pressure is moderate, policies enforced if students health is in danger."
College Junior,2,"Living and trying to attend UCSB for low income students is almost close to impossible especially for first generation students. The environment is friendly for long boarders, a bicyclist. It is a party school and the community college students tend to always party without regards for the UCSB students."
College Junior,2,"The only reason to join Greek life is the party lifestyle, and you can find better parties outside of the Greek system."
College Junior,2,Expensive and terrible landlords. Noise isn't regulated very well.
College Sophomore,2,There is not much financial assistance or support and many people are struggling
College Junior,2,"If we're solely grading Isla Vista, then its bad. Goleta has a few options as well as the downtown area. Honestly, its about getting lucky and being smart"
College Sophomore,2,The rent is really high and the housing quality is low.
College Freshman,2,"Isla Vista is the main place for off-campus housing. It's a very nice community, full of restaurants but it's very unsafe."
College Freshman,2,"Cheap/low-quality housing albeit numerous. While it's nice to live in the atmosphere of Isla Vista, you'll find yourself missing the amenities of home."
College Senior,2,"Greeks love being Greek and enjoy their lifestyle, but often are seen as cliquey."
College Junior,2,"I got decent financial aid but the process is grueling. Too many additional documents need to be sent which is fine for the purpose of checking, but needs to be faster. I was having problems when the quarter already started and fees were due"
College Sophomore,2,very huge competition -- limited majors making it harder competition
College Freshman,2,"Greek life is not very prevalent on campus at all, however Frats throw great parties for any girls. If you go Greek, that's good for you. If you're a GDI, that's even better."
College Sophomore,2,Didn't have a great experience personally.  Receiving all loans
College Sophomore,2,I recieved aid last year but they took forever to distribute it thati was charged late fee and was almost dropped out of my classes.
College Sophomore,2,I got a $2000 scholarship for performance but only got $666 of it. When I changed my major to Ethnomusicology I lost all of the rest of it.
College Sophomore,2,"The social atmosphere is great, but the facilities are pretty terrible depending on which housing you live in. The meal plans are less than good as well."
College Freshman,2,It's very loose. there is a new large amount of found freedom here.
College Freshman,2,It's popular but it is not mandatory to be a part of.
College Senior,2,"Financial aid has been difficult at this school. Once I think I have all forms in, I'll be notified to turn in more. The whole process is a bit confusing, and it's pretty much left up to the student to figure things out. This is definitely an area of this school that needs major work."
College Sophomore,2,"Some professors are great, but it seems like the majority are some of the worst imaginable. Registration can also be a pain and it's likely that you won't get a class you need."
College Sophomore,2,"It's increasingly scary in IV in light of recent events, but I know that there is a lot being done to increase the safety. Jst don;t walk alone, girls especially."
College Sophomore,2,"It's pretty tricky to find parking in IV, and it can be hard to find parking by Campbell hall."
College Junior,2,All the restaurants are expensive and close way too early for a college town.
College Junior,2,The facilities is worse than the 24 hour fitness
College Junior,2,It's not that great so I rarely use it.
College Freshman,2,"Expensive, unsafe, and parking is an absolute nightmare."
College Freshman,2,There isn't much diversity. There aren't a lot of minority students and the school consists of mostly white students.
College Freshman,2,"I have only lived off-campus in Isla Vista. 

Pro: walking/biking distance to both school and the beach.

Con: far from everything else. Loud. Dangerous at times. Landlords seem generally helpless against noise.

Cost: 600-800 per month for a shared space. Often close to the beach.

Parking: cars are frequently (every night) vandalized by drunk partiers. Mirrors, glass and antennas often smashed. Also, you cannot drive to school before 5 pm if you live in Isla Vista.

Safety: there is a number to call to be walked home at night by another student if you feel unsafe. Otherwise, Isla Vista has growing to do in this area. Residents seem pretty apathetic to lack of safety in exchange for the party climate, and it's not rare for music to be blasting past the 11 pm cut off. Multiple brutal crimes by outside people have occurred in past months."
College Freshman,2,It is so difficult to get financial aid here.  I am still struggling to find any.
College Sophomore,2,They don't enforce the rules which can be dangerous
College Junior,2,I haven't been able to apply to any kind of finnancial aid
College Freshman,2,I am a personal student who encountered some racist remarks
