Alum,5,"Not applicable. I did not take any courses online during my time at University of California, Santa Barbara therefore cannot accurately attest to the quality of online education at this institution."
Sophomore,5,Being a student at UCSB has been the best experience of my life. Our professors are well-prepared and extremely versed on their academic subjects and engage their students in both in-person and online teaching. Students are generally very happy and enjoy life at UCSB. The party scene and academic excellence at UCSB create a perfect balance for students.
Sophomore,5,"I took all my spring classes online, and even with short notice, the professors did an amazing job and I was still able to receive good grades and increase my hunger to learn."
Junior,5,Online courses super easy and professors were very willing to help adjust to the issues pertaining to the virus
Alum,5,"I did not take any classes online through UC Santa Barbara I did enjoy the in person classes, however."
Alum,5,"I loved the UCSB community and the connections I made while there. I was able to find mentors and lifelong friends who support me and my goals. UCSB is unique because of how united the community is. When visiting, strangers are very likely to help visitors, and the students, staff and faculty all work together to make sure the campus climate is safe for all."
Alum,5,"I only took courses online during one of the wildfire seasons where we were forced to evacuate campus, and I have no complaints.  I cannot speak to post-pandemic online courses but from what I've seen professors are more lenient and are finding creative ways to continue to teach materials."
Alum,5,"UCSB is an excellent school, the campus is beautiful and I had great professors available in my program.  You really get the best of both worlds, the student community of Isla Vista is extremely sociable and active, and the academics are challenging and insightful.  Your courses will often be difficult and challenging but through your peers, TAs and professors, and the resources available such as C.L.A.S., you can definitely succeed. Upon graduating numerous opportunities reach out to recruit you as well.  It doesn't hurt to be able to walk to the beach from your apartment or dorm either."
Sophomore,5,"Happiest UC, best college town. Had a great first year present (on campus) before COVID19 hit. If you like the outdoors and the California weather you will love this school. The beach is the backyard, mountains are nearby, and downtown isn't too far. Isla Vista is the perfect little college town, party hard but study harder."
Sophomore,5,"UCSB is obtains one of the most beautiful campuses in California, located right on the beach. It is an excellent research school. There are many research opportunities to get involved with, physically and virtually. Although their science and math departments are very competitive, UCSB portays many amazing resources to help students succeed. Professors are extremely helpful and give you every source you need to succeed in their lectures. UCSB obtains kind and helpful counselors, tutors, TA's etc. One thing is that the campus is very diverse."
Sophomore,5,"The online learning experience is a great way to get students engaged academically from home. UCSB offers many online classes, and most importantly many resources. Gauchospace, which is an online portfolio to view and manage your classes helps students to stay in contact with professors and teacher assistants. It also provides students with an easier access to submit their work and take exams or quizzes as well as having professors upload their lectures. UCSB makes the online learning experience very easy and accessible."
Alum,5,"Only took 1 class online, it was good. Everything you'd expect from an online class. Apart of the certificate program which is an extension of UCSB so I think it was geared more toward part-time students, didn't require much effort or time."
Alum,5,Lots of opportunities to get involved. Transferred to UCSB junior year & still felt like I had the full 4 year experience.
Freshman,5,"I just completed my first year at UC Santa Barbara and I have had such an amazing experience so far. I immediately got involved by becoming a President of my hall council and member of the Residential Housing Association. I got really involved on campus and worked with great people. I loved RHA so much that I ran and became the Finance Vice President. RHA has been a huge part in making my experience at UCSB great. The campus itself is beautiful as it has its own beach and lagoon. All of my professors and teaching assistants have been approachable and understanding. I've learned so much in just a year of attending UCSB. The school is not very diverse, however I feel the campus life and organizations definitely provide a sense of community for everyone especially including minorities. The on-campus housing is comfortable and each Resident Hall has its own sense of community. The dining halls also have multiple food options including vegan and vegetarian."
Freshman,5,"I've already made amazing friends, and school hasn't even started yet. 
There's a wide range of classes available to all students, and everyone is willing to help. They make going into college not so terrifying."
Freshman,5,"I've only had orientation online, and I was the first session but it was still amazing. It was very engaging and to an extent, I preferred it over one that would be in person."
Junior,5,"UCSB has such a welcoming, co-operative environment, where students see their peers as teammates and friends, not as rivals. The beaches, sunsets, and party scene cannot be matched anywhere else. But even though UCSB is known for its social life and beaches, the school also has excellent academics and research opportunities for all of its students. There's nothing quite like the thought of studying on the beach to make you want to go back after a long time away."
Senior,5,"The online learning experience is good for me. My instructors tried their best to make a great remote learning environment for students. And some of the instructors reduce a few tests or essays, because they're nice, kind and totally understand students' hardship."
Alum,5,"It was a good time. I would love to see more majors being offered, there are a lack of majors to choose from."
Freshman,5,"I am an incoming freshman and I have already fallen in love with my school. The location is beautiful, right next to the beach and many awesome places to visit. Go Gauchos !"
Freshman,5,"I am an incoming freshman and I have already fallen in love with my school. The location is beautiful, right next to the beach and many awesome places to visit. Go Gauchos !"
Alum,5,"I didn't take any online classes at UCSB but from what I heard, my friends had good experiences with them. I'm not sure about them now since I graduated in 2019 before Covid-19."
Alum,5,"UCSB, while having incredible weather right by the beach in beautiful and diverse Santa Barbara, is also an incredible research university that has endless opportunities. You will find you passion and your people there and get world class education that is inclusive to all people."
Sophomore,5,"All of my professors were understanding of the struggles that students may have been facing during this difficult time and were open to working with students for the benefit of a successful education. Though it was a learning curve for both students and professors, all of my professors did what they found to be effective in their teaching techniques. Most lectures were recorded in order for students to be able to watch them on their ideal times. We would meet with TAs for section once a week which ensured clarity of work and class lessons. There were also many resources for contacting teachers such as email, zoom meetings and class chats."
Sophomore,5,"UC Santa Barbara has an extremely welcoming community with endless possibilities to make friends and enjoy your time there. Classes are mostly very competitive and ensure students are learning in efficient ways. One of my favorite parts is being right next to the beach! Being stressed with school work then looking over at the peaceful ocean leaves you with a sense of ease. The entire campus is beautiful and has lots of nature and always good weather.  I am very grateful and happy to be attending the University of California, Santa Barbara."
Sophomore,5,UCSB is more amazing than I expected! The academics are rigorous but interesting. This school's social life is fun and exciting. The campus is beautiful and the professors and faculty are amazing.
Senior,5,"I have not taken any online courses, however due to the COVID crisis we had to move online. The teaching staff and administration made this transition very fluid for the entire campus and allowed for an easy transition. UCSB showed they have the best intentions for their students success."
Senior,5,"Our academics here at UCSB rank among the top in the entire nation. You will not be disappointed with the quality of education you will get.

We are among the most diverse campuses in the local area. Everyone on campus is involved and welcoming to every type of student. You will find someone just like you here. 

Our athletics are amazing! Our basketball team made it to the sweet 16 and our sports scene is very vibrant. GO TO THE SOCCER GAMES. You wont regret it. 

The professors here are some of the top researchers in their fields. 

Plenty of dorms and undergraduate housing near or on campus. Including the local college community of Isla Vista. 

We have a college police force as well as an Isla Vista police force that establish safety for the students. 

UCSB will not disappoint you. Just come and check out the campus, or check it out while you are on vacation! We all know you will probably come to Santa Barbara for your next vacation! Even if you’re a local ;) Good luck!"
Graduate Student,5,"I loved UCSB as an undergraduate. There was always something happening that it was impossible to be bored which also meant more potential distractions from academics. However, the environment UCSB touts allowed me to develop a balance between my academics, health, and activities. It really was the best place to meet new people, learn as much as possible, and further my personal growth. For example, like many of my colleagues, I wished there weren't as many General Education courses to take to graduate. But reflecting back as a graduate student, I realized there was something I took away from each of those classes that made me feel more academically rounded as an individual. Every experience I had at UCSB was inherently unique (the LGBTQ+ community, the parties, even the coursework!) and I wouldn't trade them for anything else."
Alum,5,"I came into UC Santa Barbara as a Sociology major. I transferred from a two year community college. I had an amazing experience. I met international students, students coming from high school, and other transfer students like me. You have to check out the nearby cities and beaches. The beach near Santa Barbara City College is beautiful. It helped that I am naturally a social person. I joined and interacted with different clubs and activities. My best advice is to explore the sites and beauty of Santa Barbara."
Alum,5,"I loved the campus life, friends I made, and career opportunities. I liked that the campus was located right next to the beach."
Freshman,5,"This school is amazing despite the stereotype of it being a party school. If you want to be successful, you will in this school. yes"
Senior,5,"Overall, my experience at UCSB has been life-changing. There are many resources to help ease your transition from high school to college. One of the hardest things for me was adjusting to the quarter system (10 weeks per quarter). It is VERY fast-paced and can be overwhelming. However, it does teach you to stay on your A-game and you have the opportunity to take more classes. The best part of UCSB is the beach. The campus is right on the beach and student housing is a short walk or bike ride from the beach!"
Junior,5,UCSB provides a diverse and inclusive environment that has resources for all. I have especially liked the legal resources provided. I had a roommate dispute and UCSB provided me with an attorney to help me get through my conflict. I also like the easy access Student Health Center that is conveniently located and easy to navigate. These resource make being away from home easy and comfortable. What I have disliked it the transition to online classes due to the current pandemic. It was rough navigating this new online world with professors that have not been trained with online learning.
Sophomore,5,"I truly believe that UCSB is the best place in the whole world. The academics, people, culture, and location are all the best you could find. I have never experienced such an accepting, excited, and ambitious community of students and faculty, and would not change my college experience so far one bit. And plus, where else are you going to see a top-tier school just steps away from the beach?"
Alum,5,"UCSB is a dream school if you serious about your studies and having a good time. It is located right on the beach, has the perfect weather, is extremely social, always has activities going on, is overall a very active and social scene. The classes and professors are great, I met some lifelong friends, and I overall had the time of my life in that little bubble called Isla Vista."
Alum,5,"To start, I am BEYOND proud to be a Gaucho. I absolutely fell in love with this school because of all the great opportunities and resources this diverse campus had to offer. UC Santa Barbara was my home away from home. My experience as a student exceeded my expectations due to being taught by brilliant and helpful professors, having numerous resources available for all students, safe housing options, delicious campus food, its friendly environment and of course, an absolute stunning campus. One thing I would like to see change at UC Santa Barbara is for the library to expand. I regularly studied in the library, but during certain times of the day, it was difficult to find a space to study. I would often spend a great deal of time checking each floor for an open seating. Secondly, it would be beneficial to students who commute on bike to not have to struggle to find an available bike spot. In summary, I rate UC Santa Barbara with a 5+ stars!"
Freshman,5,"Excellent location. It truly is the ""Campus by the Sea."" Very strong sense of community. Met a lot of great people and made friends for life."
Alum,5,"I had a wonderful opportunity to get involved, explore courses of study, and work closely with professors!"
Freshman,5,its good its very good i like this school its  a very good school yes very nice school yes i like the school in very nice area come on is this 100 characters yet why doesnt it let me submit
Freshman,5,"UCSB is not only in a beautiful location,  but it also offers the best education you could ask for. I feel like I am already smarter and I only have attended one quarter of classes. There are so many resources available to get you to success. Apply!"
Freshman,5,Love the campus. It is beautiful here every day but seriously lacking in diversity. everyone if very friendly.
Sophomore,5,"The environment and interesting people really increase the quality of life at UCSB. The professors are very cool and show you that they are just normal adults like us, with a little more knowledge than us though. It is easy to be happy with your courses here because the classes are fun and engaging and you can literally study on the beach if you wanted. The views and weather always put people in a good mood, and there is such a large population of active students, whether it be in clubs or physical activities like surfing."
Niche User,5,Overall my review of UCSB is nothing but a stellar campus with an almost amazing campus life to go along side it
Freshman,5,I love the campus community. I wish the dining halls were more accessible with regards to hours of operation.
Senior,5,"It’s a beautiful campus near the beach with many clubs to chose from, when going to visit they have a very nice soccer stadium, and art decor. Usually went for rallies."
Senior,5,I love the location and diversity of guest speakers/lecturers that are invited to the school. There are a ton of resources for students and interesting classes.
Freshman,5,"UCSB is a gorgeous school, with a large but easy-to-navigate campus. Academics are a definite priority, but there are plenty of opportunities to get involved in sports, clubs, support groups, fraternities and sororities, etc."
Junior,5,"I love UCSB - the faculty is extremely qualified and knowledgeable, but are still extremely approachable and kind. The investment in undergraduate research is what I appreciate most about UCSB. The graduate program is very small in order to give younger students the opportunity to participate in research as assistants in graduate students' and professors' labs. You can even apply for grants to do and publish your own research. In addition to stellar academics, the campus in located in probably the most ideal location, there are mountains to the east of you and the ocean to the west. The campus offers many opportunities to stay active and healthy. At UCSB, they truly advocate for your learning and wellbeing every step of the way."
Sophomore,5,"I am really enjoying my time at UCSB. Not only are the professor motivating and friendly, the students are so welcoming and supportive of each other. It really creates a wonderful environment to learn, meet new people, and try new things at UCSB."
Niche User,5,The parties are crazy but can be better. A lot of diversity. The safety is good in the day but in the night not good.
Freshman,5,I'm having an amazing time here at the University of California - Santa Barbara. There's always something to do for everyone here.
Junior,5,"I love this place. People are both down to earth and passionately engaged in their academic or artistic pursuits. It's an astoundingly beautiful campus and location, and I'm still impressed by how scholarly the faculty and many students are, as well has how high quality the performances from the music and theatre departments are. It's an all around awesome place."
Senior,5,The environment was very relaxing and made it easier to take a break when school felt like alot of pressure. I also like the fact that all my classes were easy to get to. Never had an issue of getting lost.
Alum,5,"Best college experience EVER! Perfect mixture of academics, research, professional development, and social life to jump start your skills in and out of the classroom."
Sophomore,5,The environment is super friendly and there's a lot of diversity. Plus it's right next to the beach for all sun lovers.
Niche User,5,"Excellent school,Excellent schoolExcellent school love the location,ove the locatioove the locatio provides amazing quality educationprovides amazing quality educationprovides amazing quality education and super good professors.very goodsuper good professors.very goodsuper good professors.very goodsuper good professors.very goodsuper good professors.very good"
Niche User,5,"I like that UCSB is one of the few college campuses in the US that actually owns beach property, and plenty of students regularly enjoy the beautiful beachfront. Also, students in UCSB was friendly. I had a campus tour and the guide was really kind, and she told us a lot of things about college stuff. Also, I liked that some of the major like psychology, sociology, and international/global studies is popular in UCSB."
Junior,5,"Beautiful campus, excellent academics and vivid student life! UCSB is your place to go if you want to live right by the beach and experience college at its fullest!"
Senior,5,"UCSB has been a wonderful experience. The students, teachers, atmosphere and location all adds to it. I have never complained about anything here. I would recommend this school to anyone. They are accepting of anyone and everyone that wishes to attend."
Junior,4,People are really respectful of each other and the learning atmosphere is great because everyone is supportive. Professors are really open to talk to students and are willing to make adjustments to classes when needed.
Junior,4,"There have been a lot of assignments in the period of online learning. However, professors are willing to make necessary changes to the syllabus when requested (and are reasonable) in order to motivate students to learn"
Junior,4,It’s hard to find your place on such a big campus. Quarter systems are hard to adjust to if you’re not used to them and classes are tough.
Junior,4,"Switching to online was a transition for everyone but the pros and cons each had lists. Adjusting to anything new is hard. When your quarters are short, transitioning is more difficult"
Senior,4,"The cost of living is very expensive, but I love the school and the location. It is definitely one of the best UCs."
Sophomore,4,"The professors I have had for online learning have been incredibly understanding. However, I have mainly learned either on my own or through homework. There was a lack of fruitful lectures and the connection would be harder to attain for those who need strong guidance."
Sophomore,4,"Unfortunately, I have spent much of my college experience stuck quarantining, but when I was there it was some of the most fun I have ever had. A completely new experience from high school. The vibe between the people was welcoming and encouraging."
Alum,4,"A nice school with a focus on academics and social life, conveniently located next to the beach. An all-around ideal college experience! Would definitely recommend to students looking for a well-rounded college experience."
Junior,4,Overall the counselors were very helpful and super easy to contact. It made the entire process of transferring super easy
Sophomore,4,"Adjusting but doing the best they can given the situation. Can be challenging managing the online schedule, and some professors are much more prepared than others."
Sophomore,4,"Many professors have been more lenient because of the sudden shift to online learning. Many have made great adjustments and are very flexible. I prefer having synchronous lectures and discussions, but only a few students ever participate in class."
Sophomore,4,A beautiful location and inviting campus. Most classes are excellent and faculty is hard to beat. My only complaint is that the campus feels a bit isolated.
Junior,4,"There was difficulty at the end of winter quarter, since the shelter in place orders were still up in the air finals week leading to a lot of stress for students trying to study while worrying about getting home. If the university had been a little more proactive and declared remote finals earlier, some of this could have been avoided so professors would have had time to plan instead of hurrying to adapt to online problems.
I had no difficulty with the transition to online schooling spring quarter, since all of my professors understood the software and difficulties of remote learning and accommodate for them by the end of spring break. Zoom lectures became attendance optional and recorded with powerpoints and notes provided so all students had equal access regardless of time zone or home obligations. The biggest change was that most of my classes used project based learning structures than the exam-oriented style most of my classes used in the past. My TAs were incredibly helpful."
Senior,4,"UCSB is an excellent research school with a beautiful environment. Most of the courses have to be self-study but there are a lot of friendly instructors. Some of the departments are very competitive and those employees are icy-colds, such as Economic, Math and Biology. The College of Engineering is very popular. The mood of this school is not as relax as others described. Definitely a party school, there are so many parties and bars around the campus. Study hard, Play hard. UC Santa Barbara has rich natural resources. If you're learning Geography, Environmental Studies, or Earth Sciences, you'll own many learning opportunities. Security is good. Campus Point is a super nice place, you need to visit there!"
Senior,4,"Overall I would say it's a really good UC, especially since over the years it's only improved to be better and better. Campus is really pretty and it's right by the beach so beach day literally any day! And the social life/party scene pretty chill too, most people eventually end up making good friendship groups since the students are so so so so friendly. 

I do have to say the diversity is very lacking (student body mostly consists of those from one type of racial, socioeconomic background, I'll let you guess which it is) so the school needs to do a better job about that area."
Sophomore,4,"I enjoy UCSB. The social life is definitely worth it but some professors give you a hard time. Others are great but in general, academic life needs to be kept separate from personal life."
Sophomore,4,"The coronavirus pandemic affected our school very quickly. Many student, like myself, who could return home were encouraged to do so. I think that the switch to remote instruction was preformed as smoothly as possible given the circumstances and the time frame. The online classes were not as engaging as in person classes but i believed them to be of very high quality."
Alum,4,I didn't have any online classes. I did dabble with technological resources. It was pretty up to speed when I went there.
Alum,4,I loved the location and supportive atmosphere at UCSB. Students are committed to helping each other. I would love to see a better focus on retention of  minority students and financial support.
