Sophomore,4,Bethel's community aspect makes it feel like home. The school grounds are beautiful and I always feel safe here. I have had the experience where my professors really seem to care about their students and their success. They are always ready to help you in areas where you may need it. Bethel has an atmosphere of trust and companionship that I never expected.
Sophomore,4,"Bethel is a great place for people looking to build their faith with other people their age that find faith and academics important. The campus has so many competent professors that are willing to help you when you're struggling. The one problem that I sometimes have with Bethel is that while everyone is super friendly and there's tons of activities to go to, the authenticity of friendships can be lost. It can be hard to get close to people beyond the activities. But overall love it!"
Senior,4,"Bethel is a wonderful place to be, it may be tough if you aren't a Christian or have a relationship with God. But the profs, especially in the humanities are very open to talking to people form all walks of life."
Sophomore,4,"Bethel University is an incredible educational institution that values honest and high quality education and discussion in the classroom and the overall community. I have had the best experience at Bethel and have not only learned information that helps me toward my degree and future career, but has also taught me intrinsically valuable lessons about myself and society. The only criticism I have for Bethel is the lack of diversity in the student population, although Bethel does its best to encourage conversations from all different viewpoints and opinions within the context of Christian values."
Niche User,4,"After spending a couple days at Bethel University, I see that all the professors are friendly, with great wisdom to share. The community is great too, especially among dorm mates and dorm neighbors. Though sometimes I get confused about where I am, overall a nice campus too."
Freshman,4,"As a Christian, being at Bethel University has been great. I love that professors begin their classes with a word of prayer and incorporate Christian values throughout their teaching. The people and community of Bethel University are awesome. Most everyone is kind and genuine and can hold a good conversation even if you do not know them well. Bethel does a thing called welcome week for the incoming freshmen which is very eye opening. The upperclassmen put in hours of work to make the incoming freshmen feel comfortable and ready to grow in their academics and their faith as well."
Sophomore,4,"I love my college! The only complaint I have is that it is hard to get off of campus and feel connected to the community, but I feel as if Bethel has a great community of its own. The professors are interested in success, the students are friendly, the campus is clean, and the food is amazing.   "
Sophomore,4,"The academic scene for Pre-Medicine is stellar. The small class sizes and opportunity for research is something that cannot be found at most big schools, and the quality is something not found at many smaller schools. The food and people scene at Bethel are both adequate. If there is one thing clearly lacking, it is the surrounding scene and the absence of a ""college town."" That being said, that is usually not something found at a small school anyways. Overall, good choice. "
College Junior,4,It is a generally safe environment. I here of very few things happening on campus. Whether it is true or a cover up I'm uncertain of.
College Junior,4,"Most people I know who have graduated have a job, but whether they are working in their field is the question."
College Junior,4,There are so many different housing options that everyone tends to be pretty happy
College Junior,4,"I like the people I am now surrounded by. I also really like the professors, particularly in my department."
College Freshman,4,Bethel teams typically perform in the top half of the conference.
College Freshman,4,I am on campus early to participate in the volleyball program.  Everyone has been very friendly and welcoming thus far.
College Student,4,The alumni network is great; I know so many.
College Student,4,"I do not live on campus, but I did live in Heritage for Girls State over the summer.  It was super fun living with five other girls and getting to know them.  We are all still great friends, even though they live so far away.  The cleaning volunteers were so great to help us move in and to make everything fresh for us."
College Student,4,"I loved going to football games to support my friends.  It is a great atmosphere, and the team isn't too bad.  Also, all the girls on the cross country team are so sweet!"
College Sophomore,4,Bethel's values are amazing and our covenant is great. I would definitely send my future children to bethel if the diversity rate improves.
College Sophomore,4,There are shuttles that run around campus and in the community which keeps students safe. We also have security every day after dark. Students are able to call security to help them get from one location to another at any time of night.
College Sophomore,4,The housing is great! It's mainly apartment style and relatively close to campus.
College Sophomore,4,"The professors are very caring, since it's a small school you would see people often and professors often as well. The campus is absolutely beautiful."
College Sophomore,4,Drinking and drug use at Bethel isn't as abundant as other schools but is definitely present. You definitely hear about people who drink in their dorm rooms and go into the cities to party but its not as if everyone does.
College Sophomore,4,"One of Bethel's best attributes is it's safety on campus. I've never felt uncomfortable or scared on campus-even at night. However, I will say that Bethel has a lot more issues with sexual assault than they will admit or know about."
College Sophomore,4,The student career prospects and the value of a degree from Bethel are all very good. There are many opportunities for students to find jobs or internships at Bethel. A degree from Bethel is a valued thing to obtain. Bethel has great programs that are quite rigorous. This is what makes the degree so valuable.
College Sophomore,4,The Bethel security is great. There are constant patrol cars running 24/7. This makes the campus feel safe and protected. Crime at Bethel is practically unheard of. Many people feel comfortable enough to even leave their laptops on a table in the library while they go to dinner.
College Sophomore,4,The housing at Bethel is very good. The social atmosphere was lacking a little in the dorm I was in. The rooms were huge and there were many ammenities for us to enjoy.
College Sophomore,4,Bethel is a school that has great academic programs and focuses strongly on preparing students to become capable in their fields of choice. A unique feature about Bethel is that it offers many opportunities for undergraduate research; which opens many doors for students to succeed.
College Junior,4,Some professors are tough but you're going to experience that anywhere you go. I like Bethel a lot.
College Junior,4,Sometimes too much emphasis on sports over academics
College Freshman,4,How hard the course work is generally depends on your major.  People usually generalize that science majors and math majors get the most work.  The professors are great and with the available help of your advisors making a manageable workload should be do-able.
College Freshman,4,"It's great, the academics are of very high quality"
College Freshman,4,The classes are very good and high quality. The professors are professionals in their field and do a great job at relaying information to their students.
College Freshman,4,They have great athletic facilities and the students are very supportive of the teams
College Freshman,4,The pros outweigh the cons.
College Junior,4,Bethel does a good job of encouraging internships and placing people in a variety of field experiences.
College Junior,4,"Bethel has a variety of dorms, some newer than others, for a variety of lifestyle choices. All are within a 10 minute casual stroll to the academic buildings. Laundry is always free so that's a plus. You can't get cable in the rooms but there is a common space in each dorm that has cable. Besides most people watch things on the computer now days anyways."
College Freshman,4,"There was only one professor that I did not resonate with, but the rest were very caring and interested in my learning experiences. They all seemed to want to be there, and they were passionate about their subjects."
Freshman,2,"The social life at Bethel has been, unfortunately, pretty poor for myself.  I did PSEO full time for my junior and senior year so I was out of the high school environment for a while.  However, since coming to Bethel I feel like I'm right back in it.  I believe the faculty is composed of genuinely nice people, however, the student body seems to be filled with more fakey-nice people than genuinely kind people.  Additionally, I oftentimes feel that Bethel students are quite judgmental as well.  As a straight, white female I feel that I have trouble feeling free to express myself.  With that being said I can't imagine what it must feel like for someone who's apart of the LGBTQ+ community or of a different ethnicity/ race."
Niche User,2,"It's simple. If you don't believe in their religion, you shouldn't go here. I know that there are lots of religious schools like Augsburg or Concordia that are affiliated with a religion but Bethel university pressures it on you even if they SAY they won't. Also there is ZERO diversity here(in race, culture, experiences,etc.). It's made up of majority rich Caucasian students that have their parents paying for their tuition. Students here can also appear to be dumb sometimes because their sooooo frikin sheltered that they literally don't have a clue what the real world is actually like. This makes it hard to connect to them because they just sound ignorant when it comes to some discussions.  As for their facilities, their food is better than a majority of colleges but their dorms suck....and there is absolutely no student life, to the point where everyone goes home every week, even if they live 3-4 hours away. That's all."
College Sophomore,2,"A big issue here at Bethel is a lack of school spirit. No one ever attends athletic games or seems to care about them unless they are on a team. The only football game anyone really goes to is the homecoming game and this year half of the students left midway through the game because of how boring the atmosphere was and how terrible the school spirit is. However, Bethel administration tends to brag about our athletics and spends a lot of money on it. Just don't come to this school hoping for a fun athletic atmosphere or school spirit because there is none."
College Freshman,2,It's not a really diverse school
College Freshman,2,"I did not like it due to it's price and quality, I only lived in a dorm for a semester and moved out on the next one."
College Freshman,2,"There aren't many diverse students. Bethel is predominantly white, middle-class, and christian."
College Freshman,2,"I'm not around drinking, but may students partake in drinking. Most kids go off campus to drink and do drugs."
College Freshman,2,There is no Greek Life
College Sophomore,2,"Student involvement is very low in all but football, which is mediocre at best. Team performance is okay, but track facilities are inadequte, to the vast detriment of all athletes and community runners. There isn't much fan support for athletics. Culture within the athletic department is less than supportive within some teams"
Recent Alumnus,2,"I met some people who are my best friends 5 years later so I would be afraid to change that if I had the chance to do it over again. However, the school had little to do with that. It was just chance that I should meet those people. It's far too expensive for what they offer and the community as a whole is not one that I would want to identify with. Academic standards seem to be fairly low, the arts and humanities are underfunded, and the new buildings are ostentatious and unnecessary. They need to fix their spending problems."
Recent Alumnus,2,In 10 years student tuition has gone up by nearly 60%. The loans I have are crippling and it was not worth it.
Recent Alumnus,2,"Administration claims to desire a sense of community amongst students, but their policies perpetuate a sense of us vs them mentality. The ""good"" bethel students vs the ""bad"" ones."
College Freshman,2,Little to no parties on campus - very strict
College Senior,2,We are a dry campus
College Junior,2,"In the process of creating a health and wellness center.  Until then, Bethel is very behind."
College Sophomore,2,"There is no specific off campus housing available to students through Bethel University. It is a possibility, but Bethel does not play any role in management."
College Junior,2,"In the middle of the midwest, walking to and from classes is extremely cold."
College Freshman,2,"The school prides itself on nurturing sheltered christians who do not know how to experience the real world. I feel if I took my Bethel friends to Dinkytown or the U of M, they would curl up in the fetal position or feel so socially uncomfortable they would want to go home. The schools atmosphere equals a high school atmosphere, as most students have not grown up and are not interesting or stimulating in the least. The school doesnt mind that it doesnt encourage a challenging academic setting, and is comfortable remaining average. My personal experience, coming from a large metro suburban public high school, is that this school is more of camp than a school. If you have any reservations about this school, do not go here!! (transferring next year)"
College Freshman,2,"The campus is small and everything is average about it, from the classrooms to the paintings decorating the halls. Very boring if you want more of a lively feel to your school. "
College Freshman,2,Some facilities are good. well just the dining facility. Athletic facilities are similar to most middle class high schools
College Junior,2,Not alot of variety in the rink or party options. But it is a christian school.
College Junior,2,The summers are great but are very short and pale in comparison to the minnesota snowy winters.
College Sophomore,2,"Parking is limited and it is hard to get a parking pass, and if you do have one parking spots are hard to find"
College Freshman,2,The night life is not always the best at Bethel.  It can get kind of boring on the weekend. There are tons a places to go around down town area but not always the best transportation.
College Junior,2,"Parking is very good around most of campus, but my dorm parking lot borders a Seminary housing parking lot, and college parking is very limited. There are consistently plenty of open spots in the Seminary section of the lot, but if students park there when the student lot is full, they are fined for it."
College Junior,2,The school is composed of students mainly form the area so it is predominantly the same race.
College Freshman,2,There are very few scholarships here at Bethel. Financial aid was very hard to receive and only a few special cases receive a good amount of help.
College Freshman,2,"There is definitely not a large amount of diversity on campus; I would like to see more. However, there is no racial discrimination towards the few (such as myself) who are ethnic."
College Freshman,2,Most people on campus are white and religious. Majority are baptists and express their faith freely.
College Freshman,2,There are some housing options but not a lot of choose from
College Junior,2,"There are no city buses that run within 2 miles of campus. Bethel does offer shuttles to Rosedale mall and super Target that run once or twice an hour (less frequently on weekends). It is probably half a mile to a Cub or Target, but there aren't many sidewalks so it's hard to get there. There are shuttles to local churches on Sunday, so that isn't too hard."
College Freshman,2,"Bethel University provides free wifi throughout the whole campus, however the connection is usually really slow and sometimes refuses to connect."
College Sophomore,2,"Average. There are plenty of computers in the library, but the internet is often slow. Printing is compeltely unreliable in the dorms, and printing in the library is not always reliable either. It is often hard to connect laptops to the wireless internet in dorm rooms. However, it works great when it actually works! Sometimes library computers take a VERY long time to long in, which can be frustrating when you only need to print off a paper."
College Junior,2,"Football Is King – Without football, Bethel would sink into mediocrity in all aspects of sports. Football is the only sport that consistently brings the students of Bethel out. Our football team is always good, often the best in the conference. The student body doesn't rally around any other sports team. The gym is mostly empty for volleyball and basketball, and the hockey arena is off campus, which makes it less manageable for students to attend. No other  sport can compare in talent with football."
College Junior,2,"We as a school have a vision for reconciliation, that is of races. We have an African-American chaplain at Bethel, but we don't have a large number of minority students. We are mostly white. Bethel has a club for the minorities to join, which celebrates the various cultures of Bethel in its diverse students. This club, however, creates cliques of minorities, so the very thing it tries to do in creating reconciliation doesn't work. The white people hang with the whites, and the students of different cultures remain together."
College Freshman,2,"Bethel allows junior and senior students to receive parking permits and sophomores and freshman are not allowed cars on campus unless for special circumstances. However, freshman and sophomores are allotted a certain amount of days per month that that can park their car on campus and also have the option to purchase a week, or month long parking permit. The parking lots do fill up pretty fast so, if you are getting back late at night from something, it is sometimes hard to find a parking spot and you might end up walking a good distance."
College Freshman,2,"I do not have a car, but I have heard that permit costs are relatively low. There is sufficient amount of parking, but nothing spectacular."
College Senior,2,You Have to Work for It- If You Want to Party – Tough to find people to party with at a school that doesn't allow drugs or drinking during the school year. Most students who party do so at/with those from other schools.
College Sophomore,2,"Bethel is a Christian college and they have a strict no alcohol, no drug, no partying policy that is, for the most part, highly enforced on campus. So on campus there is nothing much to do. Bethel is only about 10-15 minutes from downtown Minneapolis/St.Paul so of you have a friend with a car, I suppose you could club to your hearts content... but good luck finding someone with a car, especially freshman year. There are on campus events like dances, coffe houses, and other random events, and they are fun, but not hugely popular."
Recent Alumnus,2,"Bethel provides transportation to the a good mall and Target. Otherwise, public transportation is not available."
Sophomore,1,"Many classes would only be offered by one or two professors, and if those professors were horrible, there was nothing that you could do. This is especially an issue if you're a STEM major (physics, anatomy, and chemistry are some of the worst). The professors often spent half of the class talking about religion, so you had to teach yourself the subjects. Racism and sexism were extremely prevalent between both the professors and students. Additionally, a very large chunk of the students were on probation at any given time, even if they had not actually broken a rule. This shows up on your record if you wish to apply to a certain program like nursing, another college, and sometimes a job. Your degree also looks inferior to a degree from a more competitive school (only certain majors, probably not liberal arts). If I could redo things, I would never go here again."
Sophomore,1,"My classes switched to online last semester during Covid. Two of my professors stopped lecturing completely, so I dropped the classes so I wouldn't fail them. One stopped lecturing but took away almost all coursework so it was easy. The 4th professor lectured, but was not supplied with a proper camera or microphone so his screen was so blurry you couldn't see it and often couldn't hear him as well."
Junior,1,"Don't go to this school if you're a student of color. You would think their diversity group will be better in year 2018, but it gets worse. The students are basically made up of 90% white, and conservatives students. 

The school will tie biblical scriptures in all your classes even after making you take two theology classes and you'll be asked in all your class project to explain how the outcomes or overview of your project is pleasing to God. Only gospel music are allowed in the school, Google ""Bethel students reaction to Snoop Dogg concert""

This school will put you in bubble and most of their students only get low paying jobs at Ameriprise Financial which is also a Christian based organization. Unless, you are going for a seminary degree, Bethel is definitely not a good school for any student. It’s basically a cult, and the school will make you sign a covenant which will be used against you if you ever go against the school rules."
Senior,1,"I am currently in my senior year at Bethel, and I highly suggest that if anyone is looking at this school to look elsewhere. 

In the education program, many hours are spent in schools to gain experience;however, Bethel is very unreasonable and has made me pay over $400 in travel costs to these schools alone. They are unwilling to work with their students to find a placement that fits their schedule or even is remotely close to where they live. 

If you’re looking to go to Bethel to be a teacher, look somewhere else."
Freshman,1,Beware of this college! They have acquired a large amount of friendly staff and they are very nice to you once you apply.  When you see the bill it seems like a large amount but it seems worth it.  But if you find yourself wanting to transfer they will do all they can to take all the money that is possible.
College Sophomore,1,There is no party scene at all.
College Sophomore,1,There is no party scene or nightlife here. It's Bethel.
College Sophomore,1,"The academics here is honestly terrible and frustrating. The profs are terribly unkind and u helpful and lack the knowledge needed to assist students. Gen ed classes also make up so much of your time, people rarely take classes for their majors until sophomore year. The academics are also very vigorous and cause high stress for students."
College Sophomore,1,"Bethel has had a lot of backlash about its diversity so it is now trying too hard to fix it. They recently added a cultural connection center for only minorities to hangout at, however it actually causes a greater barrier between minorities and caucasians."
College Sophomore,1,"The professors might be the worst thing about Bethel. Since we are such a small and non-natioanlly recognized school, the only profs Bethel can find are alumni who usually aren't good at their job or profs who couldn't find a job anywhere else so they settled for Bethel. The professors are usually extremely unapproachable and simply don't want to be there teaching or help you. Many students have to drop out of classes because their professors are so difficult and unhelpful. Also, their is a serious lack of variety of courses and so many useless gen ed courses that only this school requires. More than half of the courses you'll take here are unnecessary general ed requirements. One thing many students find frustrating is that Bethel often doesn't accept credits from community colleges- even local ones. For many of my classmates, they took community college courses in high school so they wouldn't have to take so many classes here. However, Bethel won't allow them to transfer over for unknown reasons. Transferring out of Bethel is also incredibly hard because of their unique classes they require you to take."
College Sophomore,1,"A degree from Bethel doesn't mean anything unless you plan on studying something biblical. I know a lot of recently graduated students are struggling to find jobs because no one has heard of Bethel or has high regards about it. Additionally, alumni connections are severely lacking compared to other schools because of this."
College Sophomore,1,"Just as a warning, half of the dorms on campus at Bethel don't have AC which is incredibility hard to deal with. Also, no dorms have cable available in the rooms. Additionally, Bethel's housing is very old and rarely updated. People find rats in their rooms all of the time and the bathrooms are disgusting. It's definitely not worth the money you're paying for it. As for the social atmosphere on the floors, the RA's really try to make everyone bond and most of the girls hide in their rooms or go home for weeks at a time. Also, Bethel has strict visitation hours and makes it difficult for causes a lot of frustration. I know many people who have gotten fined and written up for staying past vis hours for a few minutes. Even once you become an upperclassman, the dorms don't get better and vis hours still remain. Also, housing draw is a stressful mess and this year, due to an overload of students, many underclassman were forced to get upperclassman dorms on the other side of campus."
