Junior,5,"Bethel has been a great place to be. I am currently a junior mechanical engineering major and their growing engineering department has been extremely beneficial for my education. 
I have also been able to explore my faith and grow closer to others around me."
Sophomore,5,"I love Bethel! The community is great, the people you meet will be some of your closest friends, and the faculty is so welcoming and helpful. The professors are very personable. I have had a couple that invite our class over to their house for Christmas parties or an end of the year BBQ."
Sophomore,5,All of the professors were very undertanding of the circumstances were in and encouraged us to reach out if we ever needed anything. They care so much for their students and really want to see them thrive.
Junior,5,I love Bethel! It has been such a life changing place for me! Who I am as a person has been positively impacted much more than just the academic side. I am a student athlete here and it is amazing to see the community of this school! Among all the female athletes there’s a Sunday night bible study where we are able to connect with all different kinds of sports and cheer one another on! The professors are incredible and have invested so much into me and my future as an educator! I’m so thankful that I chose to come to this school!
Alum,5,"I went to Bethel for their RN-ADN to BSN program. I had 2 previous associates degrees from MNSCU colleges. Bethel was by far the best experience. The teachers care about their students and are flexible. I was very sick at the time an assignment was due and they extended the date without a problem. That never would have happened at my other colleges. Also, their main concern is student comprehension instead of temporarily remembering information for a test. The program wasn’t easy by any means but the instructors made it enjoyable by engaging students and really making us interested in the coursework."
Freshman,5,"Deciding between schools was very difficult because I knew that I wanted to go out of state but I was nervous to go to a big school.  I also wanted to make be independent.  Bethel was the perfect school because there is a spiritual aspect to the campus, but none of it is required.  The people who attend the chapels and worship nights genuinely want to be there, and are not forced to be there.  It is also located right near the twin cities so it is easy to get out and about."
Senior,5,"This school is made for the student who really wants to be known as a person rather than a number. The faculty and staff are top-notch and give an education that is second to none. If you want to become the best version of yourself, attend Bethel!"
Alum,5,"The professors are great and everyone is very inviting. The food is amazing and the dorm facilities are well kept. The campus is beautiful and up to date. The campus is very safe. The cost is a little high, but mostly everyone receives financial aid and it is very helpful it making college a joy filled experience. The buildings are connected, so during the winter it is easier to get around. I would recommend Bethel as it is a great place to attend college and get my degree. Recently, there have been improvements to the entire campus and new labs for the sciences."
Junior,5,"I love Bethel!! It feels like home and has such a great atmosphere. It's a bit smaller and it would be great to have more resources, but I wouldn't want to go anywhere else!"
Niche User,5,Bethel University is like a home when you get out of high school. After you graduate you feel like you are alone but when you go to Bethel you feel like that is your home away from home. Everything from the fantastic home food to the people you meet walking around campus you feel like it's a part of you from the very beginning.
Senior,5,"Bethel University is a great place to further your education. The professors genuinely care for you, and encourage each student to challenge their biases and expand their worldviews. Bethel advocates for spiritual, social, academic, and holistic growth and provides the resources necessary for students to mature and become their most authentic selves."
Sophomore,5,I love Bethel for the Christian liberal arts education that it provides and the caring and compassionate professors!
Freshman,5,"The professors are always willing to help you, they want you to succeed and do your best. The professors are all very knowledgeable about the topics they are teaching which keeps you engaged. The campus is beautiful, lots of good picture spots, and places to relax or do homework."
Alum,5,"I loved the atmosphere, education, and especially the people. It provides a high quality education with access to many amenities. It also has great people to connect with and has an excellent atmosphere for religion, education and self-discovery."
Freshman,5,The school brings God into the classroom and still maintains a high level of academic rigor. Everyone is inclusive and will talk with you about any topic under the sun.
Niche User,5,"I visited Bethel and I fell in love with it right away. The campus is beautiful, the buildings are welcoming and make you feel like you're at home, and their faith is easy to notice just by walking around. There are bible verses everywhere, everyone looks like they're living for Christ and applying the Bible to their classes. It didn't look like a normal college. It looked like another home. Everyone was welcoming when I visited and they had the biggest smiles on their faces. As Bethel is around the cities, there are multiple opportunities for my future occupation and I am so excited to say that I will be attending Bethel. Just after one visit, I knew this is where I was going to go."
Niche User,5,"I am enrolled to go to Bethel University in the fall of 2019.  Everything that I have seen and encountered has been nothing but top notch...i look forward to my college career at Bethel.  From the coaching staff, to worship, to admissions and financial aid advisors, I've been well taken care of and informed.  I highly recommend Bethel University."
Freshman,5,"Attending Bethel University as a Post-Secondary Enrollment Option (PSEO) student has been one of the experiences, and has made me fall completely and utterly in love with the school. All of my professors thus far have been very good at teaching and helping students, and my classes have been very enjoyable yet challenging. All of the students I have met have been nothing but kind and welcoming. As a Christian, the incorporation of faith into all of my courses has been a major plus for my college experience. One of the main things I wish to see a change in is more diversity on campus, for I am from a very diverse high school and that has always been a major part of my education. Overall, my education at Bethel has been nothing short of amazing, and I would recommend this school to any high school student looking for a good education with the friendliest classmates in a Christian environment."
Freshman,5,I like the community and that everyone is willing to help one another no matter the situation. I love that their foundation is a faith-based college because God is always number one to me and so picking a college that has somewhat of a similar moto to me is why it fits.
Freshman,5,I liked how involved the college was and the majors offered. They were really understanding when I was sending in my application and offered guidance through the process.
Niche User,5,"The administration and students have been very welcoming and accommodation throughout my visits on campus. They hold strongly to what they were funded on which is the christian beliefs and values, and I love how the professors and students are looking to make personal connections."
Sophomore,5,"Bethel University has changed me and has begun to shape me into the young woman God created me to be. From the moment I made my decision on BU, I had peace and joy about the future. I am now currently living the college life I prayed about for years. I attend classes with professors who speak and teach to me like they are a friend. They care for me as a student and a person. The community aspect fuels the people. There is a sense of togetherness, even between the people I do not know. The chapel services have rocked my world and spirit; the speakers, as well as students around me, push me to be a better person and stronger Christ follower. I am confident in the college decision I made. Bethel is authentic, it is inspirational, and it is home."
Sophomore,5,"Bethel has completely changed my attitude toward others, sports, academics, and my walk with Christ. The atomosphere here is so encouraging and positive and supportive. The academics so far have been outstanding! Bethel has given me some of my very close and forever friends."
Senior,5,Bethel has a small but beautiful campus with a variety of housing options. I've made many acquaintances here and a few close friends and my favorite experiences here happened because I joined choir and started going to the many special activities and performances out student government puts together. I love the opportunity to learn about my faith at the same time as I gain academic knowledge here.
Sophomore,5,"Bethel University provides a great professor to student ratio. The professors actually care about you too. Beautiful campus, supportive community."
Junior,5,The online program for working adults is perfectly tailored to suit my needs. I can complete coursework on my own schedule and interact with other students. The advisors and staff have also been extremely helpful.
Freshman,5,"My time at Bethel so far has been amazing! The professors really care about you and want you to succeed. The campus is so beautiful and there are a lot of things to do around campus. The dorms are pretty nice and the food is pretty good too. I have grown so much in my faith here from chapel, bible studies, and conversations with other students here.  Although this school is small, there is a lot to get involved in here. I would definitely recommend this school to anyone."
Freshman,5,"Living in the Bethel community has challenged me academically as well as spiritually. Small class sizes have given me the opportunity to know my professors, and to work closely with others."
Freshman,5,"Bethel University really has a great community, a supportive academic connection center that helps immensely with every step of any subject you can think of, and I love living on campus it has made my experience so far so much greater and better than I expected."
Junior,5,"The student body is incredibly friendly, professors truly care about their students (they have given out personal phone numbers, welcomed students into offices, allowed students to babysit children), administration is clearly caring for students. Academics are good, professors challenge students but it is well worth it. Campus is beautiful, dorms are always maintained and generally larger than at other schools."
Sophomore,5,"When I walked on campus for the first time, I knew that this was where I wanted to spend my college career. I love the atmosphere and the caring faculty."
Niche User,5,I love the Bethel community! Visiting family at Bethel has always been a highlight and love how welcoming the people are.
Freshman,5,I love Bethel University. The community is fantastic and the area it is in is perfect for job opportunities and internships.
Freshman,5,"Being at Bethel has honestly been on of the greatest experiences of my life thus far! The friends I have made,  the rigorous academic pace set to prepare you adequately for what lies ahead, the amazing staff and faculty who are more than willing to help you achieve you goals, the amazing food. To put it simply, Bethel University in an incredible school, with a great community that puts Christ at the center of everything."
Niche User,5,Fantastic school!!! Bethel offers a great faith based atmosphere where students feel welcome and comfortable to learn. The education is wonderful with many internship programs to help students succeed. May I also say the food is stellar and campus security does a very good job of keeping students safe.
Junior,5,"Bethel University is a great place for people from all backgrounds can get connected and involved with a christian community all while being encouraged and highly educated.  Bethel has a focus on community in being Christ centered, and very important. "
College Student,5,"Class sizes are very small, which makes for a great, close-knit learning environment."
College Student,5,"The campus security is very responsible and alert.  It is very easy to report anything, especially after learning from the required Sexual Assault training in the summer."
College Student,5,"Bethel University is a haven for driven, young Christians who wish to make a positive impact on their world.  I have so much pride for my school and applying was one of the best decisions I have ever made, due to the community and to all of the great opportunities I have thus been provided with so far."
College Sophomore,5,Bethel just made a whole new Wellness Center which is amazing. State of the art machines and a great space to work out! One of the best parts of campus-besides the dining center!
College Sophomore,5,The experience with courses and professors has been one of a kind. The courses are all taught by passionate and caring professors who have mastered their fields. The professors make students feel comfortable and allow them to grow in their education and prepare them for their selected fields.
College Junior,5,"Bethel works hard to get people jobs and internships. Alumni plays a huge, active role in job outlook and network and such."
College Freshman,5,"Most people at this school aren't interested in drugs and the party scene.  Some parties are rumored about, but they occur off-campus."
College Freshman,5,The people on that enroll in this school generally wouldn't be into harming anyone.  If anything the only concern would be students from other schools coming here and causing problems.
College Freshman,5,We have a 24/7 security system on campus. We have security patrolling throughout the campus at all times and are accessible at anytime they are needed.
College Freshman,5,It has a wide variety of opportunity for students. I'm in Business and I can guarantee a great help comes from the school at finding internships and jobs after you graduate.
College Freshman,5,"I feel very safe on campus. The security is remarkable, and I always see security guards at night. Some have helped me in situations before."
College Junior,5,"The worst options for on campus living are wonderful compared to several other colleges and universities. The social atmosphere is inviting anywhere, which makes up for the small spaces of some living options. Choosing housing is somewhat stressful as certain dorm rooms tend to fill up more quickly than others. After that process and people are settled in their housing, everyone is happy with their dorms."
College Junior,5,"Athletics are respected and well attended. A lot of our school spirit comes from sporting events. It's neat to see how much attention intramurals receive also. It's a way for people of all athletic backgrounds to participate in athletic activity together. Our brand new fitness center is a big hit on campus, too, for all students."
College Junior,5,My school has a community like none other. I had never felt more welcomed into a new community than before setting foot on campus. Students and professors truly care about each other; that is something I could not have found anywhere else should I have decided to choose a differently.
College Freshman,5,"So far, as a freshman after first semester I have loved Bethel!  I was more of a studies based student during high school, as well as more of a introvert.  After coming to Bethel, I was able to leave all that behind and start a new chapter.  The other new students were all super friendly and I was able to branch out and make lots of friends.  I have joined some intramural sports and clubs.  The classes have been interesting, you can definitely tell it is a Christian based school.  The professors are very approachable and passionate about what they do."
College Sophomore,5,Bethel is one of the best in the state
College Sophomore,5,"No school, outside of community college, would've been inside of my perferred budget, but I anticipated that an won't complain about what I pay. I also appreciat that Bethel cares about its communter population and it will only get better from here, which is a lot more than can be said for other schools."
College Freshman,5,I received very reasonable scholarships.
College Freshman,5,"I play Women's Basketball and it is great. I love the athletic facilities that are available to us. Not only people who play a varsity sport, but anyone who wants is allowed to use the gym or other work out equipment places when they are not being used."
College Freshman,5,It is great living on campus. There is always things to do with people. If you are bored there is a shuttle available to take people to the mall and target so that is awesome. I believe the dorm life has been a great experience so far.
College Freshman,5,I believe Bethel University's campus is very safe and I have never heard of any problems with safety.
College Freshman,5,I feel very safe if I am out late at night by myself or with others.
College Junior,5,"The Christian foundation is based on marriage and no sex before marriage. There are many couples on campus, but 90% of them are married."
College Junior,5,"With the environment, it is safe and enclosed from the rest of the city. Students and faculty are Christians, there is a very low tolerance for any such issues."
Freshman,4,Great adjustment to switching to online. They did a great job making sure everyone is still able to learn remotely.
Freshman,4,Bethel has such a welcoming community and it will always feel like home. I know I am being taught by amazing Christian professors and will be successful in my future.
Junior,4,"I had to take a few classes online due to COVID 19 and I thought for the given situation that they were handled in a way that was beneficial to both the students and faculty. Most courses didn't lighten the load during these times, but since I was learning from home I had much more time to learn the information being taught. Overall, online learning is an option and can work out better because of time restraints but I recommend a physical class to experience the great attitudes and teaching arithmetic of the professors."
Junior,4,"Given the circumstances, Bethel has done its best to provide online learning opportunities, foster community, and keep students informed."
Junior,4,"Bethel University is a fantastic school. Bethel is highly accredited, has a great music program, and has an unparalleled sense of community and belonging. However, Bethel does not have much diversity and is filled with homophobia masked as Christianity."
Junior,4,Bethel University is a great place for those who want to build a community of people that are going to be life-long friends. The staff/faculty are supportive and are willing to work with students to help them be successful.
Niche User,4,"I am currently a PSEO student here at Bethel. Overall a very good school, if a little strict. The place and service was incredible, academics are fair, and the people are fantastic. Bit lacking in the placement and buisness sections, though."
Sophomore,4,"Overall, my experience has been great. Smaller school, allows for people to see each other a lot. Faculty know just about everyone in their classes. Dining center can be a bit stingy on portion sizes but just go through the line again. Would not change my decision to come here."
Sophomore,4,The atmosphere is undeniably different and has something special about it. There is a sense of community between everyone on campus. The location is prime being right outside the city and only a short drive from the hub bub of the cities and anything you could need. The tuition of course is spendy and I would recommend having a plan for how you will afford it and making sure you are aware how much you are paying and what you are paying for. The facilities are stellar for the size of this school. The staff are top notch and most certainly some of the most helpful educators there are. Not to forget that the standards of this campus in every single aspect are very high and so much is expected of you every day.
Sophomore,4,"I love the way that this college approaches Christianity. The environment is one where Jesus' love is being spread all across campus, and it helps to make people feel more welcome on campus. I have met so many amazing people who really seem to care for one another. The class variety that is available is also very great for being a smaller school. In addition, I have met many great teachers who care about their students, and they truly want to get to know you. However, the price point of this school is a little high."
Sophomore,4,"When deciding between universities, one of the deciding factors was the theological teachings. I appreciate how Bethel gives you the tools for you to challenge your faith in a non-condescending way. It could improve in how certain teachers treat minority students. I've heard some pretty bad experiences from friends."
Freshman,4,I like bethel university because it is a beautiful campus.  The professors are super nice and they help you out to their fullest potential.
Senior,4,"I enjoy the christian perspective on typical college subjects it allowed us to think about this differently. I love the schedule of the online class, very fast paced but you are able to learn all the key takeaways with time management skills. The one thing I really disliked was the amount of group projects we were required to do, one thing about online class is, especially in the adult studies criteria is that we are all working adults, and group projects just don't work due to how we are in courses manly to fit our schedules 1 or 2 individuals always do a majority of the work."
Sophomore,4,"Bethel has high credibility for such a small school. While their size could be viewed as a negative, it allows faculty to not only connect with students while they are attending, but also work with each individual to help with the students next step in life."
Junior,4,"Excellent professors who teach with passion, genuinely care about your educational growth as well as spiritual growth.  Classes tend to be small, especially when you get to major specific classes."
Junior,4,"I love that the program I am in allows me to work full-time and be a student. The program is intensive, but worthwhile and I'm fortunate to be completing my degree soon."
Senior,4,"I’ve had a great experience academically at Bethel University. If I could change anything, it would be the social climate. You’re expected to fit the mold and be a certain type of person at Bethel. Different attitudes and lifestyle choices are frowned upon and it takes away the freedom for students to be who they are."
Junior,4,Bethel is a smaller school that has lots of great professors who will actually take the time to interact with you one on one. The STEM majors here are well backed and doing the same caliber of research as major state schools.
Junior,4,"Bethel is a very safe environment and pushes you academically and spiritually if you open up to the opportunities there. There are rules with going to Bethel and living there, but they are nothing unimaginable and make it easy to go there. The community atmosphere is incredible."
Sophomore,4,"Staff works really hard to make the student body feel welcome and find a community to settle in with (especially for Freshman). Professors are held to standards of excellence, so you will do well if you put in the effort and study hard. The student body itself tends to be clique-ish and not as diligent in living out their faith, but becomes less of a problem Junior and Senior year."
Junior,4,"I am a part of the adult online bachelor's program.  I have had a wonderful experience with how the course is set up.   Professors are kind, helpful and accessible.  The staff in the admissions and advising office are quick to respond and helpful as well.  I would recommend this program."
Freshman,4,I love Bethel and never want to leave! The campus is safe and beautiful and the teachers really care about you as a person. There are also so many opportunities to study abroad and it is a comfortable atmosphere. Although I believe this school is amazing you have to be a certain type of person to go here. Bethel is a small rich white Christian school.  I would highly not recommend going here if you do not like small clicky communities and are not a big believer in Christ or willing to become one. This is a great school for someone who has grown up relatively sheltered and does not want to change that. The party scene is also non-existant due to it being a Christian school.
Junior,4,"I really enjoy Bethel. It does have its downsides though, as it feels like they are only giving their money to the sciences - it feels like the liberal arts courses get forgotten about, which is hard because Bethel is a liberal arts school.

The classes are great and interesting, and the connections with professors and people here have been wonderful. I've experienced a lot that I never would have imagined doing so soon into my life, and its because of the connections I've made at Bethel."
