College Sophomore,1,"I came to Bethel thinking I'd found my dream school. After touring the campus and getting financial aid, I was sure this was the place for me. However, I and many others at the school, quickly realized this wasn't true. First off, the professors and classes are useless and incredibly unhelpful. Because Bethel is such a small school that is not nationally recognized, the only profs they can find are usually alumni who don't have good teaching skills or profs just looking for a job who couldn't get one anywhere else. Also, the social atmosphere is terrible. Everyone goes home on the weekends every single weekend and as an out of state student, I found this campus to be very depressing since no one was ever there. Making this matter worse, freshman aren't allowed cars so you're basically stuck on campus alone. Bethel tries to plan activities for students but no one goes and it's more like children vacation bible school events than college age events. Almost half of the freshman class this year transferred spring semester or are transferring this year, however a lot of people feel trapped due to Bethel's classes being nearly impossible to transfer over. I think a large issue is that no one going here likes being here so there is a severe lack of school spirit and pride in the school. Bethel is just simply not a good school at all- especially for the high price."
College Freshman,1,"I have never been to a party, a lot of students haven't.  Most people just hang out without partying."
College Freshman,1,There is a ghost of a party scene at this school.
College Sophomore,1,Bethel is just like high school. Very clicky and judgmental. The campus reminds me of a summer camp and the faculty is very strict.
College Junior,1,We have no Greek life on our campus.  We are on a private college.
College Freshman,1,"Absolutely NOTHING to do. I go home every weekend because the only local atmosphere is a shoddy mini van ride from Bethel to the local chipotle and target. You will pay too much for a miserable social experience at bethel. The city isnt nearby, its a good 15 minute drive for those who are lucky enough to appeal to have cars, and if you manage to go down to the cities youll probably not do anything fun because Bethel kids are sheltered and boring. They think fun is dressing up in the kids aisles at Target. Not dance clubs or concerts. "
College Freshman,1,"Student life is terrible. Student activities tries desperately to hold ""fun"" events but the quality of the base, sheltered, and flat personalities that go there make it hard to enjoy yourself in any social setting-including the dorms. No matter how outgoing you are you will find yourself suffocated by the dull personalities at Bethel."
College Sophomore,1,"There is not much diversity here at Bethel. Sadly, being a private school with an expensive tuition, that greatly limits the opportunity for many people. The majority of students are ""rich white kids"". I do admire the efforts to make this campus more diverse by the association though. You can see effort from Bethel to educate its students on other cultures and races."
