Freshman,2,"North Carolina Wesleyan College has mildew growing in the corners and ceiling of dorm rooms which has been reported to the resident assistants and advisor and still has not been dealt with. Also the dorms resemble a prison with white brick walls inside, destroying and feel for creativity. students to steal from other dorm rooms because the door room doors can be easily opened not to mention that some room keys can open other room doors and has led to several rooms being broken into  and having students personal belongings stolen, items such as game systems, jewellery, money, etc.. And the campus security does practically nothing about it. However the professors are great but the school lacks tools and resources to fully exemplify a good college learning experience and the college is dirty because they have the football team;(i play)Clean the campus every Monday which doesn't make sense because they pay people to do that."
College Freshman,2,All this school cares about is money and getting  people to play for the football team which is under bad coaching
College Freshman,2,Greek life is not very prominent at all on campus. There are only a few groups and they do not do much that is broadcasted widely.
College Junior,2,"The internship/career services woman spams your email daily about fast food positions and local dying companies in the bustling metropolis of rocky mount.

I'd be surprised if 50% of graduates can find steady employment"
College Junior,2,"Things break all the time and take ages to get fixed.

The rooms are tiny and the furniture is low quality, but whatever it's a dorm.

Residence Life staff is garbage.

If you're a girl, your dorms will be nice and pretty and refurbished.

If you're a boy, you'll be stuck in a horrible decades-old dorm full of destructive loud asshole kids that always smells of cheap body spray full of broken furniture"
College Junior,2,"Tiny chapters, and the members are mostly mindless idiots"
College Freshman,2,"Edgecombe residence hall is one of the nicer dorms because it was newly renovated. Nash, Collins, and Petteway are nasty, you cant control the air condition so the heat stays on until they decide to turn it off, the bathrooms are horrible, and there isnt a lot of room in the rooms themselves. Boddie and Centura residence halls are single dorms, they are pretty nice but you have to pay 1,000 extra a year to stay in them."
College Sophomore,2,Most of the dorms are really old and need some serious work for a private school.
College Sophomore,2,"Rocky Mount is a small town and there is not much to do here.  Raleigh or Greenville has more to offer in regards to shopping, events and recreations."
College Freshman,2,"very bipolar weather.it snows one day, then its nice and sunny, then its storming, and it continues as such"
College Freshman,2,"The faculty gives us ""strict"" rules but they don't really punish those who ignore them. from what i saw, as longs as you don't bring attention to the school in a bad way(involving the media), you wont be in much trouble."
College Freshman,2,"Because the school is so small, Greek Life is also pretty small. we have 2 fraternities and 2 sororities, the largest having 25 members, the second, 16,, third like 8 and the smallest has only 2. But we are growing."
College Sophomore,2,"The food is eh. They used to have a section where you could get international food,but they no longer have that. I tried to stick to vegetarian meals since the meat sometimes could be flavorless or cold."
College Sophomore,2,"The Freshman Dorms Are Not Great – The dorms at this school are a working process. The AC in the first year dorms isn't all that great. Always breaks down. But, it's somewhat understandable given how old the buildings are. How ever, the school offers many great opportunities.they help students when it comes to finding internships and jobs"
College Sophomore,2,"They're Okay – The only sport everyone is into is tennis. But it's hard to be part of it.During orientation they tell you that you can join and learn even if you've never played the sport.WRONG.Tennis is the most important at NC Wesleyan,if you're not amazing they don't want you. The football team doesn't even have their own field,they have to use the one of a nearby high school"
College Sophomore,2,"joining is a popularity contest,doesn't offer equal opportunity"
Recent Alumnus,2,The majority of NC Wesleyans students are a minority.  The school is made up of mostly African American males because of the football team introduced in 2004.
College Junior,2,Co-Ops Offer an Average of Real Experinece – The school will send job announcements to all the student's email address but none of those jobs pertain to my major. So its no good to me.
College Sophomore,2,"Wouldn't Know – I am an adult student who works during the day and takes classes at night. I wouldn't know about the nightlife on campus, but there isn't much to do in town."
Freshman,1,"Horrible experience here! They pick and choose who they want to discipline, and who they'll allow to get away with things. The campus is beautiful, but the administration needs a LOT of work. Most of the professors are okay, and take their job seriously. My advisor was a huge help guiding me and my class choices."
College Sophomore,1,The teaching there in terrible and they only care about sports and have no time to rest and get proper food to eat
College Freshman,1,I just don't think it's what it could be
College Freshman,1,The class sizes are ok but besides that I really dislike this school. They give out false information about lots of things that you would really consider when coming to college. I really dislike everything about this school besides the class ratio.
College Freshman,1,"Our nurse usually just tells us to go to the hospital for almost any problem. Theres has been A LOT of theft and vandalism during the past semester, including soccer feild being trashed and cars being messed with. Honestly, people are aloud to do whatever as long as the news gets involved, then you're out."
College Freshman,1,"The faculty say that there is a bus that comes and pics up students to go into town but during the whole year I've attended, i have not seen the bus once."
College Sophomore,1,There are no parking spots for students .Students are just like the public we cant park across the street. We have to use the side parking in the streets of downtown. We do have a public parking lot down the corner.
Recent Alumnus,1,Campus housing in a few words is run down!  The need severe rentavation and makeovers.  The doors could use a much needed paint job with some matching furniture.  Nothing excessive just cleaned up a bit.
College Senior,1,"Everything Is Reallyyyyy Outdated and Old or Just Too Small – All of the buildings are too small or super old.. like from the 70s!  even with the addition the library, it's still to small, especially if you need a computer!"
College Senior,1,"The classroom buildings are very very stuffy especially in the bathrooms, where there is no AC or heat. In all of my classes there is no central AC which is totally unacceptable for the price we pay to go here. I'm pretty sure there is no heat in the classroom buildings. If you go to class without a jacket in the winter, you'll freeze!  These problems can make it hard to concentrate in class!!!!"
College Sophomore,1,"Not at Home – Visitors have to be signed in and out as if they are visiting violent prisoners. We are not allowed to choose when we are cold, the heat is only able to be turned on by the college and it has to be under 70 degrees. Students often had to sleep in sweat pants and hoodies. Many bugs, water and wifi issues."
College Freshman,1,"Drugs at Wesleyan – Horrible. The school is working on fixing the problem, but it's still horrible!"
