College Freshman,2,"Greek life dominates. Obviously you can get by without being in a frat or a sorority but: there are girls who think that ""all guys with a social life rush"" so... boys might want to consider that. For girls there's less obvious pressure, but when Bigs start showing up in your dorm showering all their littles with gifts, the Greek presence definitely dominates."
College Junior,2,Bad weather negatively affects the experience
College Freshman,2,The drug scene is not that noticeable. There are many other options if you don't want to and there is not pressure to if you don't want to. The most prevalent is alcohol though.
College Freshman,2,Not a lot of aid besides Jeff Scholars for merit!
College Sophomore,2,"Parking isn't great during school hours, but pretty easy to deal with at night or on weekends."
College Sophomore,2,It's hard to find parking but few people actually drive to class. Living off campus and trying to find parking is near impossible unless you buy a space. 
College Freshman,2,Lots of competition and stress. My dislike comes from mostly personal reasons. My advice is to consider whether or not a large school is really right for you.
College Freshman,2,There's not much parking...it kind of sucks.
College Sophomore,2,Not so easy to find solely merit based aid.
College Sophomore,2,"We do very much accept different races here; however, there is some self segregation of certain ethnicities that seem to be impermeable. Economic background, political beliefs, religion, and sexual orientation all are handled well and are rarely even noticied among our scholars. We very much accept everyone or at least to the point of respecting their own opinions."
College Junior,2,"Greek life is definitely a presence at this University but it doesn't represent an overwhelming majority of the student body. Fraternities and sororities are definitely spirited organizations known for their tightly-knit members and sometimes exclusive parties; but that doesn't prevent any brothers or sisters from becoming integrated in other groups at the University. Being non-Greek, I'm part of a handful of student-run organizations that have an outstanding number of Greek participants. I've never thought that Greek-life was a dominating presence at my school."
College Junior,2,really cold when its cld and really humid when its not
College Sophomore,2,"Drinking, at least, is pretty visible.  I don't think there is a lot of peer pressure."
College Sophomore,2,"I had to send in the same document multiple times. Also, for the amount of effort I put in, I did not receive the amount I was expecting. I do not have enough aid or the money to pay for the rest. I suggest to anyone in the same position to apply to as many renewable scholarships as possible, and contact financial aid with any questions or concerns you have. Also, college planning network is a great resource but it is not free."
College Freshman,2,"For students under 21, the only real options for parties are frat/sorority parties. Many of them usually have a guest list or only admit certain people. A lot of them tend to even exclude minorities."
College Freshman,2,"There are diverse people, but we tend to self-segragate. People gravitate towards familiarity when they first get to college so they are more comfortable. Because the beginning is when most friendships are formed, people tend to stay in their own cultural groups."
College Freshman,2,"Campus dining is acceptable, it would not win any prizes.  Not enough variety if you want more than the basic, standard food."
College Freshman,2,"It is very very difficult to park on or around campus. There are very few available spots unless you have a house. I do not need a car to get around campus, but it is problematic when people come to visit me on any time other than the weekends."
College Freshman,2,"I know a friend group that smokes pot, but that's all I've seen here. It's not incredibly common, and in my experience, if it happens at a party, it'll happen in somebody's room or somewhere off-limits so you're not likely to stumble in on it if you don't wander off the beaten path. They're really strict about having it in dorms, so I guess it's more for the upperclassmen who live off-grounds.

Alcohol, though, is really easy to come by if you want it. Very visible, and all you need to do is walk across the lawn on a weekend night or game day to see lawnies having parties. They don't have it at parties for some of the Christian groups, I think. Nobody will think less of you if you don't drink (hopefully), but there's definitely a pressure for it at parties just because everyone is doing it. It sorta depends on the party. It's not allowed in first-year dorms, but some people choose to have it anyway if they know upperclassmen who will buy it for them (which is fairly common in my experience). You're good as long as the RA doesn't see it, and some (but not all) RAs go out of their way to not see it.

I'd heard this before I started at UVa, and it's definitely true: the police are here to keep you safe. They'll bust a party for noise violation, but they don't really do anything about underage drinking unless you mouth off to them. I've heard that they're tougher on drugs, but that's not really my scene, so I can't speak to it."
College Sophomore,2,"Percentage wise The University may be diverse but when it comes to parties, greek life and friend groups it is rather homogenous."
Junior,1,ehehehehehehehehehehehehehehehehehehehhehehehehehehehhehehehehehehehehehehehehehehe.enenenenenenennenenenenenenenene
College Freshman,1,I had a horrible experience rushing a sorority and feel very excluded now by Greeks
College Freshman,1,Everyone is very stuck up here.  Most are the assholes who thought they were cool in high school.
College Freshman,1,Don't come to UVA if you don't enjoy living with a bunch of stuck up assholes.
College Junior,1,"Food on campus is awful. I got food poisoning from O-hill my first year. I did not get a meal plan after my first year, but first years are required to be on meal plans. The food not only is unhealthy, but also there are limited options and it doesn't taste good. I absolutely hated the food, and I would not recommend eating in the dining hall unless that's your only option."
College Freshman,1,It is very hard to receive any type of financial aid as an upper middle-class student. Especially as an out-of-state student as well.
College Freshman,1,"The scholarships for first year needed to be turned in before I even knew if I was accepted into the University, which just seems a little ridiculous. Even after turning in all of my financial aid work I got nothing back and felt as though I wasted a ton go time just doing what they wanted with no returns in sight. It also was a hassle for them to receive my fax messages and I had to re-fax some of my information up to three times."
College Freshman,1,"Wireless could definitely be better. Buy your computer through Cav Computers, definitely."
College Freshman,1,"Grounds is very wealthy, straight, and white. Socially many people may be liberal, but there is a huge core of Young Republicans who will loudly disavow Obamacare without making any solid points. For what it's worth, the University makes a huge effort to increase diversity or at least awareness of diversity, but it is hard to pick up on this on a daily basis."
College Sophomore,1,Filling out the form was a long and lengthy process and there was no aid given.
Recent Alumnus,1,"the drug scene at uva is not very big, although it depends on who your hanging out with. Drinking is much more popular."
College Freshman,1,UVA doesn't give out many scholarships. All my financial aid only consisted of things I could get from the government. Any scholarships they offer are very prestigious and most people don't get them.
College Sophomore,1,"Although parking is not a necessity for most students - most housing is within a very walkable distance - when you are desperately in need of a spot, there will be nothing within a mile. Or, if there is, it will be ticketed after a mere half hour or perhaps after a bit longer - if you have the luxury of landing a slightly better spot."
College Junior,1,"While it pains me to say anything negative in relationship to UVA, dealing with the student financial aid office has been the single most frustrating aspect of my three years here. Granted, UVA is a fairly large school, and for the number of students we have, the office is vastly understaffed. Having said that, my interactions with financial aid have been exhaustingly taxing (pun intended, although it's no joking matter), as I have repeatedly been on the receiving end of their inefficiency and lackadaisical treatment. It's best to deal with them in person--the representatives I've spoken to in person have usually been kind, good people; but if you want to get stuff done, don't deal with them over the phone. 

Grants are absurdly stingy here, too; if you are looking for scholarships it's best to do it through independent foundations, or through sites like this."
College Senior,1,Clemons library used to have a good amount of computers for student use and allowed for students to borrow laptops for use in the library until last year. You better have your own laptop! There is a small computer lab in Alderman.
College Freshman,1,"Parking and even driving On Grounds is a nightmare during the school week, central roads are blocked off from through traffic and parking passes are not available for students. You can pay at the bookstore, but other than that, keep your car at your apartment."
College Junior,1,"Greek Students Viewed by Non-Greeks – At UVa, non-Greeks view those involved in Fraternities and Sororities as snobbish people. They tend to be very cliquey and very self-centered. There is no interest in getting to know non-Greeks. Also, the socio-economic divide between Greeks and non-Greeks is obvious."
College Freshman,1,"Don't Bother Unless Your Parents Dont Make Any  Money – Financial Aid in general is a pain in the butt and they screw up the paperwork often. UVA doesn't offer any academic scholarships, only need based, so unless your parents do not have any money or are unemployed, good luck getting any financial aid. I only have my moms salary and they still didn't give me anything. Other people got tons if their family income is less than $25,000. I would recommend applying to tons of private/national scholarships instead"
College Freshman,1,"There is no parking at UVA. For anyone, even professors. Good luck finding a place on grounds for your car."
College Sophomore,1,"The local atmosphere is non-existant, UVa makes the town."
