Sophomore,4,"The grounds are beautiful and radiates an aura of scholarship and intellectual excellence. The learning environment is incredible and the instructors encourage a diverse space to share ideas and ask questions. As a first-generation immigrant, I would have liked to see a bit more diversity in the student body. Nonetheless, the people are all friendly and welcoming, making UVA a place to make wonderful life-long connections with some impressive individuals. Students are very involved in the community and with the plethora of extracurricular activities available, there is something to do of interest for everyone. Sometimes the workload is heavy and stress is inevitable, but if one manages their time wisely and makes an effort to reach out to other students, TAs, and professors, academic success is achievable."
Junior,4,"This university is located in the beautiful, artsy location of Charlottesville. Since it is a relatively small campus, it feels like a true family to be a student here. The architecture of the school is traditional, and many building remind you of the Thomas Jefferson era. The education is exceedingly good, and every professor here is one that you want to get to know. The food at the University is not good, but Charlottesville has amazing local food so it really makes up for it. New dorms are very modern, but old dorms need some rennovation."
Senior,4,"UVa is a wonderful school with ample opportunities to study and get involved in whatever you are interested it. Greek life is an option, though you will be completely fine if you do not join. The school work is intense, but manageable."
Freshman,4,"UVA is an excellent institution. The professors and academics are high level and rigorous but they are meant to challenge you and the professors are really focused on not only wanting you to succeed, but instill learning that will be relevant, impacting, and long lasting throughout your life and make you into life long learners. One thing I hope to see get better is UVA's response time to emergency events. In light of the recent circumstances due to COVID-19, I've been disappointed with how the university has handled things compared to other schools whether it is how they are handling certain things or the rate at which they are coming to decisions."
Senior,4,"I transferred in to UVA from a community college my second year, so my experience was non-traditional. The academic rigor really slaps you in the face when you arrive, but you become accustomed to it. The campus, or ""grounds,"" as we say here are really beautiful. The dining hall food is average, though this is an area that needs improvement. Professors are generally excellent, but you still need to do your research before you choose a class. I am graduating this year and will really miss UVA. You really do form a community here."
Freshman,4,The scenery is refreshing and everything is spread out. It is a good choice for university if you're looking for a change from a city life.
Niche User,4,The University of Virginia is an amazing school with amazing people. The school spirit makes the campus feel very united.  The classes are very inclusive for every personality type.
Freshman,4,"I really like the challenging academics and the communal atmosphere at the University of Virginia. One thing I would like to see, however, is more diversity and support for lower income students. The professors are very nice and truly want to see you thrive in their classes."
Freshman,4,I have liked most of my professors and enjoy all the resources provided by the University. One thing I really dislike about it is the extremely competitive nature it creates amongst students.
Freshman,4,"UVA is a wonderful place to find your college home! Nowhere is perfect, but, coming from someone who was determined to not go to Virginia (I didn't want to go to my state's big school), I have found so many incredible opportunities and can't imagine myself any where else. It is academically rigorous, there are many resources to take advantage of, and it's diverse. You are bound to find your passion and your people at UVA."
Alum,4,"I think UVA has an excellent level of quality academic fields with individuals ready to teach and individuals ready to learn. The school does well in trying to foster a community of  “us” as being Wahoo and encouraging students to find their niche and to support each other. This university provides a listless amount of opportunities to try things some individuals may not normally have access to, as well as meet people from all across the world. The UVA community has a ways to go in recognizing the skeletons of its past and reconciling the treatment of slaves and their descendants as well as women and other minorities. I also feel that a community of this size does attempt to address the needs of its inhabitants, there is still more that can and should be done to help support the mental and physical health of its hard working students, faculty, and staff."
Freshman,4,"I love the warm atmosphere, college spirit, and the work hard- play hard mentality in the University. Academics can be quite tough, dining hall food isn’t the best, and there’s a slight lack of diversity but the pros definitely outweigh the cons! Proud to be a wahoo."
Sophomore,4,"UVA has great sports teams, good social life, and great academics. The school is not exceptionally diverse; however, the administration does everything within their power to make sure everyone feels welcome here. The campus is beautiful and there are many great places, both in inside and outside, for studying. My only issue with this university is that there is a very competitive environment that can take a toll on your mental health if you’re not careful."
Niche User,4,"When I visited UVA's campus in the summer of 2018, I was surprised at how friendly the staff and student guides were to me and my fellow peers. They gladly showed me what UVA had to offer. This experience made me consider this university more for when I eventually applied for it this fall. They told me all about the amazing academic fields, clubs, and organizations that they offered, and this further enticed me to consider UVA in my applications."
Sophomore,4,"I love a lot of things about UVA, but it is very expensive for an out-of-state student, which is really my primary complaint, but nothing I didn't know going in! The campus is beautiful, the academics are top-tier, and there is incredible school spirit. Also, the food and dining programs are really good!"
Junior,4,The food has gotten better over the years but can still use some improvement - as per usual. They need to work on diversifying the student body beyond just race/ethnicity.
Senior,4,"So far, my experience at the University of Virginia has been very good. The grounds/campus is beautiful and the academics are excellent."
Junior,4,"There is a myriad of clubs and organizations at UVA, so I found it easy to find people with common interests. During the first year, the university makes you get an unlimited meal plan which was very helpful during that transition period and not having a place to cook meals."
Sophomore,4,"My first year at the University of Virginia was a challenging, yet enjoyable  experience.  Besides trying to manage the academic rigor, I made some new friends and joined a few extracurricular activities that I am passionate about.  My first year was also a learning experience.  I did not have the best roommate situation but through faith, I learned how to not let that situation negatively affect me.  Additionally, I learned how to take better notes and how to study more effectively.  The University of Virginia challenged me without a doubt academically, emotionally, and mentally, but I have learned how to perform better in those areas.  I love being a Virginia Cavalier."
Junior,4,UVA is a prestige school in Virginia that provides world class education to students preparing them to take up on the rigors of this world.
Niche User,4,"The University of Virginia has one of the most beautiful campus in the state with excellent academics and a competitive atmosphere; however, like most colleges, there is a lack of diversity as there are mostly white students. Although this is the case, the search for inclusion is not difficult as there are always groups for everyone."
Freshman,4,"I am an incoming freshmen at the University of Virginia so my experience at the University is limited, however from my countless visits and student orientation I have developed a positive image of the University. The students and staff at UVA have been welcoming and helpful, assisting me when I am lost or in need of advice. UVA encourages independence amongst its students which I believe to be an essential part of the maturing process of a student and young adult. UVA offers countless resources for its students to get involved or seek assistance when they are in need. Whether that be the deans that are available most days with an appointment (walk-ins are available with the ""dean of the day""), financial advisors available with just a brief phone call or handshake, a resource that helps students find jobs/internships and plan their future outside of college, UVA offers its students countless opportunities to get help and succeed which is something I really value."
Junior,4,UVA is a great school with great opportunities. The academics are very rigorous so be sure to study hard.
Freshman,4,"There could be better food and housing on grounds. I am impressed with the academics, but I do not understand why everything is so competitive. You are not even guaranteed a certain curriculum in the College of Arts and Sciences. Not saying this is bad or good necessarily, just important to note if you don't like applying to things. Finally, the college is simply TOO expensive."
Freshman,4,The campus is nice and the faculty are more than willing to help you. The food here is not the best though.
Sophomore,4,"The environment at the University of Virginia is amazing; anyone can find their community within the large grounds of UVA. While getting accustomed to the academic life at UVA is difficult, finding upperclassmen friends to guide you along the path helps. If I were to change one thing about UVA, I would change the amount of resources they have for first-generation students. First-generation students need more help than others."
Sophomore,4,The academics are challenging without fluff. It can be challenging meeting students of my background
Junior,4,"The academics and learning environment at UVA are unmatched. The quality of education for the price is impressive, and there are countless opportunities here to explore your interests."
Freshman,4,"UVA is a great place to balance both your academic and social life. It has a great party scene, but it offers way more social opportunities for those not interested in partying. The professors and students here are very nice and welcoming."
Sophomore,4,"The University, while trying, still needs to improve on the diversity of the staff, especially the professors."
Junior,4,"University of Virginia is a great school, with excellent academics and an amazing campus. One thing I would like to see change is an increase in diversity, and less of a focus on separating groups of people, and more of an emphasis on empowering all people in a diversified environment."
Sophomore,4,"my first year was awesome! the only thing to complain about is the food quality! considering that is the only complaint, i go to the best school ever!"
Sophomore,4,"UVa is an excellent school in regards to academics. The professors I've had are generally quite friendly and willing to help you during office hours. However, I will say that it can be a bit difficult for out-of-state students (especially those who are more introverted) to break into the social scene."
Junior,4,"The Univeristy of Virginia offers great facilities and student life. The academics are rigorous, but employment statistics seem to suggest the rigour is well worth it."
Junior,4,"I love the campus and the people. I think that it is certainly challenging academically, but I find that many students are willing to help you in classes. The campus itself is absolutely beautiful (especially during the fall and spring time) which encourages a lot of students to study outside on the Lawn. The school is known for being preppy; however,  you can still certainly find you friend group outside of that (as I did in a Christian fellowship). Most of the professors that I have been taught by were really good, but I have heard my fair share of poor professor stories (I've just been lucky enough to not encounter that in the English department). The one other downfall I would like to comment on is that  I do sometimes find myself hyper-aware of the fact that I tend to be one a few black students in the classroom. However Black Student Alliance tries to have a strong presence on the campus."
Senior,4,"This college if pretty good. It is one of the best colleges in the state and it is the best college in the state for the subject I am majoring in, which is astronomy. It is pretty pricey of course, which is expected. The meal plan is crap, you pay more per meal for the plan than for buying the meals one at a time."
Sophomore,4,Joining the University salsa club at the University of Virginia has been the best thing that I have done since coming to college and would recommend it to everyone.
Graduate Student,4,"The University of Virginia is situated in beautiful Charlottesville, VA. It has a prestigious reputation and a diverse student body pursuing a number of exciting and interesting courses of study. However, any student can easily get lost in the shuffle of a large institution. The support resources are good, but require the student to step up and use them voluntarily. In addition, behind the UVA brand, there is some lack of connection with the surrounding community. UVA is not quite as good as they perceive themselves to be."
Junior,4,"My experience, as a transfer student, has been intense, humbling, and excellent. Transferring from a community college to U.Va has been life changing. It is academically rigorous, but the professors are more than happy to help. Everyone here is a natural born leader and are highly active on Grounds. Though I come from a community college background, I feel that U.Va has done a fantastic job with their transfer students. I was assigned a mentor who happened to be a transfer student a year before. They definitely aided my journey through U.Va, and spoke to me about their own experience.  My experience academically has been challenging, but my professors were patient and easy to work with. Additionally, professors of this institution are extremely passionate about their courses and are willing to help their students grasp the material.  Overall, I am more than content with my experience and enjoy the diligent atomsphere here."
Senior,4,This is a fantastic school with a terrible history. I was able to find my home here but it took a lot of searching.
Freshman,4,Something I really love about UVA is everyone's willingness to look out for and support others. The atmosphere is great and there's always something to do; just look at all the clubs and extracurriculars offered! There's something for everyone and the campus itself is beautiful.
Alum,4,"Academics are great! Definitely worth the price you pay for the school- which is relatively inexpensive. Socially can be a bit ""uppity"", however don't let this deter you. Everyone finds their place!"
Junior,2,if you want a school with rich kids who got in from daddys donations then look no further. awful overall.
Junior,2,"The professors/academics have for the most part been great, though I've had a lot of frustrations with the way the school is run. For one, many majors at UVA are application-based, and have very competitive acceptance rates, though they're extremely misleading about this on their main website. Even majors like Creative Writing require an application, which is unusual for even similarly selective schools like William and Mary. I applied to one of these types of majors, but because I was a transfer student taking three courses and commuting due to chronic health issues, therefore having no time for extracurriculars/a beefed-up resume, I was not accepted, despite having the grades I needed. UVA is not by any means a commuter school, and it is very difficult to work with many of the university's systems if you are a non-traditional student. They also prioritize good-PR investments like athletics and eco-friendly LOTL when the bathrooms are falling apart in some older buildings."
Freshman,2,"Good school for you if you don't mind meeting a lot of selfish and big-headed people, people like that and very antisocial nerdy types seem to be the only kinds of people at UVA"
Niche User,2,I am an above average student and I wish they offered more merit scholarships. I do not qualify for the TOP and only merit scholarship. They need more mreit scholarships.
College Sophomore,2,Old Dorms suck but are closer to classes.  New dorms are really nice but much farther away.  Social aspects of New and Old Dorms are the same.
College Freshman,2,"The whole atmosphere surrounding the rush and pledging process leaves much to be desired. The rush process is terrible for girls (sororities) but the pledging process is great. It is the opposite for fraternities. Lots of hazing takes place, whether or not anyone wants to believe it. This is typical, nothing unexpected. The concept of having a group of people that you are close with and can bond with and can rely on for support is good, however the execution of joining these groups are pretty sad and inhumane. Being a member of a professional service fraternity myself, I cannot say I have experienced all this, however I have heard many stories and witnessed much of what I have described. 

Students in greek life are generally regarded as partyers and people who abuse alcohol. However they are not all like this. Many are, however. Greek housing is plentiful. Most social greek organizations have houses, and even some professional organizations also have houses."
College Freshman,2,"There is little diversity at the school, and those who are minorities don't really get much a say in things here. It's not a great situation to be honest."
College Freshman,2,"Everyone at UVA drinks, and if you don't, it's noticeable. Anyone saying otherwise is just trying to convince you to come here. In terms of drugs, I definitely see it everywhere, and that's not a huge problem. I personally have no problem with drug use, and other than excessive study drugs that start taking a toll on people mentally, I don't see many drug problems here."
College Freshman,2,"There are a lot of issues with the Greek scene, including pervasive racism, sexism, and homophobia. They are generally a large group of wealthy, privileged white kids who don't want to look outside the bubble that is Rugby Road (the road most Greek organizations are located on). It's pretty big here, but if you want to avoid it, it's not that hard."
College Junior,2,"Greek life at my school has a bad reputation but is still sought after by first-years and anyone looking to party. I personally find Greek life disruptive at times, but they can be very big-hearted. One time a CIO I'm a part of was raising money for a family with a terminally ill patient and a fraternity extended their time and efforts to help raise money and awareness. I'm not aware there is any Greek housing, but if there are it would be located off-grounds."
College Senior,2,"Campus housing is expensive, far away from grounds, socially isolating, and lacks amenities. Most students rent off-grounds housing after their first year. Anyone who tells you on-grounds is a better value is absolutely lying- coming from someone who worked for Housing and Residence Life!"
College Senior,2,"Hard to escape Greek presence. Most individual Greek students are nice, but the organizations themselves contribute nothing to school life except parties."
College Freshman,2,Excessive drinking is pretty common here.  I don't drink so I am not worried about my safety.  But I do worry about my friends occasionally.
College Freshman,2,"If you want a good job, to William and Mary or Tech"
College Freshman,2,"We are pretty good at every sport that doesn't matter, other than basketball."
College Freshman,2,"The partying is excessive to the point that it's debilitating- even going so far as to inhibit my own study habits and ability to sleep. If you don't appreciate living with a bunch of rich animals, UVA is so not for you."
College Freshman,2,"It takes a while to receive, and the employees do not offer much help. You can call the office, and get two different answers for a problem that is easy to solve. So many headaches."
College Freshman,2,"Long process, hard to get scholarships as an instate student"
College Freshman,2,"The food on grounds is very disappointing.  There are very few healthy food options, and the meals that are available are often undesirable.  The quality of the food is very poor as well.  The salad bar is often filled with old vegetables and the fruit available is often unripe."
College Freshman,2,"Easily the biggest downside to the first year experience. Food is repetitive, processed and hastily prepared. There are great, super inexpensive alternatives all over Grounds and the Corner though."
College Senior,2,Parking is pretty difficult at UVA and in Charlottesville in general.
College Sophomore,2,"Between frats and the bar scene, personally I am over it. I like to have intimate small parties with friends."
College Sophomore,2,"Lately the University of Virginia has received a lot of bad coverage over sexual assault. Our leaders, student and faculty, are in the process to help this problem."
College Sophomore,2,It's very cliquey and predominantly white.
College Freshman,2,"UVA does not offer many scholarships, and I ended up needing to take out more loans than I had originally anticipated. Most scholarships are for students who come from obscure states or for upperclassmen, and there aren't a very many scholarships available."
College Sophomore,2,My family is too wealthy for need-based financial aid and I'm below average for UVA students so don't get academic financial aid either.
College Sophomore,2,Some times swiping into dinning halls I regret it instantly once I see the option. They are a hit and miss. Sometimes the hours suck. Plus dollars and meal exchange are a life saver and there are plenty of better tasting options outside of the dining halls that are UVA dinning affiliated.
College Sophomore,2,"Its seems like I am always getting updates about a sexual assaults from the school. I also hear about people stoping guys from taking advantage of girls. Some houses use grain alcohol, are rumored to use date rape, or are creepy, but I haven't had that happen to me personally. Everyone has been more aware with everything happening recently with Hannah Graham."
College Freshman,2,"The quality of housing depends greatly on where you live. Old dorms have the best sense of community and they are closer to classes but they have no AC and are very dirty. Housing for first year is assigned randomly. Because off campus housing is ridiculously over priced, it is super important to stay on top of deadlines for on-campus housing when applying after your first-year. You also apply to one of the residential college for any year."
College Sophomore,2,UVA isn't as diverse as it should be. It's a big school but I find that a lot of the students are pretty similar (read: generally well to do). UVA can and should do a better job at admitting and supporting students who aspire to attend a university of such regard but may not have the finances to do so.
College Sophomore,2,"Racially, things seem very self-segregated."
College Sophomore,2,"For the amount of money we pay for tuition, the quality of food and variety should be much better."
College Sophomore,2,"There is very little variety, and somehow they found a way to make everything taste the same."
College Sophomore,2,"Many people abuse drugs and alcohol.  It is very available, and fake IDs work almost everywhere."
College Sophomore,2,"As a non-Greek, it seems to me that Greek life is about buying friends and getting drunk.  Sororities and fraternities throw charity events because they have to, and do not really engage genuinely in the Charlottesville community life.  The culture is generally very elitist and Greeks seem to look down upon non-Greeks."
College Junior,2,"Parking sucks--you can't park anywhere on campus without paying, even on the weekends."
College Junior,2,"Parking is expensive at the University of Virginia. What's more, the street parking spots are limited and during the day, parking permits are enforced. After 5pm however, there are some parking spots that you can take advantage of because they become free for all. One such place is the parking garage for the Memorial Gym (colloquially called Mem-Gym)."
College Freshman,2,"The weather changes randomly to cold and hot. Even recently, snowing in March. It affected me because I got sick often and didn't go outside because it was too cold."
College Freshman,2,"There are a lot of wealthy upperclass white students here.  In greek life, there is a lot of racial and class segregation."
College Freshman,2,There's always a grungy frat house you can go to if you want to get soaked with beer.
