Sophomore,5,"I have taken classes online due to the COVID19 Pandemic. I have loved my experience with UVA online, and all of my professors are super helpful!"
Freshman,5,UVA has done a good job of incorporating on-Grounds and off-Grounds students during this time. I don't feel as if I'm missing out as much as I thought I would be.
Sophomore,5,"Currently, I take my classes online due to COVID-19. I feel the professors have worked hard to create a good learning experience despite the nontraditional means of interaction. They have been very accommodating during a stressful time for students."
Sophomore,5,The University of Virginia is an excellent institution that offers a great education. The professors are accessible and friendly even with larger class sizes. The campus is gorgeous with historic architecture. I would recommend it for any ambitious student looking to further their education.
Junior,5,"I've got nothing but good things to say about the professors and people I've met here at UVA. My nursing professors are extremely accommodating and understanding, and they really take feedback to heart. I've had so many experiences at the hospital that I know I wouldn't be able to get elsewhere. The social life is great, too (aside from COVID), and I've met so many people who are genuine and share the same values and I do. Go Hoos!"
Graduate Student,5,"I have been a graduate student at the university for about 5 months now and while most of my classes have been online due to the pandemic, I have greatly appreciated the effort my professors and classmates put in to make it seem like a typical class. While I'm in a technical program, we are given opportunities for hands-on learning and are well supported. I feel valued by my specific program and the professors are second to none."
Freshman,5,"It just started, but it's been going well so far. The professors have done amazingly in these uncertain times. While there might be a few mistakes with the technology, the proffesors and TAs are doing everything they can to make sure the students are getting a good education."
Alum,5,"I thoroughly enjoyed my experience at UVA. The school was full of tradition and became home very quickly. The school was as big or small as you made it and I went out of my way to get to know as many people as possible. The food was better than high school, the athletics were national winners for several sports a year, and the professors are the best of the best. The school gave me opportunities I couldn't have gotten at a smaller school or much larger school. The party culture was above average and there was something going on every night. I would recommend this school for any high schooler who wants to study hard, have opportunities post graduating, travel abroad, be challenged in classes, study late nights, and wants value for money."
Sophomore,5,"My online learning experience with UVA was decent.  I continued to learn and do well, but the online environment did not help me learn the same way as an in person class."
Sophomore,5,"I love UVA.  Not much I would ask to change, apart from dining hall food.  I have learned a lot so far and still have a lot of time to go."
Junior,5,"I love the grounds, the size of the school, and the fact that it offers a typical college experience. It has great sports teams! I think it can improve by addressing the racism the university was built upon by hiring more professors of color."
Freshman,5,It's definitely a school that stands firm on a work hard play hard ethic and does not limit or hinder student participation and leadership
Freshman,5,When one needs information on anything it's very detail-oriented and organized and takes most situations and conditions into consideration in terms of internet access and eligibility
Freshman,5,"UVA is a different, but great experience. UVA is a community of great caring people. I wish the dining hall food was better. Also, some of the classes are limited to availability. Other then that, it is great!"
Freshman,5,"UVA did a great job moving everything online. Most classes were still helpful. I feel like I learned less, but it still was an enriching experience."
Junior,5,Quick transition to the online learning experience.  Professors and individuals of leadership were quick to accommodate a wide range of students.
Sophomore,5,"I loved my first year at the University of Virginia. The students, faculty, and administration work together to create an inspiring and welcoming community. I enjoyed going to sporting events (2019 National Champions) and spending time in Charlottesville. I cannot wait to return to UVA this fall, and I am incredibly grateful to be a Wahoo!"
Sophomore,5,"I've loved my time at UVA so far. There's definitely something to be said about the unique passions and involvement each student participates in, which is incredibly motivating. I've made amazing friends, and met some even more amazing professors as well. The dining hall food sucks, but first year dorms are pretty good now! Overall, I am so happy with my decision to come to UVA."
Niche User,5,"I am attending UVA this fall, so I'm not really sure how to respond to this question. I have two older siblings who both attended and were able to graduate a semester early and land excellent jobs straight out of graduation. Furthermore, UVA is just beginning to open an astrophysics major which is exactly what I was planning on taking advantage of."
Senior,5,"As a Hijabi student at the University of Virginia I was quite enthused by the ability for  Muslim students to pray in Newcomb Hall. However, as more Muslim students are accepted into the University I hope that bigger accommodations will be made for prayer. I also truly enjoyed the Iftars held during Ramadan for Muslim students by the Alumni Association at Alumni Hall in the Spring of 2019."
Niche User,5,I have loved it ever since I came here. Everything is great. The professors are amazing and there is nothing that isn't good about it. I would highly recommend this college to anyone
Freshman,5,"I have met the most extraordinary people at the University of Virginia. Professors and students have made my first year amazing. The academics are exceptional, as I challenge myself to learn and expand my horizons everyday. I have come to feel at home and feel safe at this school."
Niche User,5,"My sister is a sophomore at UVA and it is truly the most amazing school! I love whenever I go visit because the environment is always lively and the campus is very well kept. You can tell the students there have a lot of school pride which is awesome! Not to mention Charlottesville, VA is a great town with plenty of shops and restaurants!"
Junior,5,"I absolutely love it here. My fellow students are always encouraging me to explore the world around me and better myself through all kinds of social and academic support. The professors are always so engaging and knowledgable,  creating a learning environment that is perfectly challenging and accepting. Outside of classes, there are so many research opportunities, and faculty is very approachable and  helpful when it comes to supporting experiences outside of the classroom."
Freshman,5,"This is my first year and I had such a great experience. I met so many new people and became part of many organizations where I can really connect with people. I am part of the marching band and we are such a close-knit family. Your professors are there for you when you need help. We have such amazing athletes and I enjoy going to game like soccer, volleyball, football, and who could forget basketball games."
Freshman,5,"As my first year at UVA is coming to end, I have gotten to fully experience college life. UVA provides so many resources including great alumni networking which can lead to internships and jobs. At UVA, you have access to amazing professors and deans who care about your future and want to put you on the right path. You have the opportunity to meet many people from around the country and around the world which provides UVA with a unique environment that no other school could rival. Charlottesville is the epitome of a college town that blends university and suburban life so well. It makes UVA feel like a home away from home especially for out-of-state students, like myself, and international students. Even as a first-year, you have great access to a variety of classes that can help you determine your major and future career. Through my overall experience at UVA, I can say that UVA has been the best decision for my future and I wouldn't want to be anywhere else."
Freshman,5,I just got accepted and I already know I'll love it. I've visited a bunch of times and it gets better every time. Can't wait to start in August!
Freshman,5,"Very nice campus with many interesting professors, peers, and faculty members. The area is nice and the academics are awesome. The school is very big in sports and the party scene, but it really requires a lot of hard work and personal growth to learn and get through the courses."
Freshman,5,I am currently a first year at the University of Virginia and I have found my experience to be far better than I ever could have imagined. This is due to the passion shown to me by my professors and to the education that I have already received at this excellent university.
Freshman,5,"Work hard, play hard. I love this school. I'm learning so much in my classes, and I'm having so much fun when I go out. All my other friends from high school are at schools up north and all I can say is that I'm not jealous. This school is the ultimate college experience"
Alum,5,"The school's honor code is incredible and impactful. Totally run by the students. Provides a strong culture of trust among students and between teachers and students. The Grounds are gorgeous, tremendous architecture by Jefferson and others."
Niche User,5,Great school that is very focused on academics but still maintains a work hard party harder mindset that allows students to understand the benefits and positives of hard work
Alum,5,"I loved my time at UVA, I made some of my best friends there, and I always love going back! The student life, athletics, and academics are one of a kind, truly."
Niche User,5,I love the atmosphere at the school. You can tell that everyone there is happy with where they are and the people that are there. It is such a loving community!
Niche User,5,"the University of Virginia is a beautiful school with warm, welcoming staff that have been welcoming to answer any questions regarding the application process."
Sophomore,5,"My first year at UVa was really difficult because I felt like I wasn't the typically successful first-year student. There were so many resources, new things that I felt obligated to try, and it was just very overwhelming. But as I continued attending the university, doing my best to learn not for the sake of getting good grades, but for the sake of learning and getting my money's worth. And I found that my experience was so much more rewarding as I naturally found my niche of volunteering, opportunities, activities etc. that just enhanced my college experience. I thoroughly enjoy how the professors here care so much about their students and about education, and that most students here are the same and enjoy working hard."
Niche User,5,"When I visited UVA's campus, I was fascinated by how polite both the students and teachers were. Although it was far from my house, I felt like it could be my home."
Junior,5,"The employees are so nice and everything is clean and productive! Definitely love it here! Our classrooms are simple with the right amount of tech. The professors get stuff done in a timely manner and aren't too hard on students. The courses are challenging and prepare us for the real working world. Personally, I am premed and the counselors have done a great job of preparing me for medical school apps."
Alum,5,"My time at the University of Virginia was fantastic overall. Looking back after graduation, it is even more of a unique, inspiring, exciting, welcoming, and positively challenging university than I had previously thought."
Niche User,5,It is an amazing campus with honestly great people there who are always willing to help you in anything you need. Anywhere you look around campus or off campus there is a place to eat or a spot to be with friends.
Junior,5,"Dining at UVA is convenient and diverse in options! The staff is so kind, and the food is always available and delicious. There are many meal plan options for everyone to choose from. Meal exchanges can be used to get meals from places like Chick Fil A and Subway on grounds! We also have plus dollars that are easy to use at any restaurants on grounds! I always enjoy eating in grounds before and after classes!"
Sophomore,5,Love the architecture! The old buildings make it feel homey while the student body are incredibly spirited and motivated. Great work and social life balance.
Sophomore,5,"Thus far, my experience at the University of Virginia has been excellent. The meal plan has been great for me. Since I live on grounds, but have an apartment-style dorm, the smallest meal plan has been perfect for me. In addition, I love having the plus dollars option for meals as well."
Junior,5,"It has been an amazing home away from home! Everyone is focused not only on academics but growing as invididuals. My only critique is housing— as a first year you are not promised AC, and hopefully that will change. Also some professors are too focused on their research rather than their classrooms. The local food scene is great, and Dinning makes sure to support local farmers and promote sustainability!"
Graduate Student,5,Campus life is great! There’s something for everybody no matter what you’re interested in. Sustainability is great on grounds and in the dining halls.
Senior,5,"Very glad I decided to go to UVA - I’ve met my best friends here and will be sad to graduate! There have been plenty of opportunities both social and professional, and all of the faculty that I have come in contact with are extremely helpful."
Sophomore,5,The University of Virginia is a wonderful place for people to study! They have the ability to participate in such a wide variety of classes and activities in a vibrant community and with the support of some of the nation's best professors. Students have nearly endless resources at their disposal and are able to learn in such a unique environment so closely connected to the local community and the history of the area.
Senior,5,"I love having so many different options with my meal plan by using plus dollars, meal exchange, and residential dining halls. It's great to be able to have options and get to eat Chick Fil A, smoothie bowls, and salads with my meal plan."
Junior,5,University of Virginia is an amazing school with a great dining program!!!! The atmosphere is inviting and encourages conversation! It’s a great place to sit and hang with your friends too!!!
Junior,5,UVA is a great school and my time here has been very formative! The food is great and they are a variety of options for everyone to find something they love!!
Junior,5,The food at the university of Virginia is very good. The party scene is also very fun. The academics are great.
Niche User,5,Not an official student there yet but visiting the campus and touring the university was a great experience. There are a variety of activities and things to do and it seemed as if everyone there cared about each student personally and were willing to help. The campus itself was nice and felt like a place I could see myself in.
Niche User,5,"Our son is a ""First Year"" student. He arrived to UVA independent of his parents for move in day. Because the university is so organized he was able to get moved in and immediately had activities to attend with new friends."
Graduate Student,5,"I absolutely love UVA. Grounds is gorgeous, both the students and the faculty/staff are incredibly friendly and interesting people. Chancellorsville is a vibrant small town with an incredibly accessible downtown.  On top of all that, the quality of education is top notch."
Sophomore,5,Uva is home. Charlottesville is the best community. You won't find a better balance between academics and social scene.
Freshman,5,"Although I haven't started classes at UVA, all the events thus far and my experience with the university has been nothing short of amazing. UVA has been my dream school since a child but I always felt that even though I was accepted I was out of my league. But after attending Days on the Lawn and Orientation I never felt more at home in many aspects including: academics, diversity and culture, extracurriculars, research and athletics."
Sophomore,5,"I just finished my first year at the University, which is a 10-hour drive from home. I was far away and unable to go home on weekends. I was very homesick, missing the comfort of my family and friends, leaving me unsure of my place. But, I quickly came to love the school. My old, unrenovated dorm without AC forced us to keep our doors open and welcoming, creating lasting friendships. By December, I was yearning to go home. But during Winter Break I realized something: I missed UVa, and the home it had become. Second semester, my friendships flourished. The courses I took were challenging and specialized to my interests. As well, the community came together to cheer on the men's basketball team for the NCAA championship. The communal, overwhelmingly pure school pride and excitement is of which I cannot describe nor ever forget. UVa has nurtured me to be a stronger person, and I will forever be thankful for this school."
Junior,5,UVA staffs and faculties are nice and helpful. They're always there to answer your concerns. The way they communicate with students is really friendly. I'm also proud to be a Wahoo.
Sophomore,5,Picked UVA over Vanderbilt and couldn't be happier with my decision. Student life here is amazing for an unbeatable price.
Junior,5,"I liked the curriculum and what was going to be offered, I felt this would provide the broad foundation she needed—in topics that included organizational management, policy, and budgeting—to become a more well-rounded public servant. The program has fulfilled my expectations, thanks in part to the professionalism and expertise of the faculty. The instructors are extremely knowledgeable and dedicated to making sure that students get the most out of the courses they teach. Thanks to the program, I feel more confident pursuing positions of more responsibility knowing that I can meet the challenge."
Sophomore,4,I love the Charlottesville area! I especially love the people at UVA. The professors are also usually pretty great.
Freshman,4,UVA is a great school. I have really enjoyed being a part of the Undergraduate student body so far. They are very inviting and inclusive towards everyone.
Junior,4,"It obviously isn't ideal to be learning online and would much prefer in-person classes, but I can see that my professors are trying their best to help us learn regardless. I am lucky in that my courses are less hands-on and more knowledge-based-- I don't know I'd rate the experience as positively if I had, say, a lab online."
Graduate Student,4,"While some classes have been online due to the pandemic, our faculty and classmates have worked hard to make it feel like an in-person experience. We haven't encountered too many obstacles with using Zoom for lectures and the presentations we have had."
Freshman,4,"The communication is great, however, it could be faster. I understand this is unprecidented times and the response so far has been great."
Alum,4,"I spent my graduating semester of 2020 online due to COVID-19. Because we had just gotten back from Spring Break and went straight into online classes, the teachers had no training on how to run classes without a classroom of kids. I felt that it was a quick adjustment, but it was my best academic semester. Teachers were understanding and fair given technological issues, WiFi issues, and the fear of 2020. I felt a lack of desire to work extra hard as I graduated online, but looking back, the education they provided was almost as good as in the classroom."
Freshman,4,"I love the university of Virginia. The vast amount of opportunities that the university offers for all students is amazing. the Campus is beautiful and peaceful, it truly feels like you are in a place completely different from reality. The amount classes and class variety that is available for students is amazing as well. Even though I would prefer a much more diverse university, the student crowd is incredible and extremely nice. Overall, the University of Virginia is an amazing College."
Freshman,4,"Online classes at the University of Virginia are not that much different from in person classes. Online classes still provide the same great learning experience, as if you were in class. Assignments are easy to do, and asking your professor for help and assistance is made to be very flexible. Online classes makes everything so simple."
Junior,4,"The University of Virginia is a wonderful institution with a wide variety of options in terms of academics, social life, extracurricular activities, and jobs. However, it is a predominantly white University that has failed to address several aspects of its Grounds and buildings affiliated with racist historical figures. It also has a history of poorly addressing sexual assault cases and rape culture on Grounds. It is also incredibly expensive and has not provided many students with the funding they truly need, especially in this pandemic. They did not provide student refunds for tuition or student fees, nor will they be doing so this upcoming Fall 2020 semester, and have not been understanding of the financial struggles that students and their families have had to endure throughout the past several months. Their president makes almost $1 million annually, if not more, and has not assisted his students in their struggles these past few months."
Senior,4,"I thought that online courses were normally no different from the average lecture-based courses taken on grounds at the university. In response to the COVID-19 outbreak, online learning became a necessity. In these times, lecture based courses remained similar, and professors managed to answer their students' questions as well. Smaller classes however that required small group work were difficult. Overall, online learning experiences at the University of Virginia are mostly similar to in-person learning."
Senior,4,"So far, my experience at the University of Virginia has been a challenge. Following high school, I was definitely unprepared for the work load and amount of studying that each individual class required of me. However, after 3 years of experience, I have learned new tactics on how to study, and I have seen improvements on my exam grades from the beginning. This university is incredibly challenging, but provides its students with an incredible college experience, prepares them for the future, and ultimately gets its students degrees that will help them thrive in their careers."
Junior,4,"During covid-19, I took all of my classes online. They went better than expected, and since I am a government major, not much was changed in terms of assignments. However, I feel like being so removed from classmates and the teacher makes it more challenging to motivate yourself and stay focused."
Sophomore,4,"Definition of work hard, play hard. Don't believe the stereotype that all students at UVA are preppy and rich, because this definitely is not true. It is a big enough school that no matter what you are like or are interested in, you will find people who are like you. Most people are accepting of different beliefs. That being said, UVA needs to improve its diversity in acceptances, as they are not representative of the diversity of the state."
Sophomore,4,"My online experience after the transition due to COVID-19 was difficult, yet manageable. UVA faculty and professors made the online experience convenient as possible while providing reliable access to resources, lectures, labs, etc."
Sophomore,4,"The university's school spirit is unmatched. I love the feeling of togetherness stimulated by healthy competition, dedication, and great academics at this school. There is always something to do for everyone."
Sophomore,4,"UVA is a great school for pursuing your educational and career interests. But more than this, it gives you a great holistic experience of what it means to be a college student. It challenges you academically, but also allows you have other experiences as a student, such as meeting faculty, peers, friends, and clubs."
Sophomore,4,I have enjoyed my time at UVA. I found that taking time to get involved with student life and clubs was beneficial because I had time to settle in and find my footing. I found a core group of friends that have greatly affected my time at the university.
Alum,4,"I loved how there was always opportunities to get involved. The spirit of student self-governance is really emphasized. UVA is in a great location with lots of opportunities to get involved with the Charlottesville community as well. It can of course be quite stressful as there is a culture of competition. However overall, it is a great school."
